comment,SEJ_label,PEJ_label,MRJ_label
여윽시 불법대금송금 당사자답다. 본인이 잘못한 걸 죽을 때까지 인정 안 하려고 나라를 말아먹네. 이런 게 매국노다.,1,1,1
정상인이 조폭과 협상시 헙박은 더큰 폭력을 부늘 수도 있는데..!,0,1,1
니가 판단할 일 아니다..  좌꼴 벌갱이 졸라야!!,1,1,1
여러분 나이먹으면 곱게 늙어야 해요. 참 보기가 추하네요.,1,1,1
919는 북한이 이미 폐기했다. 박지원이는 북한 간첩노릇하고 있음을 스스로 입증함,1,1,1
늙은 여우야 이제 굴 안으로 들어 가있어라~`하는 짓 마다 모사 꾼.,1,1,1
그냥봐도간첩 저런게국회의원에국정원정보북에다넘겼겠지?,1,1,1
윤석열 김정은. 김주애. 똥 오줌이나 먹어라 북한보다. 딸리는 대한민국  대한민국 안보 군사  정부 최악 이다,1,1,1
우리는 도덕적 우월성이 있습니다. 왜 비이성적이고 비논리적이고 비상식적인 집단의 수괴와 동일하게 행동하는지?,1,1,1
박지원 너가 대통령하지 뭐햇노 늙어주책 떨기는,1,1,1
"21% 드는 희안한 인간들이 경향에 죽치고 있네...조.중,동으로 가거라",1,1,1
전쟁을 방지하는 정책을 없애다니 진짜 무개념,1,1,1
저인간. 아직도  안갔나,1,1,0
이또한 지 기분대로 아무생각없이 파기했네~~훗날 넌 ~ㅋㅋ 이게 군사적으로 대북안보 상황이 어떤것인지 알지도못한놈~34년전 남북 대치로 돌아가는것이다,1,1,1
머라는 🐕 소리야  그럼 당신말대로 북쪽이 우리재산폭파시키고 해도 읍소 해야하냐,1,1,1
역대 국정원장중 가장 날나리로 대충 해먹은 한 사람 중에 하나,0,1,1
전직 가발장수가  더  어울리는거 아녀?  꼭  어설픈  국정  거시기  달아야  겄어?,1,1,1
윤석열이가 유일하게 잘한일,0,0,0
문재인이 가장 잘못한게 아니고?,0,0,1
이넘이 국회의원이라니  ?  북한 오물 풍선이  너 집안방과 너 머리 위에   떨어져라 ㅜㅜ,1,1,1
그런게 통할 북한이라 소대가리소리듣고 똥물맞냐진즉 박근혜때처럼 밀어붙였어야지,1,1,1
"보수도, 우파도 아닌 조작전문 깡패검사가 기소권으로 정권을 강탈하더니 참 어렵게 놀고 있다~~~",1,1,1
나라의 안위를 안인하게 보는 자들의 나태함인가?,0,1,1
할배가 못했다하는거보니  윤통이  굉장히  잘한거네요.,0,1,1
대중이 김정일이한테 상납한 자금 땜시 빵간  넘이 국정원장 했던 게 개그여~~  쩝쩝이가 시켜주니 충성 맹세나 하고... ㅋㅋㅋ,1,1,1
이런 작자가 정치를 5류로 만드는 일등공신,1,1,1
북한은 공격중인데 우리는 준비도 하지말라는 거임.,0,1,1
박지원 김정은 추종인물이네,1,1,1
에라이 ~~~  말같지 않은 개소리 하고 자빠졌네 !,1,1,1
"하여간 내로남불 입벌구에  맛난거와 술이나 챙기지, 안보 민생 경제 외교 청년 뭐 하나 제대로 하는게 없어",1,1,1
웃기고 자빠졌다 제일 잘한 치적이다,0,1,1
좌파들 퍼주기나 했지.. 뭔 대응은 있었냐?,1,1,1
역시 휠체어 송금의  박지원 슨상,0,1,1
제일 찰산일중 하나인듯,0,0,0
지원이 X 싸고 XX 전네잉,1,1,1
저 사람 반대로 생각하면 정답이죠 ㅋㅋ,0,0,1
"그 입 다물라 ᆢ
니집에 도둑이들어와도 괸찬은지 ᆢ",1,1,1
어머..........   우리의 개눈까리 마음 아프겠다.  정은님 심기상하는 일이 있을때마다 거품을 물고 오살을 부리는 인사인데  오죽할까.,1,1,1
도발은 그에 상응하는 조치로 대응하면 되지 왜 상대방 목에 가시인 협약을 먼저 파기하는지 모르겠음.,0,0,1
다수의 국민들은 긴장고조 보다는 안정된 평화유지를 바란다.  본인의 인기유지를 위하여 국민들을 희생시키지 말기를 바란다.,0,0,1
이슈는 이슈로 덮는다!....정치인들의 경구아닌가....당신들이 맨날 하는거 그거 용산도 하는거여~~.....그 이하 그 이상도 아님.,0,0,1
어찌 이것뿐이겠니?모든게 잘못되가고 있는데 차라리 잘한게 있는지 찾아봐라 없소이다ㆍ,1,1,1
저런 사람을  국정원장 시켜준 사람부터 참,1,1,0
국정원장 출신이 저모양이니 얼마나 많은 국내 기밀과 기술이 북으로 넘어갔을까.,1,1,1
넌 종북주의자지  북에서 쳐 내려 오는데 가만히 앉아서 학맞을거냐? 늙어서 상황판단 안되는데 국회의원은   어찌 할래  반납해라,1,1,1
"북이 파기혔다는데,  딱한 아저씨야~~??  그냥 엎드려있으면 되는거잉~~??",0,1,1
윤통 전쟁일으켜 놓고 일본으로 망명하려고 하나?,1,1,1
국개 빨강이 첩자들 추려내 처형하라,1,1,1
국정원장했답니다.  고양이?  생선!  문재인께서 국정원장에 임명해다네요. 이게 정사입니까?,0,1,1
박씨아저씨~~ 답답혀요. 지켜주세요하며. 용돈주고 지낸세월이 그리워요. 더 이상 혀가지고 세상 우롱하지말았으면,1,1,1
"이 🐕는 개소리를할려면북쪽에다 먼저. 처해야지
그것들이 먼저파기한다고 떠들었는데
이제는 귀까지  닫았어.",1,1,1
미친 모사꾼 할배. 왜 이리 오래사는지. 나쁜놈들이 더 오래 사는 이 세상. 정녕 신은 존재 하는것은가?,1,1,1
강자 한국이 북한 약자에 꿇리는격.,0,1,1
박지원과 문제인은  3급국가기밀을 북한에 넘겨준국보법 사형깜들이다,1,1,1
이노마는 빨리 미국으로 추방하라.,1,1,1
이제 선제타격의 조건이 무르익었으니 그 선제타격 좀 봅시다,0,1,1
박지원 같은 인간 국정원장 시킨 인간은 정말이지 총살감 맞는듯,1,1,1
노무현이 말했지 한국엔 미국을 미국인들보다 더 사랑하는 사람들이 많다고 웃긴건 북한을 한국보다 더 존경하고 따르고 사랑하는 인간들도 아주 많다는것,0,1,1
간첩이 대놓고 판으 치는 세상,0,1,1
왜 이것들은 중공공산당이나 북괴만 보면 설설 기는지 모르겠네. 피가 공산당이라 그런건가? 알아서 기는거 보면 졸라 재수없어.,1,1,1
당신은 통일부장관 하면서 북한에 현대아산돈 갔다 퍼준게 제일 잘한거지 그래서 현대그륩 정몽헌회장 자살하게 만든게.,0,1,1
헛소리 하지말고 그냥 북한으로 이민가라 정은이가 오만짓 다해도 가만히 있어라소리네 이런 인간들이 있으니 나라가 이꼬라지지.,1,1,1
약속은 서로간에 지켜야지 북한쪽에서 먼저 폐기한다고 선언했는데 우리만 지키라는 야그여?? 이런사람을 국회의원으로 뽑아주었으니 진짜ㅠ,1,1,1
앞에 있음 목을 베고 싶다.  국론 분열시키지 말고 빨리 이승을 떠나라.,1,1,1
북괴는 안 지는데 우리가 왜 지키냐? 북괴대변인이냐?,1,1,1
사나이는.부끄러운행동은.자중자애해야한다.더구나.연로하신.의원님들,0,0,1
이런 여우를 국정원장에 앉힌 문통이 문제였지 어찌 이런 인간 정치판에서 끝까지 봐야 하는고,1,1,1
🐕 누깔  헛소리 하지 말거라,1,1,1
"이노마의 말이 무슨의미있겠노.그냥 북으로 가지 왜 여기사노...
참 답답한 양반이네",1,1,1
이미 있지도 않은 합의를 있다고 우기는 자가 국정원장이었나?  미친 나라였구나.,1,1,1
젤 잘한것 같은데? 내 생각이랑 정 반대네?,0,0,1
"대한민국의 잘못...지워니, 잼병이,  조구기, 죄이니...여기에 살게한 것...푸하하 🤣",1,1,1
박지원~~~개XX 내가 보기엔 윤대통령 집권시 가장 잘한 이로 보이는데~~~~,1,1,1
"역겹다,,보수의  전쟁놀이,,,",1,1,1
간첩질 하거는?ㅋㅋ니놈도 무사치 못할텐데?ㅋㅋ,1,1,1
인간아 북한가서 정치를 하던지 막노동을  하던지 하라,1,1,1
눈이 한쪽이라 판단도 흐리냐?  저런인간이 국정원장까지 했으니 나라 꼬라지가 이렇지,1,1,1
종뷱 전라도 출신 민주당은 역시 김정은의 졸개인 모양,1,1,1
"북한이 그리 좋으면가라!제발가!!!!문재인,이재명과",1,1,1
북한은 지키지도 않는데 우리가 왜 지키냐?북한대변인이냐?,1,1,1
당신이 아직 안죽은게 신의 잘못한선택인가 그럼?,0,1,1
대통령 한번 잘못 뽑아 나라가 엉망진창으로 흘러가네.,1,1,1
그래 뼈속까지 북괴간첩집안출신인 니가 가장잘한일중에 하나니까 그렇지,1,1,1
빨강이 박지원  니가  할  소리는  아니지  ~   너는 북괴로 꺼져야 한다.  너는 자타가 공인하는 빨강이 아니더냐  ?,1,1,1
때로는 강한 면모가 전쟁 위협 감소!,0,0,0
"북한놈들에게 계속 놀아나며, 끌려 다닐건가.........................",1,1,1
기자가 글을 못쓰는거냐 쟤가 말을 못하는거냐 뭔소리하는거냐,1,1,1
지지율이 바닥이라 정책도 바닥치고 나라를 위험에자빠트리는 것뿐이네요 탄핵만이 답인듯,1,1,1
관리는 뭔관리 북한이 쓰레기 오물 보내는데 당하고만 있으라는거냐 좌파시키덜 모조리 감방 처넣어야한다~,1,1,1
우리는 이들을 간첩으로 본다  전쟁이 두려우니 차라리 항복하면 편하지 않느냐는 이야기인데ᆢ 의새들 하고 능력껏 대한민국을 떠나면 된다,1,1,1
남남 갈등의 주범은 더듬당이지.,1,1,0
좌익종북들 다잡아들여서  정은이 한테  선물로주자.노예로 쓰라고 .,1,1,1
핵무기를 보유해야한다...북한놈들도 있는데 균형이 안맞는다.,1,1,1
트럼프 한국을 무방비로 두진않을것...다만 많은 돈을 요구 할것이다,0,0,0
트럼프는 하는 행동이 소시오패스인듯 우방에 대한 배려가 전혀 없는 독불장군이지요.,1,1,1
트럼프가 당선되면 방위비 엄청 올리겠지 ㅋㅋ,0,0,1
이런 추측기사 그만 내보내라. 이 사람들은 그저 주변인일 뿐이다. 한국이 언제부터 이런 자들의말에 일희일비하게 되었나.,0,1,1
다 필요없고 우리나라 자체 핵무장 승인이라 하라구 ㅋㅋ,0,1,1
그냥 철수하고 핵만 풀어줘~,0,0,1
미국이 동아시아에서의 미국의 이해를 위해 중국과 북한을 견제하고자 한다면 한국에 방위비 부담 증가가 아니라 더 많은 경제적 군사적 지원을 해야 할것이다.,0,0,1
"한국인을 반미 쪽으로 몰지마라 !   우리 안보가 중요치 않다면 간섭도 말고,  핵 무장도 반대 마라 !",0,1,1
미국도 온전하게 믿을 건 못돼.핵전쟁 나면 미국은 뒤로 물러설 것.미국말 믿지말고 자주국방해야 하고 핵개발도 준비해야 한다.,0,1,1
전라도 는  좋겠다  트럼프가 주한미군 철수 시킨다니   ... 잘살아야 한다,1,1,1
2023 주한미군에대한 한국분담금 1조 3463억원,0,0,0
미국 필요없고 핵 보유가 답이다,0,1,1
트럼프는 방위비 터무니없는 인상 지랫대로 쓰겠다는거다.,0,0,1
그냥 우리가 핵무장 할테니 닥쳐 주한미군으로 삥 뜯는 깡패 놈들한테 의지 할 수 없다핵무장만이 답이다,1,1,1
미국. 돈좀주세요...제뱔.!,0,1,1
방관은 않을 터이니 핵무기에 버금가는 돈을 많이 많이 내라 GO   Dog  Sound,1,1,1
"핵무기 보유 조건으로 미군 철수 한다면 , 오케바리 땡큐 럼프형.",0,1,1
우리나라는 이미 핵기술 보유국이다. 단지 핵을 보유하는데는 6개월이라는 시간만 필요할 뿐이다. 트럼프 당선될 턱이 없지만 당선되면 핵보유국되면 그뿐이다.,0,0,1
모든 나라가 국익이 우선으로 움직인다   상대가 있으니 절충과 타협만이 있을 뿐이다,0,0,1
오히려 전쟁터로 만들어서 무기 팔아먹으려고 하려는건가?,0,1,1
그래 정말 인계철선처럼 조금만 남기고 데려가라.. 돈이 없다.,0,1,0
"""한국이 핵포함해 자주국방 능력이 없는 한, 경제적 부귀는 한순간에 무너진다""는 사실은 왜 말 안하냐!  우크라가 답!",0,1,1
구라치지 마라. 뭐 방위비 10배를 달라고? 그딴 식으로 가스라이팅 할 거면 방 빼라 양키고홈이다,1,1,1
"트럼프 노예 나라냐?  돈만 갔다 바치게 ,,,,  지금도 엄청난 돈을 요구하는 판에 ,,,, 이럴수록 자주국방하고 자체 전술 핵 보유를  해야 한다",1,1,1
안 지켜줘도 되는데~ 예전부터 핵무장하고 자주국방하려했었는데 중러 눈치보면서 막았으면서~ 이젠 우리 스스로 지켜나가야 함~ 주변국에 끌려다닐 때가 아님~,0,0,1
댓글봐라. 언론에 세뇌된 개돼지를 너무 많다. 진실은 개나 줘버린 것들.,1,1,1
다 개소리고 핵무기 몇개 만들고 미군 꺼지라 해라.,1,1,1
주한미군 감축하면 대만에 주둔시키고 방위비 분단금 삭감하자,0,1,1
심리적 동맹으로 대해줄테니 돈은내라 이건가?,0,1,0
주한미군 철수가 북진임,0,1,0
베트남전 작전통제권이 미국에있을땐 한국군은 꼭두각시였다.. 그러나 통제권이  한국군에 왔을텐 그누구도 한국을 막지 못했다..,0,1,1
그냥 니들은 일본에만 상주하셈...우리국토에서는 나가고 그냥 무기만 살께... 작전권 넘기고...그리고 우린 핵을 보유하면 돼,1,1,1
한국에 빼먹을게 있다는 발언임.,0,1,1
무방비로는 안두는데 길들여질때까지 방위비 올린다는거야?,0,0,0
미국만 믿는 가장 멍청한 민족 남한민족,1,1,1
2찍 개돼지들은 계속 핵무장 주장 하는데 핵무장 포기 각서에 싸인한게 굥두창이야ㅋㅋ,1,1,1
까고 자빠졌네. 니들이 그런다고 핵개발을 용인할것도 아니면서.,1,1,1
이승만이 한 말~  속지말자  소련 ㆍ 일어난다 일본 ㆍ믿지말자 미국ㆍ 딱ㅡ 맞는 말이었네,0,1,1
미군 철수하고 한국 핵무장 막지 마라.,0,1,1
장사하겠지~ 이걸 모르는 사람이 있겠냐?,0,0,1
그노므  돈돈 외치는 또럼뿌 당선되면 무조건 핵보유해야한다,1,1,1
또라이 트럼프보다 바이든이 우리에게 유리하다,1,1,1
트럼프는 믿지를 못하겠다,0,0,0
그거어떠케 믿냐 순간 내키는대로 말하는 트프......,0,1,0
"한국의 특수성을 고려하여핵""추진을 인정해줘야한다.
핵에는 핵으로
그렇게 해야 北쪽이  STOP.!",0,1,1
어쨌든 방위비 안 올려주면 미군 수를 줄이겠다는 거잖아? 말 돌려하는것이 꼭 누구랑 같네,1,1,0
니 맘대로 되냐? 쫄았네,1,1,1
철수해라.니들이떠나야 한국이  더 강해진다.니들도 알고있겠지.,1,1,1
트럼프가 요구할 수준의 금액이면 1년마다 핵잠3척씩 건조 가능 우리도 중국처럼 붕어빵찍을수 있다,1,1,1
ㅋ니들이 아무 이득없이 한국에 군대.주둔 시켰냐 ㅋㄱㅋㅋ꺼지라고 해도.있을 것들이,1,1,1
할배들 이래도 성조기 들고 다닐거?,1,1,0
우리만 지키던 군사합의 필요없다 북한놈들과 약속따위를 했다는게 우습다 저런놈들과는 말도 섞지 말아야함,1,1,1
완충지대? 의미없는 실호성없는 완충지대는 걷어내야지  애초에 필요없는걸 문죄인이 그냥 북에게 국경을 열어준 조치였다,1,1,1
단호하게 박살 내야됩니다 문재인이 인간 북한에 남북연락사무소가 폭파했을때도 말한마다못한인간이 대통령이랐던것이 챙피하다,1,1,1
확성기가 답이다. 더 이상 기다리지 말고 확성기📣틀어라...,0,0,1
누가먼저 공격해도 이상할께 없겠네,0,1,0
"정치적 위기를 덮으려고, 끝내 남북 무력 충돌로 가는 건 아니겠지?",0,0,1
북한 문제에는 개딸들 아가리에선 아무말도 하지않는다,1,1,1
군에 가족을 보낸 가족들 심정을 니가 아냐?,0,0,1
나라를개박살내려고 환장을햇네  너하나죽는건 몰라도국민목숨 가지고 게임하자는거냐,1,1,1
ㅋㅋㅋㅋㅋ역시 떨어진 지지율에는 북한이용 딱이야 ㅋㅋㅋㅋㅋㅋ,1,1,1
북한 무인기 넘어온거는요?,0,0,0
대북전단 살포때 더불어김정은당 국케 놈들도 넣어서 보내면 좋겠습니다.,1,1,1
"우리의소원은 통일!!
그래서 난 국힘당을 싫어함!",0,0,0
이제 아주 간첩들이 대놓고 활개치는 구나.,1,1,1
정부조직이와해되고있다 총리는사임하고제대로정부조직을장악할수있는실세총리임명하라,0,1,1
이래서 한국 주식은 사면 안됨;,0,0,1
미군 없으면 북한과 싸워 이길수없다던데 큰일이다. 최신식무기뭐하냐고,0,1,0
젊은이들이여 이 나라를 위해 피를 받쳐라! 너희들의 피가 민주주의의 발전에 거름이 될것이다,1,1,1
서북도서 주민들 살 맛 나겠다. 안그래도 불안에 떨며 사는데 포탄 값이라도 아껴 지원해 주던지 방공호 시설이나 제대로 갖춰 주거라.,0,1,1
이제는 통일도 필요없어 언제까지 통일이라는 단어만 쓸건데 ㅡㅡ 교과서에 통일도 없애버리자,0,1,1
저거  철거  한다고  특별한  의미가  있나?  어짜피  북한이  운행  반대하면  넘어 가지도 못하는건데..,0,1,1
...더듬어노동당.    더불어공산당.   화이팅. !!!!!!!!!!!!!   !!!!!!!!!!,1,1,1
"대한민국에 다시는  김구, 김대중. 노무현, 문재인 같은 인간이 절치하는 일이 없기를 .",0,1,1
"양산개집에 찡긴!!!덜삶은소대갈 문재앙놈 !!!이빨도 !!!죄다 뽑아버려야 한다 !!! usb하나만
밝혀지면 !!! 가스처형이다",1,1,1
동아일보 채널A 구독 취소들 합시다 소수 여당이면 파렴치한 야당에 줄서고 기회주의자 얼치기 보수언론 입니다,1,1,1
살문 소대가리 냉면 이모구녕으로 넘어가냐 usb,1,1,1
폭탄이나 실어서 북으로 보내라,1,1,1
근데 남북연락사무소랑 개성공단 보상은 받았냐?! 더불당아?!,0,1,1
다 썩은 선로라 어차피 못쓰는거 뽑은거 아니냐 ㅋㅋㅋㅋㅋ 가게 되면 새로 박아놓것지 그게 문제여?,0,1,1
세금낭비 평화 위장쇼재앙이 핵대중의 작품,1,1,1
배고플텐데 일을 만들어서 하네 ㅋㅋㅋㅋ,0,0,1
비싼돈들여 만드거 구지 왜?,0,0,0
ㅋㅋㅋㅋ 세금들여 꾸역꾸역 건설하더니 ㅋㅋㅋㅋ,1,1,1
다시는 이런 물건들과 상종하지 말아라. 전라도 것들과 북한 것들은 늘 결과가 이러하다.,1,1,1
문재인은 꼭 이럴때 입꾹닫 하더라?,1,1,1
저딴걸 설마 돈주고 만들어준건 아니지?,1,1,1
"문재인이 5년동안,  북한에 쳐바른 돈은 얼마나될까?",1,1,1
문재인이 개수작했다는 걸 증명해주네.삶은 소대가리.,1,1,1
어 그래 잘났다. 객기부리면  우쭈쭈 해줄 이  누구 들으란건가,0,1,1
다시는 저것들 지원 좀 해주지 마라 자꾸 갖다 바치다가 안주니까 발악을 하네  전정권이 얼마나 퍼줬으면 안준다고 저렇게 생떼를 부릴까,1,1,1
누가 손핼까? 하옇튼 도ㄹㅇ들!,1,1,0
철로를 뽑거나 말거나  ㅋㅋㅋㅋㅋ   먼지만큼도  관심 없당,1,0,1
서로 다른 국가를 연결하는 철로는 통일되고 설치해도 늦지않다. 그 동안 너무 퍼줬다,0,0,0
이게 다 윤석열정부의 막무가내 대북정책으로 인한 피해죠,0,1,1
돈얼마나없으면 철거해서 중국 고물상에 갖다팔것노,1,1,1
"가엾고 안타깝게만 보는 북한  주민들은 결국 봉기하지 않았다. 그리하여 수복해야 할 땅, 배척해야 할 민족이다.",0,1,1
그냥 이제 다른국가로 지내야된다 국경세우고,0,1,0
북한은 개성공단은 필요하니까 남의 공장을 허락없이 무단으로 잘도사용하면서  자존심 에 괜히 쇼하지말고!,1,1,1
우리는 사용을 할 일도 없다. 북한이 필요 했던 철로인데 철거는 잘했다.,0,0,1
"저런 것들을 믿고 해안철책 제거하고 GP 영구적으로 파괴하고 한강 하류 공동측량하고, 탈북자 송환하고, 귤박스, USB 탈탈 털어야함",1,1,1
누가 돈 보태줬냐 또 북한짝사랑하는 대통령 당선되면 돈 주고 뭐 만들고 부수고 반복하겠지,1,1,1
자칭 백두혈통 씨돼지는 겉은 넓고 퉁퉁해도 속좁은놈은 세상에 니만한놈 없을꺼다,1,1,1
문죄인 씨는 국가세금 이런데다 쓰고도 장난척... ㅉㅉ,1,1,1
에휴 간첩 문재앙이 쓸데없는 짓거리로 세금만 날렸네.,1,1,1
신의도 의리도 없는 집단과 더이상 거래하지 말라. 뭐주고 빰 얻어맞는 다블 벌거이당 것들아!,1,1,1
돈이나갚고 치우든가 말던가,0,1,0
윤가놈이 북으로 부터 단단히 미운털이 박혔구나 이제 우리 민족을 어찌한단 말인가 이제 무슨 면목으로 우리 선조들을 뵙는다는 말인가,1,1,1
누가 북한에  KTX지을려하지않았나??? 아물론 돈은 우리나라가 내잖아 ㅋㅋㅋㄱ,0,1,1
그러던지말든지  니들한테 갈일도 니들이 올일도없다 그냥제발 따로살자!!,1,1,1
나쁜 0들 근데 그 철도 대한민국 거 아니면 북한 거? 우리 건데 마음대로 철거 했음 정말 나쁜 x 지들거면 뭐 비난할 일은 아닌 듯,1,1,1
그러고보면 북한이 부동산 입지는 좋아 유럽까지 이어지고,0,0,1
북한 하고는 완전 빠이빠이   하자.,1,1,1
헤어져서 이혼했으면 각자 잘 살면되지~각자 인생 살자~아직도남북타령이야,0,0,1
많이는 못뽑았네 혹시라도 이재명이가 되면 또 깔아야 되니까,1,1,1
해달라는거 다해주고 뺏기고.돈지c 좀 고만해라. .  저런것들이랑 대화?,1,1,1
정은이랑 개쌩쇼한다고 참 큰일했다 ㅋㅋ,1,1,1
저런인간들하고 무슨대화냐정신짜려라 더불당,1,1,1
그침목 빼서 어디다 쓸려고,0,0,0
김대중 노무현 찍은 사람은 앞으로 투표하지마라 너네 때문에 북한에 수십조 퍼줘서 북한이 핵혀박한다,1,1,1
이것들도 한글 쓴다는게 넘 부끄럽다.,1,1,1
저거 김미화가 감투 썼던거 그거 아닌가,1,0,0
"일진 애들이 삥 뜯으려고 깔짝거리는 느낌이 드네요. 유치하고, 저급한 것들.",1,1,1
이런데도 문죄앙이는 쏘련 천연가스가 북괴통해 들어올수있다고 하는인간이였지.  어떻게 일국의 대통령했던 작자의 생각이 북괴 김정은하고 똑같니??  ㅉㅉ,1,1,1
시베리아 철도가 결국 무산되는건가. 기차타고 유럽 가면 진짜 좋으려만. 아쉽다.,0,0,0
북한 땅에 있으니 북한 맘대로 할 수 있는거지 토착왜구들 또 애쓴다,1,1,1
북한 노동당을 멸망시키고 우리가 직접 들어가서 만들면 더ㅣ는데 뭔 호들갑이야,1,1,1
문재인 평화쇼 사기...,1,1,1
민주당이 수십조씩 열심히 퍼줘서 공사해놓으면 북한이 당연하다는듯이 부수고 내다버리네 주종관계의 속국이냐?,1,1,1
나무로 만든  거라면  불 땔려고? ㅡ 저런 집단이  우상인 자들의 집합체가 있지.,1,1,1
림종석과 리짜이밍이 해결합니다,0,0,1
지구에서 제일 싫은 족속들… 다시는 저것들한테 돈 주거나 친한 척 하지 마라…,1,1,1
"안보도꽝, 경제도 꽝, 공정과 상식은 안드로메다로~",1,1,1
나이 어린 돼지라 행동하는게 유치하구먼,1,1,1
연락사무소 공개 폭파하고 철로 어작내고... 양산 🐕 버린 땜시 🐕 꼴 되야 부렀네...,1,1,1
남북관계가 좋아져야 하는데 왜 더 악화될까? 통일부의 존재가치가 의심된다..,0,0,1
ㅋㅋㅋ 재네들은 철도 안쓰나??,0,0,0
허허 !   그러면   고속도로  설치하고  자동차로  왕래하면되지  ㅡ  정치  쑈로  딴스  하나요 ?,0,0,1
오물풍선 양산에 투하하고 시체는 타지마할에 묻어주는게 어떨까요,1,1,1
"애들, 심술맞기는...철부지 생때부리고...ㅉㅉ",1,1,1
두창이 하는 꼬라지를 보면 이상할 것도 없다 당연한 조치,1,1,1
",야바위 사기꾼 몽니가 더불어 몽니당과 흡사한 수준임.  유치하고 치사하기가 딱 더불어 공산당이네.",1,1,1
다시 건설하는 것 쉽다,0,0,1
북한과 손잡은 결과가 너무 참혹하다종북좌파는 북으로 갔으면 좋겠다,1,1,1
또 좌파가 집권하면  민족타령하면서 정상회담 쑈하고. 철로 놔주고 경제지원 한다고 꼴값떨 듯.,1,1,1
남이나북이나 지구에서보면 작은영토하나일뿐인대 왜이리 서로못잡아먹어안달일까?,0,0,0
남북협력이라는 자체가 의미가 없다는것이 증명이 되었다.쓸데없이 국민들 세금으로 저런데 돈 안썼으면 좋겠다,0,1,1
서울 불바다 운운할때부터 같은 민족 아니었잖아? 뭐 새삼스레 민족타령?,1,1,1
한류가 무섭긴하네.  핵무기보다 더 강한 듯.   멈추지말고 계속 대북 전단지 보내라.,0,1,1
뭔가 극단적으로 치닫는 걸보니 북에 종말이가까워질것같은 느낌이드네!! 심리적으로여유가없다는 것이지~~,0,1,1
참 쓸데없는 짓만 골라 한다. 살만 쪄가지고.,1,1,0
돼지의 전성시대   남북한  모지리가  어찌저리  모자라냐.,1,1,1
하나라도 아쉬울 놈이 저리 나오는데 아쉬울게 없는 우리가 숙이면서까지 대화하고 지원할 이유는 없다.,0,1,1
양산 🐕 버린 이후로 완전히 우습게 보네 ~,1,1,1
국민혈세로 북에 고속철도 깔아주자는 양산개는 어딧나?,0,1,1
우리도    담쌓고   막아버려,0,1,0
대포알 만들  쇠가 모자란가 보다  ~?,0,1,0
