comment,SEJ_label,PEJ_label,MRJ_label
9.19 선언 자체가 대놓고 간첩이요 라는 증거 아닌가??? 우리 스스로 군에게 족쇄 채우는 멍청한 더불어 간첩당의 작품,1,1,1
살기도싫은데 한판붙어 한반도 소멸이나  압당겨라,1,1,1
삶은 소대가리가 앙천대소 하지못해서 울겠네!,1,1,1
그냥 선제타격을해  윤석열 응원한다.  전쟁을 해버려. 빠르게가자~~~~,0,1,1
매번 약속을 어기는 북에게 국민의 뜻도 묻지않은 합의가 무슨 소용이 있나! 이제는 제자리 잡을 때가 되었다.,0,1,1
"가짜 평화놀음으로 국민들을 기망하고, 안보의식을 흐트러 놨다, 북한 동포만 불쌍하지,,, 강력하게 대응해라",0,1,1
북한의 먼가 의도가 있었겠지..괜히 도발했을까...이런 걸 일부러 의도 했을 수도..,0,0,1
우리만 지키던 합의 따위 진작에 파기했어야 한다.,0,1,1
어차피 정권 바뀜 국짐의 누가 무슨 수로 대통령한다는거냐,0,1,1
선제타격인가? 한반도에서 또 대리전인가?,0,0,1
벌레보다 못한 것들. 지들 한것은 무시하고. 올챙이보다 못한 것들,1,1,1
문재인때 그렇게 퍼다 줬으면 공산당원들은 변한 점 들이 있어야 하는데 한가지도 성의를 보여주는것 아니 그냥 조용히 지나만  줘도 칭찬을 할 건데.,1,1,1
대북 확성기 재개 원합니다.,0,0,1
민주당과 문재앙 조국 리재앙이 말하는 평화통일 = 평화롭게 북한체제로 흡수통일 당해 대한민국 박살내고 대한민국 국민들은 북돼지의 노예로 전락.,1,1,1
뒤진지가 언젠데 ㅋㅋㅋㅋㅋㅋ,0,1,1
더불어서 이적사범 문재인을 압송해야 맞는다.,1,1,1
우리 병사들 그만괴롭혀라.,0,0,0
우리나라 빨리 공산화돼서 망해야하는데 윤석열이 자꾸 방해하네! 좌파 주사파 간첩 여러분 좀더 분발해요!,1,1,1
"폭파한 GP  신축하고  대북 확성기 방송 실시하며, 대북 전단살포하는 탈북민들에게 자금 지원하여서 전폭적인 전단살포를 하도록하라..",0,1,1
뭔 사망선고노? 잘못은 자기가 먼저해놓고 남탓하는 윤정권,1,1,1
확성기 24시간 틀어라. 그리고 우리도 삐라 살포 매주 3회씩 해라.,0,1,1
북한 선제타격은 도대체 언제 하나요?,0,0,0
그냥 북한을 선제공격해라 싹 쓸어 버려라 징글징글하다,1,1,1
이스라엘이랑 팔레스타인은 미사일 쏘고 화끈하게 싸우는데 우린 적국이 쓰레기 던지니까 말로 조지겠다는거냐? 이거 원 남 보기 창피해서..... 원..;,1,1,1
핵무기 만들고  미국 버리자는 보수것들    참 희안하지?  부국강병이 뭔지도 몰라  이런것이 이럴때는 미국을 따져,1,1,1
전쟁을 부르는구나 아주..이판사판 전쟁이나 하자 그말이냐.,0,1,1
재배치 하고 갯수 늘려라,0,0,0
북한의 대응을 기다리는 우리국민 마음은 어떤가? 북한을 혼내줄 마음과 두려움이 공존하는 짜릿함을 경험하게 될 것 같다.,0,0,1
이미 김정은이 개성공단 사무소 터뜨렸을 때 사망한 것 아니었음? 두 번 죽는 것이 가능한 일인가? ㅋㅋㅋㅋ,0,1,1
이제야 대통령이 정신을 차린 모양이다,0,0,1
???: 남조선 간나들이 돈주고 하라고 하던데요?,1,1,0
내부결속은 외부에 적을두는게 가장 확실한 방법이죠,0,0,1
누가  누구을  타나냐,0,0,0
설마 오물 풍선 안날린다고 확성기 아트는건 아니겠지?,0,0,1
한다는 것인지 하지 않는다는 것이지 정부 입장이 명확하지 않은 듯...,0,0,0
우리나라에  풍선이 넘어오기전에 레이저무기를 쏘아 북한땅에 떨어지게하라,1,1,1
현재는  밤새안녕  하십니까아   모든것  풍전등화  ㅡㅡㅡㅡㅡㅡㅡㅡ 전쟁만이  해결 가능함,0,1,1
전쟁 준비에  박차를 가할때 입니다 법사께서 말씀하신 ㅡㅡㅡㅡ 남북통일 기한이 다가옵니다,0,0,1
정은이 소기달성했네 똥주머니 정부청사옥상까지 아마용산대통령궁까지 갔을꺼야 족팔리니까 말은못하고 에라이 석열아 !,1,1,1
M모씨와 M모 방송국 오열,0,0,0
전쟁하겠다는거네. 문죄앙 거리는 것들아 전쟁나면 너희는 3일 안에 폭격맞아서 다 죽어. 잘 생각해.,1,1,1
쓰레기 정권 지지율이 낮으니 전쟁 위협으로 허물을 덮으려는가?,1,1,1
모지리 핫지부들 긁어 부스럼 만드네,1,1,1
아직도 문재인 대통령 집권중인 대한민국인사람. 댓글로 소리질러~~~~자~~ 지금 대통령은 뉴규??????????,0,1,0
여기 댓글다는 키보드워리어중... 진짜 전쟁나면 전쟁터 나갈 인원은 몇명이나 될까..,1,0,1
전쟁나면 원전많은 경상도부터 타격할낀데 우짜믄 좋노,1,1,1
문재인은 잘못했고 윤석열은 잘하고 있는겁니다.,0,0,0
2찍들 굥비어 천가 부르려 튀어 나오는 구나 ㅋㅋㅋㅋ 2찍들에겐 굥과 북쪽의 김모씨는 동급?? 인가??,1,1,1
한반도 긴장 고조시켜서 좋을 게 뭐 있냐? 무슨 실익이 있냐고? 전쟁광 튤니딱딱 칠푼이들만 신났네,1,1,1
7시 민주당 좌뻘들 공산화통일 위해 애쓰는데 어쩌누,1,1,1
현정권 매국집단이 지들이 위태로운줄은 아나보구나 또 북풍가지고 난리들 피는거 보니~ 중립외교라고는 일도 없다보니 위태위태하구만,1,1,1
관계 악화되면 헌재가 책임져야 한다.표현의 자유라니....그니깐 법조인들이  욕얻어  먹는거야...,0,1,1
"서로가 싫어하는 것  않고 살면 되는데, 가만히 있는 북한은 왜? 건드리나?
그만해라, 좀",0,0,1
돈 바치고 쓴 어이 없는 역적 행위 증명서는 그 효력이 애당초 없는 사기 행각에 놀아난 모습이지,1,1,1
도발은 석열이가 먼저 했제?,0,1,1
뭔 지지율만 떨어지면 북한 이슈가 생기냐? 둘이 짜고 치나..,0,1,1
전쟁이나믄  한국이 더 작살난다  그걸  알라나  석렬이,1,1,1
대중이 기록물 보고 싶다~~ 괴뢰군 한테. 퍼준거 기록물에. 있을려나~~재인이usb내용도~~~,1,1,1
사실상 진작에 폐기된걸~~매국노들,1,1,1
아이구 우리나라 큰일난거 아님? 농담 아니고!,0,1,1
우크라이나 => 이스라엘 => 대만 => 한국 ...빨리 이민 ㄱㄱ,1,1,1
국방력을 쇠퇴시켜 놓더니 이젠 전쟁놀이로 정책이 바뀌었냐.,1,1,1
북돼지야 아직 나이가 젊으니 그렇다치고 습진핑과 푸틴은 언제 가냐 얘네가면 숨통 좀 틔일려나...,1,1,1
정말 이놈의 윤정권 지긋지긋하다 탄핵만이 답!!!!,1,1,1
무슨 안전핀??우리쪽에서만 착각했던 가짜 안전핀 아니였나? 빨리 정신 차려서 현실을 봐야할듯!!!,0,1,1
나이많은 늙은이들이야 살만큼살았으니 겁날것없겠지만  젊은이들과 어린이들이 걱정,1,1,1
전쟁 나면 다들 알쥐? 알거쥐 되는거야~다들 기브미더초꼬렛또~ 외치며 살아야 한다~,0,1,1
병역의무도 기피한 용산 돼지가 국민의 생명을 위협하는 전쟁놀이 하자는거네.비열한 놈,1,1,1
정말 무지한 한사람으로 인해서 국민이 얼마나 불안에 떨어야 하나....한심스럽기 짝이 없다...,1,1,1
우리도 핵무장 가즈아~~!!,0,1,1
빨리 탄핵해야 나라가 산다. 근데 국짐이 저모양이니,1,1,1
흔들리는 민심을 북풍으로 잡아보려는 꼼수. 그래도 지지율은 변하지않아 10프로 대,1,1,1
헌법수호의지가 없다!!! 국민의 안전을 생각 안하는 괴뢰정권이 아니고선에야 미친거지 !! 탄핵해라!!,1,1,1
국민들은 답답하고 힘들다. 이 누마..,0,1,0
지지율 20프로가  할수 있는게  이거지  뭐야?,0,1,1
북쪽돼지가 설칠때 우리는 멧돼지를 뽑았다,1,1,1
"확성기 찬성, 북한에 똥오줌 풍선도 보내라.",1,1,1
윤석열이 살려면 전쟁말고 다른 방법없는듯  가족의 이익이 국가 이익보더 더 우선하고 국민의 안전보단 가족의 이익이 더 우선일수밖없는 상황,0,1,1
우리만지키는데. 경향은 생각있냐.,0,1,0
언제적...정치하나? 전쟁을 무기로 정치하는것은 극악무도한놈들이다!,1,1,1
믿을건 김정은 뿐이구나~,0,1,1
한걸래 앵삐찌 🐕 경향!,1,1,0
작년11월에 이미 북한은 일방적으로 폐기선언했지 않니?,0,0,0
탈북넘들과 이찍넘들 싹다 닭장차에 잡아서 북송시켜서 대한민국을 정화 시켜야한다.,1,1,1
경향은 정말 어느나라신문인지 적어도 북괴뢰편은 들지말자 다른건몰라도,1,1,1
대통령 추진력 대단합니다 아주잘했어요 질질 끌려다닐필요 있나요,0,0,0
용산개고기가 큰소리치는 선제타격으로 이젠 전쟁 시작하면 되겠네,0,1,1
긴장이 높아지면 좋아할 놈은 김정은과 윤석열 뿐이다.  생각없는 2찍 늙은것들도 좋아할라나...,1,1,1
윤석열이 업적이 대단하구나 짝짝짝,0,0,0
다죽어가는 레임덕 정권 때리는데 이런 억지까지 쓸 필요가 있는지 ㅉ,0,1,1
정치가 연속적인게 없냐 정권이 바뀌면 모든걸 뒤집으면 무슨 발전이 있을까,0,0,0
미국과 일본의 의도대로 잘도 움직여주는구료;;;,0,1,1
희한하네  이런기사에  한겨레 경향은  댓글이 거의 없네  왜그러지?,0,0,0
북과가  붕괴되야 간첩문죄인 전과4범 이죄명 도 무너진다,1,1,1
날려라 시원하게~~~~북한이 무너져야 산다~!!,0,1,1
저작권 법적 문제는 안 되시길빕니다... 혹시 나중에...,0,0,0
좋아 한판 붙어 보자 국토가 피바다가 되도 이기면 된다. 나아가지 북진,0,1,1
이미... 김여정이 연락소 폭파시킬때 부터.. 정지된지 오래됬는데..문재인이 모른척 했던거지.... 아닌척 모른척..,1,1,1
삶은소대가리가 슬퍼할 소식이네,1,1,0
군대 갖다오지도 않은 사람들이 전쟁을 우습게 보는것 같다  전쟁나면 제일먼저 총들고 나가라,1,1,1
남북긴장을 올리면 환율과 주식 내려간다...물가는 당연히 오를 거고... 누가 그걸 몰라서 강경하게 안한게 아니다...정말 아마추어다.,0,0,1
잘한다 이게 대한민국 입니다,0,0,0
나라를 일부러 북한과 강대강 대치해서 혼란을 일으키려는 목적이 본인 지지율이 낮아서 외부로 눈돌리려고 그러는거지?ㅋ,1,1,1
"전쟁일으키고 승만이처럼 한강다리폭파시키고
런칠것같은데?",1,1,1
이제 정상국가로  돌아가네..,0,0,0
이게다 무능한 문재앙탓,1,1,1
이젠 정치적 이익을 위해서  전쟁도 하겠구나.. 윤돼지가..,1,1,1
"군대도 안가고,  총도 한번 안잡아 본 보수꼴 수장이 전쟁에 대해 뭘 알겠냐",1,1,1
늙은 놈들이 매국노다. 전쟁의 긴장이 높아지면 경제가 좋아 지겠냐??  이념으로 밥말아 먹는것들.무식하면 용감한게 아니라 패망이다 이것들아...,1,1,1
남북간 불필요한 긴장관계를 조성해 이익을 얻는 집단이 반드시 있을건데....이런 간첩 종자들은 구족을 멸해야 합니다.,1,1,1
지는 술만 쳐먹으면서 전정부때 해놓은 공적을 모조리 깨부시는구나.,1,1,1
윤모지리 찬양하는 2찍 노인네들은 전쟁나면 최전방에 나가서 싸워라,1,1,1
gp철수는 진짜 코메디 였다 ㅋㅋㅋㅋ휴전국에서 휴전선 감시초소 철수 라니ㅋㅋㅋㅋㅋ,0,1,1
그래 한판붙어라.이스라엘처럼...신나겠다,0,1,1
역시 김여정이가 안목이 있었다.. 겁먹은 삶은 소대갈빠..빼~~액,1,1,1
김관진 전 장관님 다시 복귀하세요,0,0,0
저게 맞지...우리가 아쉬울게 뭐있나 북한것들은 이미 안지킨지 오래다...,1,1,1
"남에선 삐라 날리고 북은 떵풍선 날리고, 남에선 확성기 틀고 북에선 남쪽 확성기에 총쏘고... 긴장감 조성해서 '득'보는 자가 누구인가?",0,1,1
공산당과 합의한자가 공산당이당.,1,1,1
통일은 반대 일본 속국은 찬성할 사람들 ㅋㅋㅋ,0,1,1
댓글보니 무식자들 진짜 많네ㅋㅋ 천0스승 말대로 전쟁나야 우리국민들 정신차리지ㅋㅋ 댓쓰는 할배들 손주들이 1순위 참전!,1,1,1
야 사나이네 마누라 지키려고 전쟁이라도 불사할 기세네 ㅋㅋ  준표랑 둘이가서 전쟁해라 사나이들 끼리 ㅋㅋㅋ,1,1,1
이참에 북괴들 다 싹 정리해야 한다! 민주당은 북한한테 나라 넘겨주고 본인들만 기름칠 하는 걸 모르는 바보들 없지?,1,1,1
저정도 외교 활동이면 국회 동의 필요한거 아닌가???진짜 독재냐?,0,1,0
국민을 평안하게 하는게 아니라 끊임없이 대립하면서 국민을 불안하게 하는 정부.,0,0,1
소대갈이 대한민국 50년 후퇴 시켰다... 빵에 백년.. 재산 몰수,1,1,1
북한이 오물풍선 쳐 날리는 이와중에도 민주당 당대표란놈은ㅋㅋㅋ북한한테 쓴소리 한마디도 못하고 현 정부탓ㅋㅋㅋ오로지 목적은 그놈의 탄핵탄핵,1,1,1
민주당은 도대체 왜이런합의를해서 당하고만있게 하는거지??의심이든대 빨강이 의심이..,1,1,1
문죄인은 가짜평화쇼 주범이고 우리는 아직 휴전국가다.,1,1,1
안보는 보수다?......엥......전쟁 나기를 바라는 것들이 보수지요.......ㅋㅋㅋ,1,1,1
919 군사합의 파기를 머리 나쁜 국무회의로 결정항 사항이 아니다. 국회 토론 대국민 토의 진행하자,0,0,0
문재앙처럼 북한에 끌려다니는 개가 되지 맙시다,1,1,1
윤텅 좋아 죽는 6-70대 2찍들이 휴전선 가서 훈련 받고 보초 서면 되겠네.,1,1,1
"이러다 국지전 나서 젊은 장병들 죽으면 누가 책임 지냐.? 굥.? 지나가는 개가 웃것다. 조사 필요성만 언급해도 축소 지시하는데, 언간히 책임 지것다.",0,1,1
"대통령 떠나서, 북한이 똥뿌리고 있는데 당연한거 아니냐? 하루빨리 24시간 대북확성기 가동하길",0,1,1
삶은소대가리 USB 구속수사하자,1,1,1
국방에 총력을 기울이자,0,0,0
죄인이를 북으로 보내버려. 북 좋다고 하느넘이 양산에는 왜 있는징..,1,1,1
역시 2찍은 지능이 낮은 애들이 많네ㅋㅋ 할많하안할게. 말해도 못 알아 쳐먹으니.,1,1,1
대북 확성기 빨리 틀어라.,0,1,1
지구상에서도 보이지도않은 나라? 북조선 인민공화국 문죄인이 나랏돈 펑펑 돈퍼주니 적반하장 똥오물 투척 문죄인 이북 소행아니다,1,1,1
"속이 시원하다..... 간첩집단들이 만들어 둔 말 같지도 않은 4.27 선언, 9.19 군사합의 완전 파기해버려야 한다.",1,1,1
부동시로 군대도 안갔다온 윤두창이가 나라를 개판으로 말아먹는구나.,1,1,1
개버린은 오열합니다.ㅋ,0,1,0
명분을 주냐 답답할노릇이다,0,1,0
에헤이~ 그러다 전쟁난다~ 북한 정은이는 영유아 다루듯 조심조심~,0,1,1
"북한을 더 이롭게 하는 행위    한반도 위험스,럽게 하여 경제  파국으로 갈 모양새  북한 한테 한 두번 당하고 살았냐?",1,1,1
휴전선까지 전투기 급발진후 턴하는거 계속 하자. 북괴 미그기 기름 없어서 더 이상 맞대응 이륙 못할때까지 ㅋㅋㅋ,0,1,1
민주당....또 이번 조치에 대해 시비 안거냐??,0,1,0
훠훠훠때 그래서 북에 퍼주고 초음사 미사일 날림,0,1,1
날아오는 북한 오물 풍선을 드론으로 공중에서 수거해서 다시 북으로 보내는 신박한 아이디어 같은 것 없나.,0,0,0
애초에 공산국가를믿는게 잘못이다,1,1,1
환영합니다. 무장해제로 피해는 우리만 봅니다.,0,1,0
"20%의 처절한 몸부림 !  솔직히 외국에서는 알아주지도 않는 이런 뉴스 말고 ,  나라의 득이 되는 BTS나  많이 나왔으면 좋겠다.",0,0,1
대통령실한번 맞아야 정신차리지그전까지는 맨 생각만하고 다음에 한번만 한번만 더 하겠지,1,1,1
북한의 저런 딴따라 집단에 군사합의 한 것 자체가 어불성설이고 딴따라집단에   합의서에 서명했다는 것 자체가 넌센스다.,1,1,1
어서 확성기부터 기름칠 해놔라!,0,1,1
아직도 훈련 안하고 있었냐? 정신이 없었구만. 문재인 정권 끝나자마자 재개한 줄 알았는데.,1,1,1
이 번에 대남전단 오물 날려서 차량 유리창 박살 났더 만 우리도 대북 확성기 다시 틀고 대북전단 살포 하는 게 맞다 본다,0,1,1
얘네는 맨날 북도발시 선제타격외치더니 하는게머임?,1,1,0
뭔 아직도 지키고있었냐?,0,1,0
이 시국에도 북한 찬양하는 사람들이랑 민주당은 제정신 아니다,1,1,1
지지율 오를 때까지 정지하겠네 무찌르자 공산당 어르신들 많은 지지 부탁드려요~,1,1,1
운영규정 미준수로 인해 삭제된 댓글입니다.,0,0,0
북한은 지키지도 않는 유명무실한 조약을 왜 지키고 있었는지가 의문,0,0,0
"지금은오물이지만 필요시폭팔물보낼것인데 경계근무 철통같이해야된다,",0,1,1
"전쟁을 안 하면 좋겠지만, 휴전국가에서 계속 도발을 하면 피할 이유도 없다고 생각합니다.",0,0,0
전쟁나면 총만 들 수 있으면 다 총알받이로 잡혀 나감.,1,1,1
긴장을 더 부축이는 건 아닌가요...,0,0,0
힘으로 해야 한다  말로는  안된다,0,1,1
"군인들 뺑뺑이 돌려서 사망하는 살인 군대가, 여론 돌리려고 오히려 긴강만 고조시키는 구나..역시 무능해",1,1,1
북한 주민들 우리가 먼저 자극하지맙시다 우리는 평화를 원합니다 전쟁을 원치 않습니다 우리가 먼저 시비를 걸었으니 김정은 한테 사과하세요,0,0,1
늦었지만 정부의 빠른대응 환영합니다.!  국민은  정부정책을 믿습니다!!!,0,0,0
지금 자리가 위태로우니까 뭐 전쟁으로 어떻게 하겠다는거야?? 북한한테 계속 당하고만 사는 것도 못 봐주겠긴 한데.. 외교를 어떻게 하는거냐,0,0,1
태국기부대  최전선 >>>70살 이상 전방 투입>>>65부터 69까지 그 다음 투입>>60부터 64....전쟁끝,0,0,1
특검이 눈 앞에 다가오니 전쟁이라도 일으키려고 하는구나...,0,1,1
북풍몰이 = 채상병 사건  물타기,0,1,1
곧 미사일 날아옵니다..모두 대비 하시길...우리 일본부총리님 어디로 도망 갈까...자주국방 자주국방 외치면서 전시작정통제권도 없는 이상한 나라..,1,1,1
삶은 소대가리와 찢죄명이는 또 무슨 말을 하려나? 개들에겐 슬픈 소식이네,1,1,1
우리이니가 만들어놓은 업적들 다 부수고 탄핵안당할꺼같냐 180석 국회의원은 언제까지 지켜만볼꺼냐,1,1,1
아싸...경제도 안좋은데 휴전성 인근에 긴장상태 강화....앗싸 경제는 모르겠고~~  외국인이 투자금 빼가던지 말던지~~,0,1,1
북한이 먼저 깬거아님? 그럼 둘 다 깨지는거 아닌가??,0,0,0
ㅋㅋㅋㅋ 정말 민족의 적이 누구인가 생각하게 하는군.,0,1,1
휴전이지 종전이 아닌데 혼자 종전 쌩쇼는 역시 무능재앙과 민주내란당 ㅋㅋㅋㅋㅋ 미군철수 하면 바로 전쟁 난다,1,1,1
"멍충한 정부네, 대북전단만 중지시키면 되는데, 쉽게 갈 수 있는 길을 어렵게 하네, 대체 누구의 생각이냐",1,1,1
같짠이 정말 빨리 탄핵되기만 바라고있다.,0,1,1
"전쟁중인 국가에서 안보가 중요한데, 적이 연락소를 폭파 시키던 자국 국민을 죽이던간에 문재인 물고빠는 좌파들은 정신상태가 어떻게 된거 아니냐?",1,1,1
이번정부 싫어하지만 이건 잘하는거 같다.,0,0,0
전쟁나면 일본이 잘살게 되니까 이러는거지~~ 매국노 윤석열~~~~~~~~~~~~,1,1,1
수구만 정권잡으면 전쟁위협이 고조되네. 외교는 폭망에,1,1,1
이번 정부는 우리나라가 망하길 바라는 거같다,0,1,1
걱정마십시오. 이제 고사총 날라오면 전투기로 고사총 발사한데 통째로 날려 버릴테니,1,1,1
오물이나 쳐먹고 핵폭탄이나 맞아라! 그럼~,1,1,1
지금 강하게 밀어붙여야 평화가 옵니다. 지금 물러서면 나중엔 어떻게 될 지 몰라요.,0,0,1
평화적으로 삽시다. 북한 자극하지 마라.,0,0,0
양산의 강아지문 에게 물어보시길. 북한의 시다바리 문어벙!!! 더불면 만진당에게 오물 좀 안보내니?,1,1,1
"무서우면 육지로 나오든, 북으로 꺼지든. 기자놈이 이상한거야?",1,1,1
풍선에  생화학무기담아  보내는건  안무섭나? 참는게  참는게아니라  제2 제3의  도발을  부른다.,0,1,1
못된북한놈들~~~당연보복해야지,1,1,1
포격을 먼저 가하면 어떨까,0,1,1
그럼      떵물       선물받고         고맙다고        고개     숙이고만        있을까?,1,1,1
조폭들 경찰에 신고했더니 보복했다고 무서우니 신고하지 말자. 그런건가?,0,1,1
폭탄 맞는거보다 오물보따리 맞는게 낫겠다,1,1,1
이번엔 아주 끝장을 보자.현무까지 발사해서 원점 싹쓸어 버려야 한다.,1,1,1
그때는 어벙어벙 찍소리못하는 뭉가때고 이번엔 사격하면10배로 원점타격  갚아주면 찍소리 못하지.,1,1,1
개정은에게 소대가리같은 대화는필요없다,1,1,1
"휴전중인 나라다 늘 전쟁을 준비 해야한다, 자유는 그렇게 쉽게 얻어지지 않는다",0,0,1
"유비무환 아무리 강조해도 지나치지 않다.  문죄명의 가짜 평화 쇼에  마음이 놓이냐.
  남한에는  공산주의  추종자들 많다.",1,1,1
그럼 거기 떠나살든가? 누가 그 지역 살으라고 했냐?,0,1,1
남북긴장으로 이익보는 놈은 김정은 정권이다.  전단지 뿌리는 탈북자들 똥물 수거하는데 강제동원해라.,1,1,1
서지원기자는 종북 주사파 기자 인가,1,1,1
기자는 기사거리가 그렇게도없는가?. 베트남이 왜 패망했는지  되새겨봐라. 이런기사가 민중을 부축이는거다.,1,1,1
더러운 기사네. 국민들 겁먹으라는거냐?,1,1,1
나약한백성들 부추기는 이런기사  올리지 마시오~~,1,1,1
USB에 K팝 드라마 꽉꽉 채워 5억 개만 북한에 살포해라~~ 그럼 1년 내로 북한인민들 손에 핵돼지 참수된다~~^^,1,1,1
북한의 도발시 원점 타격한다는 내용도 추가해야지.. 그냥 맞고만 있을거라는 전제하에 기사 쓴거네,0,1,1
"불안하면 북한에 쎄쎄하고 처분만 바라세요, 짱이 빵셔틀 시키면 쎄쎄하며 셔툴하세요, 친구먹고 잘 지내자 해 보세요, 이빨 털릴 걸 ㅋㅋ",1,1,1
문재인이 김정은과 평화를 논의하고 이재명이 중국세 쎄쎄 하라고 하는지 이제 이해되니?,1,1,1
윤석열이 대북정책이니 별도리있겠소 그냥 참으시오 당신들이 찍었잔소,0,1,1
윤석열이는 만고의 역적이다.  용산에 핵 한방 날려버려라.,1,1,1
"탈북단체들에게   소송 하시오


피해 받으면 


대한국민들  재산 피해  낭면",0,1,1
국회에서는 관심도 없다.,0,0,0
북괴가 포격하면 이제는 옛날과 달리 그 몇배의 포격으로 갚아주면 된다.,0,1,1
"쟈들은 약하게 보이면 안된다.이스라엘처럼 확실하게 준비하고
보복을해야 안건드린다",1,1,1
국민 안보관부터 다시 교육시켜야함,0,0,0
동아는 칼럼이나 논설 등을 통해 항상 여론분열에만 앞장서는군. 그러면 당하기만 하고 참으란 말이냐?,1,1,1
"국방세금신설해서  세금 걷자




복지예산ㅁ 대폭 축소   하자",0,0,1
저래도 선동질 이간질에 앞장서는 미치광이 종북좌파들,1,1,1
그럼 언제까지 당하고 참고 견디란말이오 참아준다고 공산괴뢰들이 인정으로 봐줄거같소지금의 이스라엘을 보시오 배워야할게 너무많다,1,1,1
기사 쓴 럼 이따위로 ... 예라이 !,1,1,1
왜 북한에서 시카니 이런기사 쓰라고?,0,1,0
북한이 보복 포격가하면 현무5 평양궁에 날려보내 작살내야한다. 평양궁에 5발만 떨궈도 평양이 사라진다.,1,1,1
먼저 날릴 필요는 없는것 같다,0,0,0
뭐가불안해요즈음은 전재이나도피난이고뭐고 소용있겠나어디까진날아올지모르잖아. 서울이더위험할거같은데  기자야불안부추키지마라.,0,1,1
우리주민들이 하루빨리 평화를 원하는 것같습니다 우리가 먼저 시비를 걸었으니 김정은한테 사과하세요,1,1,1
공격하면 북조선 멸망이야 잘됐다,1,1,1
똥아가 좌파일보 다되었구나~,1,1,1
또또 불안조성 기사 쓴다,1,1,0
자칭 보수 사실 매국세력이 정권잡을때마다 경제안보는 항상 폭망이었지 이렇게 대놓고 매국은 처음이긴하다,1,1,1
굥석열뽑은 최후다. 달게 받아라 ㅉㅉ,1,1,1
폭탄 쳐맞고 국민들이 죽을지도 모르는데 보복도 못하는 무능력한 정부야 정신좀 차려라,1,1,1
불안하면 기어나와 북에 월북하든지. ㅉㅉ,1,1,1
확성기는 언론에 발표하지 말고 그냥 하면 되는거 아닌가. 꼭 이걸 하네 마네를 왜 언론에 알려주지? 조용히 그냥해,0,0,1
"군인 장병 죽어 나가는 건 나몰라라하면서안보는 보수?
웃기고 있네 안보를 안 보는 보수 주제에 어디서 손가락을 놀려서 댓글질이야?",1,1,1
동아일보는 북한 신문인듯,1,1,1
"연천군은 상시 비상대피 훈련하고, 북한의 포격도발에 대비해야겠네. 진짜 사회의 악인 북한, 민주당, 문가놈",1,1,1
