comment,SEJ_label,PEJ_label,MRJ_label
북괴들 긁혔냐? 쫄았냐?ㅋㅋㅋ,1,1,1
훈련병 영결식에서 밝은표정으로 기분좋다던 윤무당 ㄷㄷ 지금 정신상태가 정상이 아닌거같아요 빨리 끌어내려서 치료좀 부탁드립니다,1,1,1
먼저 뿌려서 북한이 대응한거라는거임?,0,0,0
확성기 방송해라 북한것들 쓴맛을봐야된다,1,1,1
찢조는 왜 가만히 있냐!!! 그러니 좌파는 간첩이란 소리 듣는거야,1,1,1
우리는 대응 수단으로 확성기 뿐 아니라 대형 스크린으로 북한 병사 볼수 있게 걸그룹 노래 돌려라. 북한병사들 뻑하게  만들수 있다.,0,1,1
ㅋㅋ 확성기에  쫄았노,0,1,1
왜 확성기 켠다고 하니까 쫄았냐?ㅋㅋㅋ,1,1,1
북한 김정은이 보다 대한민국 내에 더나쁜인간들이 득실하다 모두 역적으로 몰아 참수해야 할것이다..!!,1,1,1
대북방송 한다니 쫄았구나...ㅋ,1,1,1
거 일단 탈북민 동무들이 되돌려준다니께 일단 달게받고 생각좀하쇼,1,1,1
부카니스탄이 보낸 오물 다시 담아서 그대로 부카니스탄에 보내줘라. 그리고 대북 확성기로 매일 24시간 안내 방송 해주고 K-POP도 좀 틀어주고.,1,1,1
풍선 미리 터트리자 그냥 날라오기전에,0,0,0
다 필요없고 9.19 군사합의 당장 전면 파기 및 대북확성기 전면 시행해라,0,1,1
이제 남조선거리지 않고 한국이라고 하네 굿굿,0,0,1
"우리는 ""삶은 소대가리""를 보내던가?",1,1,1
상학선생 저거 도로 북으로 돌려주이소,1,1,1
한국도쓰레기잔득  넣어서3500개두배인7000개보내라,1,1,1
반응이 재밌으니까 계속하는구나 ㅎㅎ,0,0,0
일단 설치는 해라  반복되면 틀어라,0,1,0
ㄴㄴ 먹는게 없어서 똥을 구하기 힘들어서 못보내는거1차 살포때 보다 이번 2차 살포때 오물 확인 한거 보면 사실상 오물은 거의 없음,0,0,1
"2찍들, 삐라 보내고 싶겠네...",0,1,1
대북단체들이 전단 안보내면 되겄네,0,0,0
삐라 뿌리며 충돌을 부치기는 것들을 고향으로 보내주면 해결된다.,1,1,1
북한은 그냥 다른국가로 취급하면 안되냐... 삐라 그런거 뿌린다고 해서 뭔 소용인지도 모르겠고,0,0,1
지금은 잘 날아가나 시험해본거고 다음엔 탄저균같은거 생화학무기 실어서 보내겠지. ㅠㅠ,0,1,1
확성기 재개하고 삶은 소대가리 북으로 날려보내자..,1,1,1
원종이들 전쟁하고싶어서 신이 났네?,1,1,1
먹은게 없어서 날릴 똥이 이젠 없나?,0,1,1
쓰레기 다시 그대로 주워 담아서 다시 돌려주세요.,1,1,0
ai 그림의 힘을 보여줘!!,0,0,0
확성기 방송은 그대로 진행하고 24시간 진행시켜라,0,0,1
윤석열 정부가 나서서 대북전단 살포를 가로막겠군. 그러면 이상한 단체들은 또 윤석열 정부를 좌파 친북정권이라며 규탄하겠지.,1,1,1
삐라는 둘째치고 서해북방 GPS교란신호 중지해라 우리어민 조업도 못나갔단다!,0,0,0
우리 남한의 풍선에는 온갖 재미와 먹을 거리가 가득한데.......행복의 풍선을 왜 막냐.........김정은악마야...,1,1,1
김관진 성님도 다시 감투 하나 씌워드리자,0,0,1
확성기 개꿀잼인딬ㅋㅋㅋㅋ,0,0,0
먹은게 없어서 다음 똥 보급에 시간이 걸리는거다..방심하지마라,0,1,0
"김정은 정권이 노리는 것은 탈북민 악마화로 비판자 입막음을 하는것 입니다. 한국 여론을 이용해서요. 북한,김정은 좋은 일은 하지 맙시다.",1,1,1
"탈북 단체 넘들이 먼저 풍선 날린게 잘못이었지.    하지 말라해도 계속 날렸으니....    
      빌어먹을 탈북단체.",1,1,1
원인제공은 정부가 한 것이다.   왜 불필요한 중단시켰던 삐라 살포를 재개한게 윤정부아닌가?,0,0,0
북한이 뭔짓을 해도 민주당 조용~~~~~~~~   니들 대한민국 국적자들 맞냐?,1,1,1
지들이 쳐보내놓고 우리가 조치하면 더 퍼붓는다고?확성기가 무섭긴 겁나 무섭나보네,1,1,1
그러면 그렇지 가만히 잇는데 북에서 보내겠냐?,0,1,1
정부는 지체말고 바로 확성기로 대응 했어야지 쪼다정권회의하다 북한침략해도 늦장대응?!,1,1,1
대북확성기재개+LED전광판설치해서 도시모습과 아이돌 연예방송화면송출+동시에 우리도 쓰레기와 똥 담아서 북으로 보내자.,1,1,1
탈북민들은 여당편이고 우파와같다 그래서 삐라뿌리는것은 여당의 옹호하에 삐라를 뿌린것이다 여기에 동의하면 엄지를 보여주세요👍,0,1,1
김여정 합성 누드사진으로 삐라뿌리니 ᆢ북한이 도발하지 ᆢ보수도 아닌  역겨운 국힘당 탈북자 단체들 ᆢ ㅡㅡ,1,1,1
남조선이 먼저 살포했단 소리네,0,1,0
한국은 심리전에서 밀리고 있다 ~  선제적으로 대응하라,0,0,1
앞으로 북한으로 빠라 보내면 구속시켜라,1,1,1
북괴에 삐라 10억장 날려 보내면 안되나? 남한이 온통 똥천지가 되더라도 대가리 깨지도록 끝장대결 가즈아~~ 이제는 자존심 싸움이다!,1,1,1
기왕 쓰레기 폭탄 맞은거 우리도 문쓰레기 북으로 풍선에 달아서 부부동반으로 날려주자,1,1,1
깨진 유리창 기물파손은 정부에서 보상해줘야 됩니다 안그러면 이거는 나라가 아닙니다 ㅡ.ㅡ,0,1,0
남북 갈등 조장도 보수의 역할이여??,0,1,1
삐라 보내지마라. 대북단체 싹다 없애버리고 ㅉ,1,1,1
"너무 일방적이고  일그러진 마인드의 댓글들이 많다 ,,, 그동안 삐라는 우리가 오랫동안 보내고 있었다",0,1,0
"이번 기회에 삐라 한 1억장 정도 날리고, 대북확성기 24시간 틀어서 이 철없는 남매 년 놈들 혼을 좀 빼놔야 하는거 아닐까?",1,1,1
"역사적으로 보면 북괴놈들 생각보다 쫄보였던게 더 많음, 대북확성기 재개 절대 멈추지마라",1,1,1
백만장씩 10번만 보내자. 빨강이들 아주 그냥 돌아버리게.,1,1,1
이건 우리쪽이 졌네.  우리가 먼져 상호약속 어기고 삐라날렸네.  게다가 민주당이 삐라방지법 저번국회 1호로 통과시켜 놔서 입법되있잖아.,0,1,1
잠정 중단? 우린 대북 확성기 영구가동 할건데…윤석열 확실히 해라…가동 안하면 탄핵!!,0,1,1
"우리나라 민간단체에서 왜 삐라 자꾸 보내냐?쓸때없는 짓거리하니 국민들 피해보자나.  .
가만히 쳐있음되는데 왜 설레발이냐?",1,1,1
우리부터 그만 해라...뭐하냐!,0,1,0
윤석열 쫄면 안된다 계속 보내라,0,1,1
"쓰레기,똥은 우리가 더 많다!!  맞장 !!!",1,1,1
확성기 방송 다시 해라~ 저들의 잔머리에 놀아나지 말고~~  안지키는데 뭐하러 계속 지키나?  모두 설치 했다가..날릴때마다 계속 틀어 대기 바란다~~~,1,1,1
레이져 피해 다니는 스텔스기에  가득싣고 평양 시내 한복판에   남한 정화조 맛도보게 투하 해라,0,1,1
지지율폭망 탄핵 다가오니 북자극해서 슬슬분위기 조장으로 작전을 바꾼듯,0,1,1
확성기방송도 잠정중단한다면  윤석열은 옷벗고내려올각오를 해야된다,1,1,1
북한도 답답하다용산 대통령실로 쓰레기는 버려라,1,1,1
리설주 포르노 합성 사진 너무 도를 넘는 전단지 그만 뿌려라 탈북단체 놈들아,1,1,1
별풍 받고 삐라 날린건데 뭔ㅋㅋㅋㅋ애들아 정치는 쇼야...북돼지  공산당도 돈 앞에서 시키는 거 다 하는 애들이고...20세기 북한이 아니란다;;,1,1,1
북한으로 삐라 보내는것들은 간첩들인가,1,1,1
대북확성기 재개하고 삐라 무한으로 냘려야함ㅋ,0,1,1
북한아 많이 보내라~ 다시 돌려 보내 줄 테니~ 민주당은 왜 다시 돌려 보내라는 말 한마디 못 하냐? 머릿 수만 많지 회전이 잘 안되나보네...,0,1,1
북한한테 무시당하는 용산,1,1,1
아주 가지고 노는구나 안한다고 했으니 우리도 북한쪽으로 날려보내지못하게 조치해라,1,1,1
북괴에 삐라 더 많이 보내자. 누가 많이 쏟아붓나 대가리 깨지도록 대결해보자.,1,1,1
아니 우리는 계속해야 한다. 우리만 피해보고 끝나면 재미없잖아?,0,0,1
고집불통  윤통이 제대로'대처하는게 없네' 속수무책  말로만 큰소리 치다가  마는 한심한 정부 도대체  알수 없는 정권이다,1,1,1
대북확성기 삐라 살포 재개해라 누가 이기나 보자,0,1,1
탈북민단체도 이제 적당히 좀했으면 좋것다....그래봐야 조족지혈같은 지원인데,0,1,1
대북 확성기가 묘약이구만. 끔쩍 놀라 살포 중단한다고 한거보니. ㅋㅋ 잘했다.,0,1,1
확성기 쓴다니깐 쫄았냐?,1,1,1
대한민국이 100배로 응징 하라,0,1,1
답은. 획성기설치가 정답이다.당장 확성기설치하세요,0,1,1
삐라 계속 뿌려라 왜 김정은 눈치봐? 열 받으면 선빵 날리면 되지,0,1,1
윤쩍벌 윤뒤뚱 응징해라,1,1,1
북한이 삐라랑 확성기에 흔들리면 더 해서 끝을 봐야지 잠정이라는데 언제까지 이러고 살거냐 기회 왔을 때 하나씩 조여서 한 번에 퍼부어버리고 끝장내버려라,1,1,1
탈북자 단체가 삐라 계속 띄엇나보네 ㄷㄷㄷ,0,1,0
민주당은 김정은한테 겁먹어서 조용하냐?,1,1,1
"겁먹지말고  대북전단, 확성기, 김정은  처단조특전사 투입 시기를 계획하라 ~",0,1,1
대북 확성기 가즈아!!!!,0,0,0
"복수하는것은  삐라살포가  아니라   국민소득을 더높여  북한사람들이
   남한을 동경하게 하는것이며
   가끔씩  못사는 북한주민을  도와주는것이다.",0,0,1
탈북단체들 어지간히 해라 이게 뭐냐 사람 다치면 니들이 책임질래?,1,1,0
삐라 날리는 탈북자놈들 도로 북송시켜라... 민족과 국가 간 이간질 시켜서 전쟁유발하는것들....,1,1,1
"결국 모든 걸 최악으로 돌리는구나…. 윤석열!!!홀리고 멍청한 51% 야…… 어떻할래?? 이제와
지지율 21% 되봐야 이 꼴이야….",1,1,1
역시 북괴의 앞잡이 이재명과 민주당은 아무소리 안한다,1,1,1
"저 오물들 문재앙, 이죄명한테좀 갖다줘라..문재앙 김정은한테 USB 갖다바치고, 이죄명 돈 송금하고. 북한, 중국 공산주의자한테는 한마디도못함",1,1,1
꼬리냐리지 마라. 대형 스크린 설치해서 드라마 틀어줄게,0,0,0
ㅋㅋㅋ 하는 짓 보니 전쟁은 안나겠다. ㅎㅎ,1,0,1
"말해봐라 민주당!!이런 꼬라지 보고도 국민혈세 퍼주는게 당연한건지
그 돈으로 대한민국 어려운 국민들부터 챙겨라",1,1,1
초딩들 책상에 선 긋고 지우개 넘어오면 내꺼 다툼 보는거 같노.,0,1,1
고성능 전광판과 스피커에 깨갱.,0,0,1
민주당은  뭐라말좀해바라~~,0,1,0
버릴 쓰레기도 없나보지,1,1,0
확성기가 진짜 무섭긴 한가보네 ㅋㅋㅋㅋ,0,0,1
대북 확성기는  방송해야 된다,0,0,0
와 확성기 효과좋네~ 저딴 말 무시하고 확성기 틀어라!! 괴뢰들한테 언제까지 끌려다닐수없다. 확성기 틀고 도발하면 원점타격하라!,1,1,1
되랑이sk 말을 믿냐 기냥 최고볼륨으로 틀어라 뉴ㅇㅇ 틀어주면 환장한다,1,1,1
확성기가 무섭긴 한가보다 ㅋㅋㅋㅋㅋㅋ,0,0,1
좌파리 쓰레기들  선물 받으러가~~~,1,1,1
죄명이랑 조국을 최 특등급으로 북에 보내자~ 북에서 돼지 선동하게~ 그짝에서 우두머리 하라지~  뭐~ 사상이 똑같으면 같이 하는거지 뭐~,1,1,1
졌네 한국이 북괴한테 원점타격한다고 하더니 아고 허구헌날 당하고사냐,1,1,1
"원칙대로 해라..우덜은 원칙과 정의, 국가와 국민을 존중한다..",0,0,0
서결아 너뭐하니~~박살을 내야지...생화학무기면 어쩔려구 다시는 똥못날리게 선제타격하라!,1,1,1
워낙 못 먹어서 보낼 오물이 없었나 봅니다,0,1,1
문재인이 꺼 놓은 대북 확성기 가동해라,0,1,1
"코메디냐..야상 입고 방독면 쓰면 ..방제가 되나!!,...특수복없어????...ㅎㄴ심하네!!!",0,1,1
"대북확성기재개하고, 철책선에 레이저신무기를 전진배치하여 침투하는 풍선.드론 등을 완벽퇴치해야한다!",0,0,1
이럴때 민주당에서 규탄 성명이나 국회 특별법 제정에 관한 페스트트랙 태우면 얼마나 많은 지지을 얻을까? 근데 단 한번도 그렇게 하지를 않네…,0,0,0
눈에는 눈 이에는 이 악에는 악 핵에는 핵!,0,1,1
확성기 한다해서 안한다는거야 이제??... 중단한다니까 이제 확성기 하기로 한거 안하기로 한거에요 설마? 무시하고 그냥 하면 안되나,0,1,1
민주주의선택하면 안뿌림,0,1,1
알았어. 울지마. 안할게. 대신 대북확성기 틀게.,0,1,0
북한것들이 대한민국에 넘어오는것이 짜증난다.,1,1,1
목적달성했나보네!  풍선 다발적으로 띄어놓고 그속에 드론도 같이 보내서 여기저기 정탐한거 아닌지?,0,1,1
북한에서 나는 것이라곤 똥오줌 뿐이라는 얘기가 사실이었군.,0,1,1
나팔하나 튼다고 바로 쫄?,0,1,0
차라리 전쟁이 낫겠다. 지저분하게 놀지 말고 차라리  응?,1,1,1
스타링크 하나면 붕괴가능할듯,0,0,0
즉각 대응하지 않으니까 이렇게 어정쩡한 꼴 되지 않냐? 한심한 윤석열 정부. 즉강끝을 입버릇처럼 뇌까리던 신원식은 뭐 하고 있었냐?,1,1,1
ㅋㅋㅋㅋ 진짜 뭐하냐 남한이랑 북한이랑,0,0,1
실컷 매맞은후에 확성기튼다니까 중지한다구 우리만손해 처음 넘어왔을때 확성기가동했어야,0,1,1
최신노래 를 MP3에 스피커 연결후 100만개를 풍선에 메달아 보내라.,0,0,1
똥푸는차 다 불러서 오물 미사일 쏩시다,1,1,1
공산당이 직접 했다는거네,0,1,0
우리도 달러 보내지말고  쓰레기 보내자,1,1,0
이왕 이렇게 된거 서로 행운의 편지 주고받고 하는건 어떨까?,0,0,1
대북 삐라살포 지지한다..달러좀 넣고..쌀도 포장된것 넣고...,0,1,1
대북 확성기 빠르게 틀고 ~  삐라도 적극적으로 날려라~  쫄아서 꼬리 내리는 이유 나왔네,0,1,1
ㅋㅋㅋㅋ 가지고 노네. 박상학이 더 하는지 지켜보자.,0,1,1
확성기을 울리세요 ~ 2틀 했으니   10일이상 확성기 하기,0,1,0
다 필요없고 삼겹살 사진만 찍어서 주구장창 보내 ㅋㅋ,0,0,1
확성기 킨다고 기침 한번하니 기가 막힌다 아 웃겨 ㅋㅋㅋ,0,1,1
대북확성기가 무서운게  증명되네..정부는 당장 대북확성기로 대응해라,0,1,1
이참에 북의 애송이 체제 문대버리고 통일하자!,1,1,1
윤석열 정부 대응능력 최고!!!👍,0,0,0
용산으로 집중 투하해라 윤석열 거주하는 곳으로.,0,1,1
풍선 다 썼나보네 ㅋㅋㅋ,0,0,0
더러운 집단 아니랄까봐,1,1,1
국짐당=북한 노동당 김정은,1,1,1
그러게 먼저 뿌리지 좀 못하게 해라~먼저 보내니 쓰레기로 되돌아 오잖어~~,1,1,1
쟤들이 700개 정도 보냈으니 우린 7000개정도의 풍선에 삐라와 초코파이로 가득채우면 된다~~아 물론 확성기도 다시 틀어야하고....,0,1,0
이재명씨  한마디하셔야죠,0,0,0
대북전단 옹호하고 박상학을 구속시킨 양산 개버림과 민주당이 오물을 수거해야 한다,1,1,1
"확성기틀어라. 선방치고 어디서. 잡것들. 
국가도 아닌.    반인류집단",1,1,1
북한다운 발상이다 오물풍선이라니 저런 자들에게 평화를 구걸한.문재인도 같이 날려보내라,1,1,1
대북 방송 재개 한다니까 바로 꼬리 내리네,0,1,1
"대북확성기를 작동하고  대북삐라를살포해라  북한민의동요를 이끌어내야
3대세습정치를끝낼수있다",0,1,1
"민주당은 하나같이 아닥중, 이래서 정은이와 한편이 의심된다는거지. 오물도 축복이라 고맙다고 할 빨간애들 좀 북으로 보내자.",1,1,1
재활용 구분해서 보내라.,0,0,0
결론은 민간에서 우리가 먼저 보냈다는거네?그래서 보복으로 오물풍선보낸거고?,0,0,1
종북좌파들과 수준이 비슷하네.. 좌파들이 날뛰면 김정은  남매가 장단맞춰준다.. 우리나라도 공산주의화 될까봐 걱정된다,1,1,1
그런다고 확성기  멈출거 같디,0,0,1
"참,살기힘들어 옆으로는 일본에바로위는 북한 ,더 위로는 중국에
사방으로치이니    누가 터,잘잡았대",0,0,1
"그만큼 싫어했단건데, 더 해야지?",0,1,0
공격을 당했으니 죄를 물어야 한다.사과 할때까지 대북방송 재개 해야 함.,0,1,1
신경 쓰지말고 대북확성기 가동 해라,0,0,0
사용하는 어휘를봐라 짱퀘나  다를바가없다,1,1,1
문가 때 주던 공물 안주니  열  뻗친 모양이다. 우린 인민 모두가 혜택보게 달러 넣어  대북풍선 왕창 날려라.,1,1,1
"그래그래 북한것들아 애쓴다 참,,",1,1,1
더운 날씨에 !  양쪽다 쓰레기 날리지 맙시다.  앞으로 북으로 날리는자 손해배상 청구해서  수고비 받아내야지.,1,1,1
지들 이미지만 더 안좋게 만드네,1,1,0
대한민국은 치안국가인 법치국가를 지향하면서 노답되고 전쟁나면 기득권들은 다 도망갈텐데.,1,1,1
"저 말 그대로 믿는거 아니지?
6일 현충일이다! 또 그럴 확률 높다",0,0,0
확성기 대응사격하면 그땐 어떻할까?,0,0,1
미사일쏴버려서   전쟁 나였야  했 는데  ~~고물가에 세금 내다  죽던  전쟁나서 죽던  매한가진게~~,0,1,1
개장수한테보냈으면좋아했을텐데 성은이라고,0,1,1
우리는 서울시의 쓰레기를 전량 북으로 폐기처분할 준비가 되어 있다. 적이 100개를 보내면 우리는 만개를 보내겠다,1,1,1
니네 똥도귀하다며? 똥으로 불때고살아서   상종못할 그 지들,1,1,1
좌파들 이구동성 한마디씩들 좀히지~~  이것들은 왜 꿀먹은 벙얻니가 되었나,1,1,1
이미 낙하지점 확인했으니 ...무섭다.,0,0,0
민vs 하 보는것같네.싸우자했다 화해하자는,0,0,0
전방에 대형 tv 설치해라,0,0,0
"안산,부천같은 멀티 지역에 떨어졌다는 뉴스에 북한발 포퓰리즘 발동 ㅋ",1,1,1
풍선 날아오기전 터트리는 레이다 없냐,0,0,0
우리의적은 북한!! 근데 우리나라에 간첩이 너무많다싹 쓸어버리자,1,1,1
남한 정치나  북한  정치나  똑같이  한심하다,1,1,1
"만들어 놓은 비닐,다 떨어져서 다시 만들어야 되나?",0,0,0
고마해라 우리가 먼저햏다 탈북자 이영학인가 뭔가하는놈북한으로보내라,1,1,1
"그러니까 북한에 불필요한 자극하지 마세요.어차피 좌시하지 않겠다 하면서 그냥 좌시할 꺼면서
그냥 조용히 지냅시다.
전쟁할 것 아니잖아요.",0,0,0
대북확성기 효과가 아주 좋구나ㅋㅋㅋ 문재앙 오열중?ㅋㅋ,1,1,1
이걸 우리탓하네 ㅋㅋㅋ 역시ㅋㅋㅋ  대깨찢들은 한국잘못이라하겟지? ㅋㅋㅋㅋㅋㅋ,1,1,1
웃기는 놈들! 🐕난리를 쳐놓고 반격만다니까 중단? 즉각 대북방송 재개하라!!!,1,1,1
대북심리전 확성기 무섭구나,0,0,0
북한은 저러한데..여기는 평화누리도..평화타령이나하고..으이그..,1,1,1
"확정기가 무섭긴 무섭구나우리가 이틀동안 800여개풍선테러맞았으니   확정기   최소한 8일은틀어야지

저것들도 지옥경험해야지",1,1,1
똥모으기가 힘들었나보다,0,1,0
대북확성기로 북한주민들에게 정은이 정권 탄핵하라고 떠들어라.,0,1,1
이제 버릴 쓰레기조차 없는거냐?,0,1,1
확성기 켠다니깐 바로 중단하겠다고하네 ㅋㅋㅋㅋㅋㅋㅋㅋㅋㅋㅋ 유치한것들 ㅋㅋㅋㅋㅋㅋㅋ,1,1,1
확성기에 북귀들은 학을떼네 더 신랄하게 하자 이번엔 300인치 아이맥스와 돌비로 빠빵하게걸그룹뮤비로 북쪽에 맘껏 틀어주자,1,1,1
우리도 바람 북쪽으로 불때 양산 평산 마을에 계신 그 분을 풍선 밑에 달아서 북한으로 보내자.,0,1,0
확성기 튼다고 하니까 전단지 핑계된듯.  확성기는 정권 자체가 극도로 싫어 하기에 대북 전단에 비길바 못될것으로 보임.,0,0,1
우리가 먼저 보냈다는 거네? 일단 수사부터 해봐라 뭔가 있다,0,0,0
쓰레기 모아서 다시보내자,1,1,0
꺼져라 받은건 돌려준다,1,1,0
이번기회에 우리도 쓰레기수거해서 북한 보내버리자,1,1,1
대북전단물 국가가 대량 발송하라!!,0,1,1
탈북민들이 먼저 도발한 행위..하지말라고 해도 그리 보내던데..,0,1,1
제대로 졌군 이거때문에 차박살나고 불나는거 보면 결국 우리가 손해였네 ㅋㅋㅋ,0,1,1
한국에서도 매번 삐라+돈 보내고 있는걸로 아는데..,0,0,0
용산은 뭐... 하는게 없구나.. 대화도 없구.. 대응도 없구,0,0,1
5일동안 똥폭탄 쳐맞고도 1도 대응하지 못한 무능한 윤정부. 윤석열 탄핵이 답이다!,1,1,1
근데 민주당이랑 조국은 왜 이렇게 조용하냐? 일본이 말한마디하면 게거품물고 달려들더니 북한의 테러는 입꾹닫 ㅋㅋㅋㅋㅋㅋ,1,1,1
"확성기 재설치한다고 하니 바로 중단하네.....  문재앙 9,19 합의도 폐기해라..",1,1,1
"민주당을 왜 진보 좌파라 하는가 모르겠다,,, 종북좌파라 불러라,,, 종북 좌파지 진보가 어딨음???",1,1,1
대북 확성기 철거한 인간이 간첩이다.,1,1,1
북한의 중단과 상관없이 확성기방송은 하루속히 재개해라,0,0,1
더부러 만진당 너무조용하네 왜 북괴에 한마디 못할까 찍소리못하고 헛발짖만 세비아까워,1,1,1
"나라가 이 꼴인데도 채상병만 부르짖는 넘들은 뭐냐?? 국회의원중 이런 사태를 논하는 놈이 하나도 없고,오직  당파싸움질만 하고 있으니...",1,1,1
우리는 머리를 숙이며 돈을 보내고 북조선은 대가리를 들고 오물을 보내주는구나. 이런데도 친북하는 것들은 그냥 북으로 가라.,1,1,1
대북확성기  꼭 재개하고 북한오물은  그대로  돌려보내세요,0,1,1
재인이 이럴땐 왜 조용하나 이럴때 나대보지,1,1,1
확성기 튼다니까 쫄았네! 그러니 더 틀어줘야지? 쟤들이 4일 동안 풍선 날렸으니 우리도 딱 4일만 틀어주자!,0,1,1
더불어 북조선당 왜 아닥하고 있지? 양산에 보내라 오물,1,1,1
대북확성기 할거같으니 바짝 쫄아서 치고빠지기 한다고? ㅋㅋㅋㅋㅋ 그건 안되지 어디 한번 죽어봐 ㅋ,1,1,1
우리나라는 대중이놈현이 양산개버린. 이셋이 다망첬다,1,1,1
"북풍불때 우리도보내고, 대북심리전확성기 지금보다100배더틀어라,",0,1,1
확성기 재설치 해라 확성기 뽀개버린 개버린,1,1,1
첫번째 보냈을때 바로 대응조치 했으면 두번째 세번째 안내려 보냈을거 아냐 박근혜 김관진 때 처럼  해라,0,1,1
확성기를 5.1채널 돌비 ATMOS 서라운드에 보이스강화 AI로 하루종일 틀어줘라. 얘기 많이 듣고싶은 모양이다.,0,0,1
대북 확성기 방송한다니까 쫄았네...,0,1,1
100배 날릴 헬륨가스와 풍선은 있나? 내가 볼 땐 그것도 쥐어 짠듯한데 ㅋㅋㅋㅋㅋㅋㅋㅋㅋㅋ,0,1,1
확성기 튼다고 하면 문재앙 죄국 자지점이 북한보다 먼저 발광할듯.,1,1,1
확성기 튼다니까  무섭냐 공산당넘들,1,1,1
ㅋㅋ 확성기가 무섭군 ㅎ,0,0,0
문재인이 북한에 한 마디 못하나? 아니면 속으로 손뼉치고 있나?,0,1,1
확성기에 바로 꼬리 내리네 그냥 시작하자 대북 확성기,0,1,1
"계산은 제대로 해야지.   니들이 한짓에 상응하는 만큼 우리도 하고,  그다음에 다시 생각해보자  더러운 것들아!",1,1,1
이런북한을좋아라하는인간들은 사형을 시켜야한다 북한 쓰레기보다 못한인간들이다,1,1,1
상거지같은것들 딱민주당하는짓이네,1,1,1
대북확성기가 쟤네들 아킬레스건이잖아~~~바로꽁지내리네.몹쓸것들~~,1,1,1
대북방송 반드시 재개해야한다. 좌파 공산당들은 상대가 강하니 꼬리내리는것 봐라. 우리도 삐라 100배 더보내라. 정말 이것 외에는 북 멸망 방법없다.,1,1,1
"확성기 방송 확대실시하고 k팝 드라마 저장된 USB 1억개, 트랜지스터 라디오 천만 개 살포하라~~!!!!",0,1,1
어이 민주당 뭐라고 말 좀 해봐라 ㅋㅋㅋㅋ,0,1,1
아직까지도 이지경인데 노벨 평화상을 받은인간이있다?,1,1,1
쓰레기같은 집단 이런집단을 옹호하는 종북좌파척결,1,1,1
확성기 재개하고 삶은 소대가리 썰어서 살포하자남북통일 얼마 안남았다,1,1,1
민주당  왜 말이 없나,0,1,0
됐고. 대북 확성기 방송 출력 두배로 해서 차질없이  하자!!! 개정은 개여정이가 지들 발등을 지들 주디로 잘도 찧는구나야. ㅎㅎ,1,1,1
USB 에 각종 한국자료 꽉채워서 하루에 5만개씩 1년동안  보내주자,0,0,1
이런애들 좋다고 물고 빨아줄려는 더불어성범죄당??,1,1,1
남한 똥 모으기 하자. 북한이 거름이 필요하댄다.,1,1,1
오물삐라 중단해도 지금 당장. 대북확성기 재개 대북 전단지 재개 바랍니다,1,0,1
재인이네  집에 떨어져라 . 얼마나 황송해 하겠냐?  ...🌺🌺🌺🌺🌺🌺🌺,1,1,1
우리도 서울시소각장 없다고 그러는데 북으로 보내주자,1,1,1
