comment,SEJ_label,PEJ_label,MRJ_label
지 눈썹에 불붙은 것은 안보이지?,1,1,0
국회에도 불참하신 분 이  낄낄빠빠 합시다.,1,1,1
아무데나 끼어들지 말고 내려와..,1,1,1
"한국이 미국을 도와주기 위하여 베트남전 파병한 건 모르냐, 미필자야!",1,1,1
속마음 : 하늘이 날도우는 구나 ㅋㅋㅋㅋ 고래와 아노 찬스다!!,0,0,0
지금의 국내 사태를 모면하려고 국제사회 연대하여 무언가를 꾸미지 말라,0,0,1
북한이 아니라 윤가가 대통으로서 하는 짓거리가 아주 위험하고 전례 없는 일이다.국민이 국제사회와 연대해서 네가 하는 짓거리를 심판해야 한다!!!,1,1,1
그냥 넌 아무것도 하지말고 아무생각도 하지마라!!!나라를 개판으로 만드네!!!!한심하다!!!,1,1,1
닭치고 감옥소나 가자~!,1,1,1
아니 넌 그냥 내려와 제발,1,1,1
군대 부동시로 면제 그런데 당구랑 공무원은 할수있고 이놈 사법고시도 비리가 있었던 것 같더만~,0,1,1
암것도 모르는 윤꺼벙 은 아닥하고 밥먹을때  지시받어  어떠할까요? ㅎㅎ,1,1,1
곧 파병 할 듯이 공갈치더니 왠 일이래? 누가 알려 준 거 아냐?,0,1,0
"말좀 꺼내지마. 니가 리더냐. 경제도 개판인데, 왜 얽혀서 금융이 박살나야하냐",1,1,1
"이자석이 더위험해 이북정은이보다,아주 한국 말아먹을작정이네",1,1,1
"이런 한심한 자식아, 네놈이 더 위험하다. 그냥 모른척 하면 될 일을 너같은 놈이 나서는 탓에 국내적으로 긴장만 조성되는거다. 이 자식아",1,1,1
니부터 해결해라. 니 와이프가 위험하고 전례없는 일을 했어.,1,1,1
임기절반에 지지율 19% 전례없고 국민들께 지극히 죄송하고 위험한일,0,0,0
12시간 먼 나라 신경 쓸 영량도 없는 놈이 바로 옆에 있는 김건희이나 관리 잘 해라,1,1,1
대한민국에 전례가 없을 정도로 위험한 윤건희~ 너는 전두환이 아니다~ 깜도 안되는게 착각 좀 하지말고 이제 좀 내려오자~,1,1,1
지금이 북침해서 통일할수있는 기회인것같은데...,0,1,1
윤석열 대통령님 말이 백번옳은 말이다. 윤대통령 말씀에 따라 국제사회 연대로 대응해야 한다.,0,0,1
여자는 끝까지 안써먹네ㅋㅋㅋㅋㅋㅋㅋㅋㅋ,1,1,1
시니어 전우들 든든합니다. 장시간 구보는 좀 힘들지만 사격솜씨는 아직 녹슬지 않았습니다,0,0,0
참 누구발상인지 ㅉㅉㅉ,0,1,1
스스로 자처해서 나라국방에 이바지하겠다고 나선분들인데 욕하누 사람들은 뭐지? 존경스럽고 감사할 뿐입니다.,0,0,0
와ㅠㅠ 너무 멋지십니다!!! 자랑스럽습니다 감사합니다,0,0,0
젊은 여자들 넘쳐나는데 걔들은 왜 징병 안 하니??,0,1,1
노인분들 불러서 예비군 시켜야겠나...,0,1,1
"왜 나는 저 할아버지들이 전쟁나면 어지간한 20,30여경보다 더 나라를 잘 지킬것 같지???",0,1,1
요즘 여자들은 피지컬도 좋던데 왜 군대에 안가는지. 표 때문이겠지,1,1,1
나도  주말 이용해서 훈련받아보고싶다. 민간인 신청가능한   건 없나?,0,0,0
와..자세 보니 총 나눠주는 병사보다 더 강해보입니다. 멋지네요,0,0,0
국민돌격대 어서오고 나라가 진짜 망하긴 했나 보다,0,1,1
나라를 지키겟다는 애국심하나는 그어느 군인보다 강인할듯,0,0,1
태극기부대 로 명명하자,0,1,0
"40, 50대도 지원할 사람들 많습니다. 모두에게 기회를 주시기 바랍니다.",0,0,0
사단장님 같은 모두 멋진포스  정말 대단 하십니다..자원 하시다니  너무 멋진 용기 아주 훌륭하고 보기 좋습니다..,0,0,0
이런 기사에 조롱이라니….,0,1,1
"정말 자랑스럽습니다  , 감사드립니다 ^^",0,0,0
옛 추억도 나고 친구도 사귀고 신체활동도 하고좋은 제도 같습니다. 꼭 전투에 참여 시키기 위해 그런 것도 아니니 good,0,0,1
여자들 기초 훈련을 시키는게 먼저 일듯,0,1,1
대한민국을 위하는 저 모든 분들의 순수한 마음! 정말 감동이다. 대통령부터 정치인들만 잘해준다면 대한민국은 최고의 국가가 될 수 밖에 없다.,0,0,1
우크라이나 군인들이 죄다 중노년층인거 보고 영감을 얻었나 봄..전쟁나면 울 나라도 싸울 젊은이들이 없잖아. 인구절벽때문에 ㅋㅋㅋ,0,1,1
"역시 노병은 죽지 않고 사라질 뿐이다,귀감이 되는 어르신들 국가에 대한 충성심 존경합니다",0,0,0
김정은이 전쟁 못일으키는 이유다...,0,1,0
진짜 개ㅁㅊ나라네.. 여성징병제하면 되는데 이야.. ㅈㄴ 스윗하노 ㅋㅋ,1,1,1
안보가 위태롭긴하지~~~,0,0,0
각자 할일을 해야지 뭔 몽니냐 이게. 이것도 예산 말아먹기 인가,1,1,1
감사합니다! 우선 군대 안 다녀온 시니어부터 입대시킵시다! 윤시니어 이마트 시니어 등등,0,1,0
여성징병은 죽었다 깨나도 할생각이 없나보네 ㅋㅋㅋㅋㅋㅋㅋㅋㅋㅋㅋㅋㅋㅋㅋㅋㅋㅋㅋㅋㅋㅋㅋㅋㅋㅋㅋㅋㅋㅋㅋㅋㅋㅋㅋㅋㅋㅋㅋㅋㅋㅋㅋㅋㅋ 참나,1,1,1
대단하십니다. 여러분들이 있어서 든든합니다.,0,0,0
대한민국 국민은 국방의무가 있는데 헌법에도 있고 그런데 여자는 국민이아닌가보다. 남자만 군복무 ㄷ ㄷ,0,1,1
대한민국 젊은 여성들은 뭐하는고?,0,1,1
러시아 젊은 현혁들 우크라이나 예비군들한테  개발리고있음 ㅋㅋㅋ,1,1,1
정치적 목적없는  순수한  마음이길...,0,0,0
전쟁나면 최전방 부탁드려요. 2찍,0,1,1
국방부 판단력 없는것 같아 보임.,0,1,1
미쳐도 단단히 미쳤네! 어느 나라가 군인을 노인네로 징집하냐? 하~ 차라리 여군을 뽑아라. 그게 답이다.,1,1,1
웃기는 기사다 참. 전쟁 한바탕하려고. 집에서 손자들 보시라. 그리고 제대로된 인간을 지지하시라.,1,1,1
병0090신짓거리 하고 있다 ㅋㅋㅋㅋ,1,1,0
사진에 애들이 2찍통꼴이구나.  총알 하나씩 먹고 오너라.,1,1,1
민주당은 또  전쟁위기 고조한다고  비난 할텐데...,0,0,1
안보에 나이는 없지만 성별은 있는 나라 ㅋㅋㅋㅋ 그저 대단하다 나거한,0,1,1
어르신들! 왜 이러시는건데요?,0,1,0
저 분들이 총들고 나설 수 밖에 없게 환경을 만든 이 정부를 규탄해야 한다. 부끄럽다.,1,1,1
"이건 아니다.이건 아니야.
블랙스펀지라니...
제3제국 국민돌격대도 아니고 이게 무슨...",0,1,1
이야 독하다 독해 그런대도 아직도 총기 자유화 안함?,1,1,0
대단하시다. 난 무장하고 걷기도 어려울것 같은데,0,0,1
걱정마. 한국도 MZ세대부터 먼저 튈거니깐. 여자들 참전시킬때까지 남자들은 자율참전임,1,1,1
이게 그 최후의한명까지냐?,0,1,0
전투 경험도 없이 아무튼 총알받이로 써달라 ㅋㅋㅋ,1,1,1
용기 대단합니다. 존경합니다.,0,0,0
멎지다. 최고입니다. 이런 정신력이 이나라를 지켜습니다. 화이팅 하세요.,0,0,0
이열 1945년 나치독일에서나 볼법한 국민돌격대~,0,1,1
대단합니다.바로 소집 훈련 시켜서 우크라이나로 파병하기 바랍니다.,0,1,1
거.. 으르신들 그냥  통제에 토달지 않고 잘 따라주시는게 도와주는겁니다...괜히 총들고 설친다가 넘어져 다치면 그게 더 현역들한테 부담되요.,0,1,1
어르신들 등산보다는 낫겠네,0,0,1
어른들이 스스로 자처해서 훈련을 받으시다니 대단하십니다.,0,0,0
나도 가고파요.  육군소령예편 65세 아저씨,0,0,0
'안보에 나이 없다'…80세 고령부터 여성까지 예비군 훈련 참여/강태현(taetae@yna.co.kr)기자 프로필,1,0,0
추미애 이재정 양문석 이재명 윤석열 이분들도 참가시켜주세요,0,0,1
소일거리 찾으셨네~~너무 무리하지는 마세요ㅡ,0,0,1
눈도 안 보이고 뛰는 것도 잘 못하는 분들 데려다가 뭐하는건지 모르겠습니다. 이스라엘식 여성징병하면 모든 게 해결됩니다.,0,1,1
공짜 국밥 먹으러 갔네,0,0,0
40만 되도 노안이 오는데;;;;;;;;,0,0,1
전쟁나면 남자 절반죽고 여자만 산더미처럼 쌓이면 진정한 여초페미국가 재탄생하겠노;; 남자 노예법할삘,1,1,1
우크라이나도 노인은 징집 안시킨다. 부끄러운줄 알아라 여자  징집 시켜라.,1,1,1
모병제로 바뀌어야합니다,0,0,0
캐리버 50  엠 60 지금도 현역 못지않게 쏠 자신있다,0,0,1
갱항도 2칙이들ㅡㅡ7군단 따라서ㅡㅡ압러강으로가서 중공군 막도록햐ㅡㅡ전투력좋다며ㅡㅡ,1,1,0
공산당이나 지지하는 테스토스테론 다빠진 영포티 보다 잘 싸울거같노 ㅋㅋㅋ,0,1,1
지원금 타먹을라고 ㅋㅋㅋ,0,1,1
사진 보니까 저출산 고령화가 뭔지 실감이 확 온다!,0,0,0
75살 ㅋㅋ  짐덩어리 ㅋ,1,1,1
허걱.. 갈수록 전쟁놀이에 미쳐가는 2찍이 정권...,1,1,1
뼈방패 말고 정복자 들어라,0,1,1
드론이 의미없다고 그냥 지나치지 싶다,0,0,0
촬영한다고 전투복 A급 받으셨네 ㅋㅋㅋ,0,1,1
대단하신분들임..산업화의 역군들이 이젠 국토방위까지!,0,0,1
할말이 안나온다만 그래도 노인 일자리 창출로서는 나쁘지는 않지만 저분들이 저 일 감당가능할라나? 근데 할머니는 왜 모집 안하나?,0,0,1
이거 완전 2차대전 홈가드,0,1,1
"손의위치가다다르네요격례할때  눈썹위에하는분. 손을칼날하는분
 손을 약간꺽어서하는분
  /하는분.  시대별군생활이보이네요",0,0,0
하......정말..... 심각한뎅..,0,0,0
쓰러지면 사단장은 옷벗고 아들은 국가유공자네요...,1,1,1
국개의원들부터 입대시키자,1,1,1
상당히 걱정되는 문제다..,0,0,0
위험해 보입니다~ 총 떨구거나 수류탄 우리쪽에서 터지는등 사기저하가 더 크지 않을까요,0,1,0
난리났네 ㅋㅋㅋㅋㅋㅋㅋㅋㅋㅋㅋㅋㅋㅋㅋㅋㅋㅋㅋㅋㅋㅋㅋㅋㅋㅋㅋㅋㅋ,0,0,1
이등병 생활 좀 시켜라. 그리고 목소리가 작으면 혼내라.,1,1,1
존경합니다. 짝짝짝!!■■■■■,0,0,1
나라가 미쳐돌아가네 아주. 의무를 다 했는데 또 밀어 처 넣고 자빠졌네. 이게 나라냐?,1,1,1
참 대단하다 그놈의 여자가뭐라고ㅋㅋ 노인들쥐어짜네ㅋㅋㅋ,1,1,1
전방 수류탄도 못하는 2찍 틀베이들이 세금으로 모인게 킬포인트,1,1,1
세금만 축내고 병원비 청구만 하시는건 아니겠죠?,1,1,1
할일없으니 별짓거리 다하네~,1,1,1
가늠자나 제대로 보이겠냐?,0,1,1
북한에서 하던짓거리 똑같이 하고앉았네 ㅋㅋ 2찍들아 총알받이나해라,1,1,1
형들이 나섰는  우리 미필석렬이는 오데갔노?,1,1,0
ㅋㅋ 하루 일당이 얼마인지~~ㅉㅉ 이러니 안보가 아니라 부정부패의 돈이 득실거리는 국방부가 되었지,1,1,1
나라를지키겠다는 노병들멋지십니다.  찢과삶소대는언짠아하겠지만.,0,1,1
총알받이라도 하겠다는건가?,0,1,0
내일 당장 우크라 전선으로 보내라... 나름 쓸만한 하루살이 총알받이들 ㅋ,1,1,1
젊은 현역 군인들에게 꼰대 역 할까 두렵다. 본인들께서 마음이야 젊다고 생각할지 모르나 군 생활 기본 활동 이 녹녹하지 안 잔아요.,0,0,1
이게 맞지. 안보엔 나이가 없다. 고로 전방 보초에 5-60대 세우는 법안 빠르게 통과 시켜야한다,0,0,1
쓸데없는 돈만 나간다 ㆍ그냥들 계시소,1,1,1
노인들까지 전쟁준비 시킨다고 소문나면 외국에서 누가 투자하려고 할까....,0,1,1
모병제로 전환한뒤 현역을 강하게 훈련 시키면 됩니다,0,0,1
잔여수명 부담 없는...  진정한 총알받이 ㅋ,1,1,1
노인 특공대 우크라이나로 보내자,1,1,1
전쟁 부추기는 윤정권 지긋지긋하다. 이젠  100살  먹은  노인들도  동원할  태세네.  에휴,1,1,1
왜..? 전쟁이라도 내시게? 의도가 뭐냐??,0,1,1
똥을싸라 저나이에 완전군장하고 몇미터나 갈수있겠냐?,1,1,1
제발 사교육비 좀 줄이게 공부를 제대로 가르쳐주세요  자연친화적 체험 예체능 이런거 집에서 다 할수 있어요 폐지 찬성해요,0,0,0
민주당 박종훈 텃밭 만드는 조례 혈세 120억으로 콩고물 떨어뜨려 학교 내 전교조와 아줌마들 용돈 줘서 민주당원 만드는 조례라는데 맞나요???,1,1,1
교사 질 떨어뜨려놓더니 이젠 무능한마을교사들 들여서 아이교육 망치려고 합니까편파적인 간담회였어요. 끝까지 실망스럽네요,1,1,1
학모부가 아이들의 역량을 떨어뜨려서 폐지에 찬성했는데 그걸 또 살리겠다니 정말 어이없다.그들만 좋아하는 이상한 조례~~,1,1,1
폐지 적극적으로 찬성합니다,0,0,0
"나랏돈으로 이런 쓰레기짓 하지마시요!!!어이없네요~~~~
그런돈으로 아이들 출생에
더 힘을 쏟아주시요!!!!",1,1,1
"폐지찬성우리아이들 이용해서 세금낭비하지마세요.
자연은부모님이랑같이공유합니다
교육을엉뚱한비전문가에게맡기지마세요",1,1,1
마을교육공동체 폐지를 찬성합니다,0,0,1
"폐지 적극 찬성합니다.폐지하라!!
폐지하라!!
쓰야할 곳에 재정이 들어가야 하는데 지금  나라의 위기를 인식 못하나요!!",0,1,1
마을 교육 공동체 조례안 강력히 반대한다,0,0,1
낙관적인게  아니라 지금 무정부 수준이라 그렇다.,0,0,1
일본학자도  공부 좀해라 낙관주의가 아니라  무능해서 아무것도 못하는거야,1,1,1
뭘 알아야 낙관이고비관이고 대책을 세우죠. 아는건 오직 혈세 낭비뿐ᆢ,1,1,1
낙관주의가 아니라 그냥 대책없음임.,0,1,0
"지금 이시국에 지앞일도 처리못하는데 그럴정신이 있겠냐구요 이러다 나라가 
어떻게 되겠노 한심하다",1,1,1
"바이든에 나라를 통채로 맏겨버렸음.끝,",0,1,1
자체 핵개발이 최고의 방어이고 대항마다 핵무장 하자 자자손손 후대에게 사대주의를 물려줄 수는 없지 않나,1,1,1
건희 지키느라 그쪽볼 경황이 아니란다,0,1,0
우리. 쎄쎄는 다 계획이 밌나보지 그래서 그렇게 잘난것들이 재임기간내 쩔쩔했냐,1,1,1
