comment,SEJ_label,PEJ_label,MRJ_label
대통령하나 잔못 뽑아서 이게 뭔일이고!,1,1,1
쓰레기.정원이 같은 쓰레기.언론이 쓰레기 통에서 주워온 쓰레기 기사,1,1,1
꼴에 잘보이려다 팽당하다!,1,1,1
저런것도 여자라고 쯧쯧  누가 데리고 사는지 못생긴게 못된짓만 하는군,1,1,1
빨리 통신기록 수집해라... 말보다 증거다.... 시간끌기 작작해라...,1,1,0
관상은 과학이다 ㄱㅋㅋㅋㅋ,0,0,1
2년  2년.. 구속 되는것좀 보자,0,1,1
전부다 수사해서 구속하자하긴 윤대통령이  봐주니 무서운을 모르지,1,1,1
팽당한거니 이참에 사실그대로 불어라,0,1,1
채상병특검  통과!!!김웅 유일하게 찬성한 국짐의 진짜 국회의원....안철수는 이번에도 철수함...쥬뎅이와 마음이 다른 이중인격자,1,1,1
버리는 카드군. 진실을 말하라,0,1,1
꼬리 자르기 시작 ㅋㅋ,0,1,0
꼬리자르기냐..한심하다,1,1,0
실제로 주먹들기 시작하면 똥오줌 지릴 것들이 야야 덤벼봐 아뵤아뵤 거리는 꼬라지 진짜 보기 싫네,1,1,1
북한 김씨왕조와 그 추종 핵심 노동당원 10만명  !!,0,1,1
갑자기???위기탈출 용산 뭐 이런시도 아니고???,0,0,1
쌀떨어졌나ㅋㅋ 장난전화 돌리려나보네,0,0,1
김정은 딸래미를 후계자로 만들려고 업적 쌓기 시작 할 거다...어떠한 형태로든 무력 도발을 감행 할 것이다. 김정은이 후계자로 나왔을 때 처럼./,1,1,1
야 야  또 쑈하지말아라... 북한 팔아먹기 말구 다른 종목 없냐... 식상한다.,1,1,1
윤석열 정부는 뭘 해도 신뢰를 못하겠다.,1,1,0
조만간 북한에 또 총 쏴달라고 하는 건 아니겠지? ㅉㅉㅉ,0,1,1
야권은 뭐하냐. 지금 북한을 욕해야지. 왜 가만히 있어?,0,1,1
서울. 정치 인 들만 공격 하라. 일반 시민들  위해는  하지 마라,0,1,1
보안은 어쩌고 공개를 하냐? 이러니 쑈한다는 소리를 듣는거다.,1,1,1
쌍팔년도 북풍몰이 집어치워라,1,1,0
북한 김정은 발작 도발하면 도발원점 지도부 궤멸 김정은 지도부 일가족 참수하고 이스라엘이 하마스 제거하듯이 뿌리뽑아내야 한다,1,1,1
방어가 최선인데 전정권에서 다 말아먹고 파괴해놓아서 걱정이네요. 자유대한민국 화이팅,0,0,1
그러게 깅상도도 인구좀늘려바라 밤낫없이 돈만벌지말고 ㅎㅎ,1,0,1
절라도에 테러하면 좋겠다,1,1,1
국정원 아직도 살아있네^^국내간첩은 경찰이 잘 확인바랍니다.,0,1,1
오 일본 전범국 풀릴 때 손 놓고 당한 이유가 이걸까? 일본 데리고 북한이랑 전쟁 꼬우^^ 하려고?,0,1,1
선조치 후보고. 정보첩보기관 기본 시스템 모르냐? 이걸 알린다고 일개 시민이 대처하냐? 타이밍 노려서 정치기사 흘리지 마 좀.,1,1,1
첩보는 확실한겨~?  옛날처럼 북풍이런거 아니지~?,0,1,1
첩보 입수했으면 조용히 처리하고 알려라. 모지리 정권이라 믿을 수 있어야지..,1,1,1
"정권 잡고 마구 헤쳐먹거나 아무것도 안하다가 지지율 박살나면, 북한 찾고 간첩 찾지 ㅋㅋ 보수 특징",1,1,1
"이 악랄한ㅈ북괴 어찌 하오리까.자유의 투지로 꼭 물리쳐야 합니다.
공산당은 씨를 말려야 합니다.",1,1,1
이상황에 경기북도를 평화자치도?!윤대통령님 굳건한 한미동맹으로 대한민국 지켜주세요.,0,0,0
ㅋㅋㅋㅋㅋㅋㅋㅋㅋㅋㅋㅋㅋㅋㅋ,0,0,0
북한의 우리대사관테러는 한국본토에대한공격으로 우리도 북한지역을 보복공격해야한다.,0,1,1
드디어 공작기사 날조기사 나오기 시작하네 매국대통령 이제 진짜 급한가보다 ㅋ 그런데 어쩌나 국민이 너무 똑똑해 매국노놈들 너네 마음대로 되짆않을거다ㅋ,1,1,1
와 중앙일보만 이뉴스를.. 엄청빠르네요.,0,0,0
억지 자작극 책동 중단하라,1,1,0
이럴때 북한이 뭔가해줘야  정부와 국힘이 힘들받는대? 우리영해쪽에  포사격   아니면  좀 뭐라도,0,1,1
테러해라 ㅋㅋ 한판붙자 ㅋㅋ,1,1,1
"재명아, 니 살겠다고 적에게 나라를 팔아넘기냐?",1,1,1
이러한 상황에서 경기북부는 평화누리자치도로 설정한단다. 이를 반드시 막아야 한다.,0,0,1
또 북풍이네 진짜 ㅋㅋㅋㅋㅋ 지겹지도 않냐?,1,1,1
"범죄하다 걸리면 검찰독재 한다고 외치는 좌파,",1,1,1
"또 간첩들이 날뛰는구나!제발 서로 헐뜯지 말고 국민을 위한 생각을, 국회의원하는동안 딱 한번만 이라도 하고 물러나면 좋겠다!더러운것들!",1,1,1
정진석이 나와서 고구마 먹다가 목메는 소릴 하던데 아무리 반항을 해봤자 특검을 거부하는자가 범인이다. 그렇지않냐 윤석열…,0,1,1
여러소리필요없지 탄핵이다,0,1,1
이동네는 좌파 천국이네 저게 전부 니들 세금인거 머르나? 멍청이들 뭐 요건 하긴 해야 하는데 너무 크게 한다,1,1,1
채 상병문제도 민생을 돌보는것이다  석렬이힘은 국민의 데변자로 세비를 받고 있다  석렬이 대변자가 아니다,1,0,1
굥타넥 가자 국짐 똑봐로 해라,0,1,1
도리도리 하는게 습관인가?  미스테리네~~,1,0,0
음~~~~! 기사내용을 보니 특검을 거부하는자가 범인이맞네 !!,0,1,1
돼지본인과  마누라 관련 특검을 거부하는게  그 잘난  주디로  떠들던  공정과   상식이냐?      특검을  거부하는 넘이  범인이라며?,1,1,1
윤석열은 특검받고 옷 벗을 준비해라,1,1,1
역대급 대통령은 맞는듯 얼릉 하야해라 그래야 보수가 산다  니가 3년더하면  보수는 좌멸이다,1,1,1
대통령도 수사대상인데 본인이 거부한다 말이 안되지 그럼 그만 두라,0,1,1
보여주기식 하지마소!특검 받고 따따블로 가소!,1,1,1
윤거니 끌어내립시다!!,1,1,1
특검을 거부하는자가 범인이다.,1,1,1
공수처를 문재앙이 급하게 만들고 떠난 게 특검을 남발하지 않겠다고 거짓말 한 것으로 드러났다,1,1,1
채해병 죽음 수사조작의 몸통이자 수괴를 철저히 응징하려고 특검을 띄우는 거다. 거부하는 놈이 범인이다.,1,1,1
특검을 거부하는 자가 범인이다.,1,1,0
특검을 하면 사단장 비호사건의 배후가 누구로 나올까? 윤석열일까? 아니면 제3의 인물이 있을까? 거참 궁금하네.,0,0,1
2찌익들은 말한다 지들이 보수라고 ㅎㅎ 대한민국 2찍들은 보수를 가장한 유우운떡 또오올마아니들에 불과하다는게 팩트다 ㅋㅋ,1,1,1
특검을 거부하는 자가 범인이다라고 누군가가 말했지...,0,1,0
당연히 윤가도 포함이지 구린내가 진동하니 거부권..,1,1,1
반드시 특검법을 통과 해야합니다!,0,0,0
석열이가 대통령 후보 토론때  말했다  특검 거부한자가  범인이라고 그러니 거부권하지말어라 범인 아니면,1,1,1
왜? 최순실때는 신나게 두들겨 패놓고...이제는 니들 차례!!,1,1,1
피의 사실 공표 지들이 매번 해 오던  거잖아,0,1,1
돌 10개와 국적당은 또 거부권을 행사하겠지? 거부권 좋아하다 한번은 식겁할꺼다. 국민들이 두눈 크게뜨고 지켜보고있다.,1,1,1
정치이념의 문제가 아닌 걍 군대간 우리들의 자식이 부당한 명령으로 사망한 사고다!국힘의원들! 국민들이 지켜보고 있다는걸 명심해라!,0,0,1
이재명 은 언제나. 처리?  검찰공화국 소리 들으면서 무능 입증.,1,1,1
작업하다 죽은 군인 하나 때문에 온나라가 시끄럽네. 하긴 사회를 시끄럽게 만드는 것이 좌파의 본질이지만...,1,1,1
거부하면 또올리고 또 올리고 질릴태까지 올려라 그게 국민 명령이다.,0,1,1
거부하는 자가 범인이다,1,1,0
일베 대구경북만빼고 압도적으로 특검찬성한다 채상병특검에 좌우문제가 아니란거다,1,0,1
안 철수는 입과 다리가 따로따로 움직인다ㆍ이번에도 다리를 이용해서 도망갔구나ㆍ약속이나 지켜라ㆍ손가락 잘라ㆍ비굴한 것 ㆍ,1,1,1
거부권? 다시 광화문에 모이자.,0,0,1
대통령이 지시를 했다고 하면서 또 다시 언론이 대대적으로 거짓 선동 하고 탄핵 몰이 하겠다 이거지 천상 쿠데타 외에는 답이 없는 나라다.,1,1,1
국가예비비를 용산이전에 해외여행에 천억넘게 썼다 도둑넘,1,1,1
친일매국노 무당주정뱅이 깜빵보내자,1,1,1
도라도리 또 거부권 허면 건희도 특검 하고  윤탄핵 감이다,0,1,1
국가에서 희생된 젊은이의 죽음을 파악하는 것이 왜 특검대상이 되야 하나. 저 용산배불뚝이가 나라를 개판만들고 있다,1,1,1
격노 윤뚱이 책임 질 시간이 왔다,0,1,0
술주정뱅이  돼지마리가  대한민국을  쏙대밭으로 만드네.....  니가  쓴 용산이전600억.  해외순방 500억  모두 갚고  감옥에 쳐 들어가라,1,1,1
응 거부권^^ 탄핵? 개나줘ㅋ 200석 안되서 의회부터 부결이야^^,1,1,1
"화재 진압하다 돌아가신 소방관, 치안에 힘쓰다 돌아가신 경찰관 관련된 사고도 다 특검해라!!",0,1,1
그걸로 탄핵이면 이재명은 사형이지,0,1,1
김건희농간에 윤썩녈이도 죽는거지,1,1,1
윤꼴통 거부권 쓰면 골로 간다. 바로 탄핵운동 들불처럼 일어난다.,1,1,1
내가 태어나서부터 보수로 살았는데 윤석열은 정말 아니다. 보수도 진보도 아닌 어중간하게 무능하기만 한 사람.,1,1,1
거부권 순간 탄핵 이다,0,1,1
앞으로 억울한 사망자 다 특검법 만들자.채상병만 억울 해?운전자 입장에서 민식이 법은 악법이다.부모?,0,1,1
"윤석열, 민심을 거스르는 자들의 우두머리!그 말로가 비참하다는 교훈을 후세가 알도록 해야 이 나라에 희망과 번영이 함께 할 것이다.",0,1,1
거부권 행사하겠지뭐. 찔리는게 많으니깐. 떳떳하면 특검법 받고 당당히 조사받고선 나중에 몰아부치면 되지 않겠니?,1,1,1
정의 로운 나라에서 살고싶다,0,0,0
에라이 경향 지라시야~^^그리좋냐~..^^반 국가단체~..,1,1,1
"윤모지리는거부하지
지가수사대상이란걸
잘아니까",1,1,1
윤통과 국짐은 채상병 특검 거부권 행사하면 대한민국 전 국민의 저항을 받을 것이다,0,1,1
국민이  주인이다  모지리 윤가 는  착각  하지  마라,1,1,1
촛불집회 준비해야겠다.,0,0,0
이사건으로   윤가는   끝났다,1,1,0
저런 짓 하라고 대통령 뽑아준 거 아니잖아 선례를 남기기 위해서라도 당연히 수사 대상에 넣어야지 그게 진짜 공정과 상식이지,0,0,1
거부하는자가  범인인겨,0,1,1
땡열아 채상병특검에 왜이리 민감하냐? 찔리는게 있나보네?ㅎ 반드시 뱀머리 찾아 잘라버리먼  좋겠다.,1,1,1
국힘은 윤석열 이참에 결별해라그래야 니들도살고 나라도산다,0,1,1
윤통령 말대로 죄진게 없다면 거부할 이유가 없지 않은가?,0,1,1
특검 거부하는 자가 범인이다.,1,1,1
멧돼지를 포획틀안에 가두는날이 대한민국 경사,1,1,1
드뎌 나라에 망쪼가 드는구만~~~이게 아무생각없이 반대파 찍은 결과란다,1,1,1
아 그런데 해병선배 정말 멋있다 ...선배들보니 군대생활 할말하지 ㅋㅋ,0,0,1
"여러말  필요없고,  특검거부한놈이  범인이다!!!😡😠👿",1,1,1
윤석열을 하루빨리 탄핵하고 이재명을 대통령으로 만들어 부자놈들 재산을 압류하여 서민들에게 보조금을 뿌리게 해야한다. 힘들어서 더 이상 못살겠다!,1,1,1
국정을  가슴없이 검사시절같이 무대뽀로하니 사고만치지.ㅉㅉ 대한민국에 왜 태어나가지고 쩝.. 일본에 태어나서 일본이나 쑥대밭  만들지..참-나,1,1,1
혐의자들 사돈에 팔촌까지 싹다 털어버려라!남의 눈에 눈물나게 했으면 지들 눈엔 피눈물 날각오는 했겠지!,1,1,1
"이렇게 많은 인원이 필요한가,,대통령실과 국방부 전화통화 내용만 알아내도 되는 것을",0,0,1
불쌍한 아들 이제야 억울한 죽음에서 놓임을 받겠구나!,0,1,1
채상병은 원인밝혀야지...쬐명이 조국도 감빵가고,1,1,1
결국 또 탄핵쇼 2탄이지 뭐,0,1,1
탄핵열차 출발합니다~ 뿡 뿡~~ 사필귀정!!!,0,0,1
최순실은 디올녀에 비하면 양반이다.,1,1,1
윤썩렬은 특검 받아서 수사 받아라 국민들은 알고 있다,1,1,1
"특검 거부하는자가 범인이야. 석열아, 떳떳하면 특검받고 털고 가라. 거부할수록 더 추해진다.",1,1,1
가자 특검. 개석렬불통령 종말이 보인다.,1,1,1
Good!!달라진 민주당.이재명의 민주당 계속 지지한다.,0,0,0
모지리는 왜 해야할일은 안하고 안해야할 일만 골라서 할까 진짜 무식한 도그베이비,1,1,1
박근혜 시즌2 윤완용정부,0,1,1
국힘당은 윤석열을 하루라도 빨리 손절해라~,1,1,1
떨리냐? 용궁 개돼지 ㅋㅋㅋㅋㅋㅋㅋㅋㅋㅋㅋㅋ,1,1,1
탄핵이 하루 빨리 되어야 한다. 나라의 정상화를 위해서라도 영남 국짐당은 사라져야 한다.,1,1,1
이러면 채상병 영혼이  소란스러워 잠들수 있을까??,0,1,0
윤두창아 또 거부권이냐?,1,1,0
이제 부역자들의 손가락이 모두 윤석렬을 가리킬때가 오는구나..,1,1,1
VIP가 그만한 일로 사단장  책임 물으면 누가 사단장  하냐?  격 노햇다고  했지..아들이 없으니 ...저런 헛소릴 하지,1,1,1
이상하게 돌아가네. 그냥 다들 싸잡아서 북한 보내면 안되나 어차피 좋아할텐데,1,1,1
잘한다 한국에 있는 더러운 일본간첩의 씨를 말려 버려야 한다,1,1,1
이번에 거부권 하면 끝장인줄 알아라,0,1,1
특검 거부하는 자가 범인이라고 윤석열 본인이 말 했잖아?  스스로 범죄 인정하는구나ㆍ좋은 말로 할 때 그만 내려와라ㆍ,0,1,1
거부하는 자가 범인이다 구속하라,0,1,1
이번에 또 거부하면 반드시 탄핵으로 가야한다.,1,0,1
석열이 지시 100프로.,0,1,1
이건은 수사하나 마나 대통령이 지시했어도 심각한 문제고 대통령  모르고 대통령실에서 몰래 관여했다면 그것또한 심각한 문제,0,0,1
누굴 구해보겠다고 윤가가 설쳤나,1,1,1
"북한과년문제는언급도안하는
반역자들",1,1,1
개고기 목덜미 한번 제대로 물고 끝내자,1,1,1
"이제 나라가 좀 돌아가는듯 하는군 야당들 화이팅~!!!!이어서 거늬랑똥후니특검도 빨리하고,병원도 정상화 시키고 짬짬이 민생,경제도 챙겨 주시길~~!!!!",0,0,1
이 문제야말로 좌 우가 없는 안건임....,0,0,0
피의 사실 공표죄는 편리한 대로 가져다 붙이는 듯!!,0,0,0
놀고들 자빠졌네   .     채상병  사망사건을  니네들이 정치적으로  이용하는거지   .     대통령 거부권 정당하다,1,1,1
국민의짐이 특검을 왜 거부 하는지는 국민들이 다 안다. 용산돼지가 최고 윗선이기 때문이다. 그런데 무슨 🐕 소릴 해대며 국민들 국민들 하냐.,1,1,1
윤석렬은 무슨 사단장 하나 지키겠다고 수사 외압을 넣어서 어리석다 어리석어,1,1,1
■□■ 서해 공무원 사망조작  ㆍ귀순병사 강제북송 두 사건도 특검해야지,0,0,1
윤대통령 비상계엄령 즉시 선포하고 물불가리지 말고 모조리 잡아들이시오,0,1,1
특검을 거부하는 자가 범인이다,1,1,1
당연 거부지...지가 범인(개) 인데,1,1,1
미필은 해병대에게 대들지마라 당랑거철이다,1,1,1
요샌 뭐가 중한건지 모르겠다~,0,0,0
5.18  유공자 명단부터 까라....이재명 때문에 5명이 자살한것은 왜 주디닥치고 있냐?  차라리 이번기회에 전라도와 갈라서자,1,1,1
탄핵의 길로 접어드네~~ㅠㅠ,0,0,0
당연히 윤깡패 주도로 이루어졌지,0,1,1
당근. 그자석이  주범.가막소로보내야쥐.,1,1,1
얼마나   나쁜짓거리을    했나   특검을  거부한  사람이   범인이다   윤바리   말씀   그러면   답이나왔네?,1,1,1
ㅋㅋㅋㅋㅋ 명목상 채상병 속내는 정치 공격. 일은 언제할런지.,0,1,1
제2의 세웛호 빅근혜편 인가?,0,1,1
더불어당 양심불량하다...... ........ 박근혜 탄핵 당일 헌재  앞에서 경찰과 충돌하여 피투성이로 숨진 박군혜 지지자는 왜 아닥하냐 ?,1,1,1
이쯤이면 버티지 말고 내려와라,0,1,1
능력이 안되면 내려와라,1,1,1
놀고들있내? 연못물이 썩으면? 가재 붕어 미꾸리 잉어 가물치 이무기 까정 몽주리 뒤지던디? 모르능겨? ㅎㅎㅎ,1,1,0
잘한다 은폐하는놈들싹다잡아쳐넣어라,1,1,1
대통령이 뭐하는 사람인지. 이제 와서 무슨 104명의 수사진을 포진.하여튼 쇼를 좋아하시는군요. 댓글 조심해서 달아야지.괜히 잡혀 갈라.,1,1,1
손가락 짜르고 싶다 할거다하고. 찬성표도 던진다더니 안철수 어디갔지?,1,1,1
국민의힘은 이제 영남 자민련에 불가하다. 여당이면서 퇴장을 밥먹듯이 하니ㅜㅜ,1,1,1
김웅만 진정한 국회의원이네,0,0,0
윤석렬은 보수가 아니다. 보수라고 속지들 말아야한다 공정.상십.정의 .자유가 보수 가치 아닌가?,0,0,1
정의는 살아있다! 불공정과 몰상식 국민의 이름으로 처단하자,0,0,1
경향 이런 이적단체 하루 빨리 퍠간조치 바랍니다. 그리고 기사 쓴 자 정말 조사가 팔요해보입니다.,1,1,1
윤바보를 집으로 보내자,1,1,1
쫄리면 그냥 하야해라..,1,1,1
윤썩렬이 죽을 날이 가깝다.,1,1,1
이재명 김혜경 특검 귝민의  이름으로 발의한다,0,0,0
일좀 하는구나 민주당. 175석 그냥준게 아니다.정신차리라,1,1,1
종북주사파 범법자 집합소가 나라를 어지럽게 하니  곧 사회주의 국가로 바뀌겟네..,1,1,1
화이팅!!!!!!!!!!!!!!!         안철수는 정체가 뭡니까?,0,0,1
특검 화이팅  제발 속시원하게 밝혀라,0,0,0
이번에 거부권 행사 하면 국짐이 두 쪽 난다 거부권 찬성 국짐은 영남당으로 자민련 꼴 나는거고 탈당파가 나와서 준석이 하고 합칠거 같다,1,0,1
안철수는 또 숨어버렸지요ㅋㅋㅋㅋㅋㅋㅋㅋ,1,1,1
꼭 해야한다! 국민의 명령이다! 특검을 피하는자가 범인이다! 자기가 스스로 한테 한말이지~~~,0,1,1
때가왔다. 마침내 미친개  몰아낼,1,1,1
"좌 우 모두에 관심사다.국힘 놈들 퇴장하는 꼬락서니 보라.
세비가 아까워서 말도 안나와 저런 쓰레기 집단 국민을 위한 다고 ???",1,1,1
피고인 야당 대표 사건도 국조 또는 영장 재 심사 해 봤으면 좋겠다..,0,0,0
특검을 거부하는 자가 범인이라고 했더라...,0,1,1
뚜껑이도 빨리 특검해서 잡아 넣어라,1,1,1
윤석렬을 탄핵하고 국가보안법으로 처벌하자,1,1,1
윤명신 물러나라  더있다간 더 험한꼴 본다.부부 윤쥬쥴리 수갑 차고 구속된다.,1,1,1
수사 대상이 아니라 주범이지!!얼굴 떡하니 나온 김학이도 무죄때린 판사가 과연..,0,1,1
나라야 망하던 말던..,0,1,0
"채상병특검..이태원특검..  다 처리후김건희 특검.. 한동훈특검도  꼭  하길...
대한민국   민주공화국임을",0,0,0
본인이 연루된 사건인데 본인이 거부권을 행사한다는게 말이돼? 무슨 자기가 황제야?,1,1,1
민주당은 세게 나가라고 국민들이 뽑아준것입니다. 저번처람 어정쩡하다가는 다음 대권도 2찍들에게 내주게 될것입니다.,0,1,1
특검을 거부하는 몸통을 제대로 수사하자 !,0,0,1
윤정권은 보수정권이 아니다 사이비보수다. 전국의 예비역들이 봉기한다. 또 거부해봐라. 이것들아 한줌의 재로 돌아갈 것.,1,1,1
특검을  거부하는 자가 범인이라고 지 입으로 떠들어놓고는ᆢ,1,1,1
"대한민국엔 진정한 보수는 거의 찿아볼수 없다.   다만,  썩어문드러질은 있다.",1,1,1
"이화영 대북송금에 현근택이 증거인멸했다고 변호사협회에서 징계한다고했다 ㅡ박찬대,정성호 이런것들이  종식시켜야한다",1,1,1
민주당은 왜 민심이 다시한번 기회를 줬는지 깨닫길바란다.무기력하게 물러서지말고 끝까지 밀어부쳐서 억울하게 세상을등진 채상병의 넋을 위로해줘야할것이다.,0,0,0
죄 있는 넘이 특검 거부한다고 누가 그랬다더라,0,1,1
특검도 필요없다 빨리 탄핵 많이 나와서 살길입니다,0,1,1
진실을 밝혀서 죄지은것들이 벌받게 해야지,0,0,1
더불어도적떼의 수괴는 걸림돌되는자 5명 이나 제거했는데 죽기살기로 달려드는더불어도적떼를 상대로 젠틀하게 대해서 나라를 어떻게치키나?,1,1,1
이게 무슨 혈세 낭비냐? 제발 그만둬라..,1,1,1
윤썩열이 말했지.. 죄지은 놈이 거부권 행사한다고.. 이번에 함 보자..,1,1,1
왜 또 이런걸로 선동질하게?ㅋ아닌거같아도 그간 너무 뻔히보이는 계략이라.별로야.,1,0,1
윤썩열과 국짐.. 똥줄타겠구나.. 그러게 평소 정당하게 살아야지.. 암튼 시원하다.,1,1,1
현장지휘관인 돌이라 난 사고를~~ㅉㅉ 좌파넘들 때,1,1,1
그렇지 국력은 이런데 쓰고 민생은 외면해야 민주당이지~~,1,1,1
채상병 특검 좋다 하자. 그런데 서해공무원 월북 조작사건은 왜 안해? 그때는 그렇고 지금은 다른가? 그러니까 정치특검이라 하는 겨!,0,0,0
국짐들아 니네 찬성안하면 큰일이 날껴~~,1,1,1
"미쳤어!  미쳤어! 곱게. 미쳐라? 라도들아!  선전선동에 국민들놀아나서. 총선이기니. 눈에뵈는게없겠지, 하늘이 노한다! 반드시 역풍맞는다.",1,1,1
이준석의 개신당은 역시나 국짐인가?  전원  불참이세네.,1,1,0
대통령이 외압을 주도한것으로 보이는데 그럴 경우 탄핵사유가 되는지 궁금하네요.,0,0,0
증거1). 대통령실에서 전화 걸었다.ㅡ증거 2).이시원대통령비서실 공직기강비서관이 개입했다.,0,0,0
말이 대통령이지 실질적으론 실물 대령통임 윤석열이 정책적으로 할수있는게 없음,0,1,1
탄핵 운운하면  박근혜 때 같이  앉아서 당해서는 절대로 안된다,0,1,1
70일 너무 짧다!!!,0,0,0
대통령 임기를 2년제로 해야 할 것 같다. 범법자들이 많으니. 법률불감증.,0,1,1
대한민국>>>>이제 시작이다,0,0,0
나라 제대로 세웁시다 .윤 멍멍이  구속.,1,1,1
이죄명과 개빡친 국개들 다 특검해라. 대통령이 임명한 특벌검사로.,1,1,1
이태원. 채상병. 특검은 이재명 독재 정치의 상징이다,1,1,1
이게 나라야 미처가는구나,1,1,0
"특검,특검.이제는 대한특검공화국이다.",0,0,1
윤석열이 그냥 내려오는게 제일 좋은 방법인데.,1,1,1
나라 퇴행시키는 왜구앞잽이 수괴.. 탄핵 가자.,1,1,1
뻔하지 특검해서 대통령탁핵 명문만들기 대통령은 반드시 거부해야된다,1,1,1
석렬이 이재 순방(쇼핑) 시작하는거임?? 건희는 화물로 숨어서 타고?,0,1,1
군인을 등한시하는 보수가 보수냐? 타국이익 우선하고 자국민 안전을 등한시 하는게 보수야?,0,1,1
2찍은 더이상 보수가 아니라 친일 개돼지임,1,1,1
"피의사실공표 ㅋㅋㅋ지금 검찰이 하고 있는 짓거리 아닌가?
그럼 검찰도 문제있는거네
참나",1,1,0
거부권 행사하면 내가 범인이다 라고 자백하는거다.,0,1,1
국힘도 특검에 찬성해라!!  안그러면 윤통과 같이 국힘도 영원히 아웃이다!!,1,1,1
"석열아 권선징악, 자업자득  알지? 거부권 행사하면 탄핵 국면으로 간다",1,1,1
사실을 숨기고 싶어하는 놈들이 범인이다,1,1,1
안철수는 또 철수....국회의원 왜하니... 윤석열 곧 끝나겠네,1,1,1
윤완용은 거부권행사 지가한 짖을아니까~,0,1,0
특검 추천을 여당이 하면 더이상 특검이 특검이 아니게 되는데 이게 어떻게 독소조항임?,0,0,0
국민이 총선에서 거부권을 박탈하라는 명령이었다 정신 차려라,0,1,1
'거부하는놈이 범인이다 ' 윤꼴똥 왈왈,1,1,1
거부권 쓰면 하야하던지 탄핵되던지..옷 벗어라 !!!,1,1,1
마음대로해라~반사하면 끝!!!ㅎ,0,0,1
윤석열 조져버려!!!! 쳐!!!,1,1,1
대통령실은 살인자집단  국짐당은 국민살인당,1,1,1
특검보 3명의 검사들은 그야말로 정의로우신 검사님들로 임명하세요 줄을 잘서서 입신출세 하려는 정치검사들은 배제하세요,0,0,1
최종 몸통이 누군지 국민들은 모두 알고있는데요 상당히 증거인멸을 잘해야 할거다 말맞추는거 잡아내는 선수급 검사들로 특검보 임명하세요,0,0,1
"이제 검사들도 제대로 철저히~ 수사하고, 진실을 밝혀서, 썩어 빠지 검새들과 정치 협잡꾼들 색출해내야 한다~!!!",1,1,1
좌파들이 설쳐봐야 거부하면 그만인데? 거부권은 대통령 권한인데 권한 쓰면 탄핵이래 ㅋㅋㅋ 이게 좌파 능지수준이지 ㅋㅋㅋ,1,1,1
윤석열.김건희 깜방갈 시간이 다가오네..,1,1,1
아주 잔치가 나셧네 ㅋㅋ챠상병 조문은 한번이라도 가고 저러나?ㅋㅋ,1,1,1
