comment,SEJ_label,PEJ_label,MRJ_label
이런것도 중요한데. 핵만들자!!!민주당.시민단체.여성단체.등등 온갖 단체들 좀 가만히 있든 얘들 몰래 핵 좀 만들자 응?,1,1,1
핵 보유국으로 가는게 훨씬 좋을수도 있다,0,1,1
성인지예산 1년치로 항공모함 5척 만들 수 있구나 우리나라 대단해,0,0,1
항모는 강대국의 대체불가재.,0,0,0
"항모는 대표적인 원정용 공격무기인데, 영국이나 미국,호주,인도 공격할거 아니면 왜 필요한가요?차라리 울릉도와 마라도를 공군기지로 만드세여.",0,0,1
싸구려 드론앞에서 무용지물,0,1,1
우리나라 상황 상 항모 필요성이 낮지...,0,0,0
저거 자폭드론 한두대면 걍 골로감 ㅋㅋㅋ,1,1,1
"한국의 적이 한국으로부터 전부 1000km 안에 있는데, 항모 있어봤자 무쓸모다. 항모보다 미사일이 더 필요하다",0,0,1
항모..전쟁나면 핵의 표적이 되지 않을까..느린데다 바다위에있어서 주변 피폭도 좀 자유롭고..,0,1,1
우리나라는 눈물이 만은 나라다!  앞으로 그런 일이 없었으면 좋겠다.  핵 갖자! ! !,0,1,1
그래봤자 중국 경량 핵탄두하나면 증발,1,1,1
드론에 폭탄 달고 몇십대 가서 자폭해도 괜찮을 정도의 자폭 대비도 해야 할 듯요..,1,1,1
벌떼드론과 대함미사일에 이제는 석기시대의 유물이되어버린 항공모함에 너무 부러워말자.,0,0,1
너무 좋다 우리나라도 키티호크급 항모 두척만 만들었음 좋겠다,0,0,1
개발비용이야  지들 부르기 나름이지,0,0,1
아직도 밥 굶는 사람들이 있는 시점에서 수조원을 사람 죽이는 무기에 쏟아 붙는것이 무슨 의미가 있을까 누구를 위한 나라일까,0,1,0
국방의무 면탈 했다고 ㅡㅡ 그것이 아니고 ㅡ 미  해군  입대 했다고 잘했다 떡검개떼 개주  겸직,1,1,1
범죄당 국개들이 국회에서 범죄적 행위를 하고 악법을 만들고 있다. 국민이 국회의원 탄핵히게 절차 알려주세요.,1,1,1
개똥검들이 나라를 어떻게하려고 하는것이냐.. 슬푸다,1,1,1
이 정부 관료의 특징 : 탄핵안 보고 받으면 무조건 자진사퇴. 이동관 시즌2,1,0,1
"윤석열정부~~정말 지긋지긋,징글징글하다...........하루빨리 쳐내야한다..",1,1,1
윤신병자들한테 참정권 회수해야함..나라 개판된거 보소.,1,1,1
아니 뭐가 그리 당당하지 못해서 그냥 런해버림?,0,1,1
법을 배운 것들이 하는게 이런 형태야.. 최대한 법의 헛점을 이용해 먹는것..평생 얼마나 이런 짓을 하면서 살았을까?,1,1,1
사퇴하는데 퇴임식이라니....개판이네,1,1,1
끝까지 법적 책임 물어라 민주당. 언론 독재 시작이다,1,1,1
대통령 하나 잘못 뽑았더니 사회적 비용이 어마어마하네. 담엔 최소한의 검증은 된 사람으로 뽑아요ㅠ,0,0,0
엠비씨 방송 장악을 마무리하려는 악마같은 꼼수. 국민이 개돼지로 보이지?,1,1,1
느그 아부지는 탄핵 안해도 오토매틱으로 빵에간다던데?,1,1,1
언론 환경을 전두환 시절로 후퇴시키고 도망간 자로 역사에 영원히 기록될겁니다.,1,1,1
탄핵되면  업무정지 되니깐  되기전에 사직하는겁니다 ㅡㅡㅡ방송장악하려고  참 ㅡㅡㅡ나쁜놈들,0,1,1
개뚱이의 작태 탄핵감이다..,1,1,1
이건 범죄자들의 행동과 뭐가 다른가? 편법에 먹튀에 뻔뻔하기는 범죄자보다 더 악랄하다.,1,1,1
"런동관, 런종섭, 런홍일.  다음은 누굴까?",0,1,1
"역사에 길이 남을인간이다. 이런 작자들이 윤정권이 너무 많아 나라가 이모양이지. 내돈을 이런작자들한테 주다니. 정말 세금내기
싫다!",1,1,1
윤석열 탄핵 국회청원 동의합시다! 분노가 치민다,0,1,1
나라 꼴이 정상이 아니야... 대통 하나  때문에  이렇게 쑥대밭이 된다는건  국가 시스템에 문제가 있는거 아닌가?,1,0,1
탄핵을 시켰어야 하는데 도망가버라네,0,1,1
죄짓고  벌받을까봐~겁은났는갑다!그죄가  어디가냐~,1,1,1
도망가는자를 퇴임식까지 햐주는 이란 상횡이 맞는지 정말 망할까 걱정이돼는데,0,1,0
탄핵깜도 안되는게  방통위원장이나 하고  있었으니  꼼수하고는  ㅉ,1,1,1
새 방통위원장 지명되자마자 바로 탄핵해할수 있나요? 사퇴하고 뽑는 의도가 뻔한대 그냥 탄핵하는게,1,0,1
탄핵을 당하는 것 보다는 자진해서 내려오는 게 보기 좋으니까 알아서 기어 내려오는 거지. 지금 저렇게 내려온 사람이 몇명이냐 ㅋㅋㅋㅋ,1,1,1
게  도리 정부~  5명이 구성되야지~  대통이 2명임명하고  다 해처먹는 북한식 방통위~  엽기적이다~   5명 다 채워~,1,1,1
런종섭에 이은 런홍일 ㄷㄷ,0,1,1
얄팍한 꼼수로 방송을 장악하려는 몰염치... 비열하고 염치없고..,1,1,1
ㅋㅋ..방통위를 해체하라. .국민에게 전혀 도움이 안되는 언론장악 화수분,1,1,1
줄행낭 런종섭 런동관 이젠 런홍일이냐?,0,1,1
한명 남은 방통 위원도 탄핵 새로 오는 방통 위원장도 탄핵,0,1,1
감사합니다 모두 공정방송을 위한 뜨거운 봉사정신에서 우러 나온 결정에 대해 감사합니다,0,0,0
거대야당이 방통위마비시키고 지들 입맛대로 방송장악하려는건데 당연 사퇴해서 방통위 무력화시키는거 막아야 책임있는 수장이지,0,1,1
그냥  다 같이 죽자. 정은이  한테는 주기 아깝고  어째야  된다냐  이그  전국에 다 퍼져있으니  어째야 된다냐,1,1,1
어찌 윤석열 주변것들은 하나같이 다 윤석열같냐,1,1,1
윤가야 장난하냐~~ 국민이 우습냐~~~,1,1,1
얼마나 뒤가 구리면 사퇴를 해대는 정권인지 ㅋㅋㅋㅋㅋㅋㅋㅋㅋㅋㅋㅋㅋㅋㅋ,1,1,1
이번 정권 반복되는 행태 한심한 정권이 이구나. 쯧쯧,1,1,1
정당하다고 큰소리 칠때는 언제고 도망가는 비겁한 놈~~~~~,1,1,1
하나같이 수준이 딱 윤석열.김건희다. 저런 것들이 나랏일을 하고 있으니 나라가 요모양 요꼬라지지. 사퇴하고 도망쳐봐라 국민은 끝까지 용서 안한다.,1,1,1
국가체제가 무너지고 있다.,0,0,0
"회사로 치면 넌 파면시키려구  징계위원회 열라하는데. 사직하구.,.그걸 대표이사는 사직처리 해주고 도망가는거ㅡㅡㅡㅡㅡㅡ네. 이놈 추노 김홍일",0,1,1
뭔 무능력한 인간들만 이렇게 기어나와서 윤석열한테 빌빌기냐;; 이런 인간들한테 방송국이 당하고 있다는거?? 겨우 저런 인간들 때문에??,1,1,1
이제사시꼰대말고참신한사람시껴라 무슨 사시만인간이냐 니미 돈많이벌엉ㅎ겄네    ㅎ,1,1,1
"꼼수인줄 아닌까스스로 사퇴하네
국민들은 다안다",1,1,1
찔리인까  스스로 사퇴 하네국민들은 다안다,1,1,1
대통령은 임명 안하던 자리까지 임명할지 아니면 다시 위원장만 임명해서 단 두명으로 언론장악할지,0,0,0
정치를 왜 이렇게 하냐? 이 죄값을 어떻게 치를려고,1,1,1
윤통이 20분만에 승인 ᆢ,0,0,0
장난하냐??  정상적인 넘들이 아닌건  알지만 그래도 할건하고가자,1,1,1
나라는2016년 사기탄핵 때부터  망한거임.  법치사망 한  공산당과 다를게없지,1,1,1
갔딘앉히놈들마다 인간같은거없네,1,1,1
그분이 사톼를 명 했나부죠 뭐 ㅉ ㅉ,0,1,1
사퇴 한 넘들도 차후 모조리 발본색원 해야 한다!,1,1,1
윤똥 ~. 하나같이.  비겁한. 이유가 뭐냐?    엉망을.  만들어 놓고. 도망가면 다냐?   댓가는. 치뤄야지~,1,1,1
방통위원 임명도 안하면서 위원장을 사퇴시켜? 대통령으로써 직무유기 아니냐?,0,0,1
ㅋ ㅡㅡㅡ검찰에서 배운거 잘써먹네ㅡㅡㅡㅡ,0,1,1
비열한것들 탄핵 안 당할라고 부리나케 도망가네. 똑같은 것들 앉혀서 무슨 짓 할라고!,1,1,1
혹시자진사퇴라서  연금을주는것은 아니겠지?  절대그럴일은 없어야한다. 진실이나 밝히고퇴진하던지..구리다구려~~!!!,1,1,1
"옛날 검사시절 불같은깡은 다어딧노?나ㅢ탓?....애초에맞질말던지 ㅠ
사퇴는왜해?
봐보라구~~재네들은꼼수사퇴라구하잖아?",1,1,1
범죄집단 탄핵감들이 다수당 이용해서 탄핵 만 부르짖는구나,1,1,1
탄핵당하기 무거워서 튀어놓고선 퇴임식?,1,1,1
어차피 공영방송 임원 의결안 의결 해놓고 할 거 다하고 나간 듯..  꼼수 중에 꼼수지.,1,0,1
운영규정 미준수로 인해 삭제된 댓글입니다.,0,0,0
누구 친구라며?친구를 부면 알만한거다.이 정부는 정말 인물이 이리도 없나?,1,1,1
멋집니다 독재자 더불어민주당에 맞선 분들!,1,0,0
방송의 비읍도 모르면서 친한 동생이 시켜주니까 낼름 받아가 하더니 꼴좋다.,1,1,1
이동관2   대한민국  언론   망칠   다음  타자~~?,0,1,0
관상은 과학....더러운 인상,1,1,1
대통령도 탄핵안 발의하면 보고전 사퇴하나,0,0,0
어울리지도 않은 자리를 차고 앉으니 ㅉㅉㅉ,1,1,1
국민은 퍼란게 좋아서 힘실어 주는게 아니다. 퍼런것들 보다   시뻘건것들이 하는짓이 더 막장 이라 싫어서 국민이 등돌리는거다,1,1,1
누가 살검 출신 아니랄까봐 법을 조롱하며 빠져나가려고? 지은 죄가 있는데?,1,1,1
이것은 합법을 가장한 불법이다. 헌재에 김홍일 사의수리 집행정지 가처분 신청해라.,0,0,1
더 좋은 자리 하나 줄께.   모지리 같은 것들.,1,1,1
국짐당 의견으로는 1인체제도 문제 없겠네  ㅋㅋ,0,1,1
뭔가  당당하지 못한게 있으니깐 사퇴 하겠지.,0,1,0
이건 뭐냐   모질이   정권   웃기네,1,1,1
"석열아, 계획대로 안되지? 난 니가 뭐 하는 인간인줄 모르겠다. 머리는 왜 달고 다니냐? ㅉㅉ",1,1,1
못되게 생깃네~!!석렬이도 자진사퇴는 배우는게~~??그래도 잘못은 아네~??발 뻣을줄은~ㅎ,1,1,1
너무 잘했다..화이팅!!,0,0,0
어차피 깜빵행...더 있다가지..??변호사비라도 벌어야지..ㅋㅋㅋㅋㅋㅋㅋㅋ,1,1,1
부위원장도 똑 같이 직권남용했으니 동시에 탄핵시켜 버려야 한다.,1,1,0
초등학교 반장보다 못한 놈.,1,1,1
쫄리니가 튄거지.....,0,1,1
이제 쫌 끌어내리자... 언제까지 두고 볼거냐... 얼마나 망가져야 끌러내릴거냐???!!!!!,1,1,1
1인만 있어도 되는거면 방통위 자체를 없애도 될거 같은데...,0,0,0
댓글로 아무리 떠들어도 소용없다.,0,0,1
법꾸라지들의 꼼수. 결국 자신들이 떳떳하지 않다는걸 보여줌. 법의 헛점을 이용해서 자신들의 이익을 취하고 남을 괴롭히는 전형적인 집단.,1,1,1
개인적 영달보다 정부 기능을 마비시키려는 기도를 막는 충성을! 반국가 세력 좌빨당을 분쇄하자.,1,1,1
좌파들 같았으면 나라야 어떻게 되든 임기까지 다 채워 연금 타먹겠지... ㅋㅋ,1,1,1
미꾸라지 이노마들 다 기억하고  깜방 반드시 보내야 한다,1,1,1
공명정대하면 뭐가 그리 두려우냐? 언론을 그렇게들 주무르고 상투를 틀어쥐고 싶은게냐!,1,1,1
대한민국은 정말 noblesse oblige는 개한테 다들 주었단 말인가....,1,1,1
전라도....너무 까불지 마라.....멸족 시킨다...,1,1,1
지금 보다 다음 어떤 사람이 들어올지가 더 궁굼하네요!,0,0,1
합법적이다 국민의 힘 발광하더니 ㅋㅋㅋ런 하는거 봐라. ㅋㅋㅋㅋ,1,1,1
나라돈 빼멋고 지멋데로 그만두고 이제는 어디서 국민혈세 빼먹는곳 찻으러 갈까 국민들은 봉 일세 대한민국 만만세,1,1,1
진짜 탄핵해야할 놈은 따로 있다,1,1,1
잘못한게 없는데 왜 사퇴를 합니까... ㅋㅋ,0,0,0
"뒤가 구려서 그래 탄핵하게되면 조사가 들어가니까
 행여 구린거 잘못한거 걸리면 고발도 되니 그럴바에는 그냥 그만두는거지",1,1,1
애초 법조인이 방통위원장으로 선임된거부터가 에러아니냐고ㅋㅋㅋㅋ,0,1,1
민주당 찍은놈들이 다 피해받아라..  모든지 지들 맘 안들면 탄핵.. 검사들도 다 탄핵하고...,1,1,1
구속수감이 답이다.김홍일 도망 못가고로 출국금지 시켜야 합니다.,1,1,1
"그래 그래 잘들 즐겨라~국민을 우습게 보는 이동관, 김홍일,  사면권 없는 무기징역으로~~
윤똥의 흰대가리 똥개^^",1,1,1
편파방솟 MBC 정상화를  위해 잘한일이다..,0,0,1
민주당 정말 지긋지긋하다. MBC가 국민들보다 100배 중요하다고 생각하는거 정말 치가 떨린다.,1,1,1
범죄자 이제명보다  법관생활한 문제인이뽑아준 윤대통령이 제명이수령보다백배천배  좋다 아무것도모르는현시대사람들  정신차려라,1,1,1
무도한 더불어전라당 철퇴를 맞을거다.이재명 탄핵하라,1,1,1
패거리당 민주당에서 막가파 식으로 민생은 뒷전이고 무리수로  탄핵을 남발한 결과가 아닌가 이런 못된 버릇 어디까지 가나 봅시다,1,1,1
탄핵한다니 원하는데로 사퇴했잖어 뭐가 문제? 탄핵당 약이 올라서 문제? 능지처참해서 문제?,0,1,1
법치사망은 2016년  박통탄핵 때부터 고.  저것들은 는 공산당과 다를게 없어,1,1,1
직무대행 바로 탄핵해라,0,1,1
하 도망가는게 천직인가보네,0,1,0
또또 셀프사퇴런 하지~~~??? 윤석열 지입맛에맞는 인간 또데려오겠네. 지겹다,1,1,1
이동관이나 김홍일 비 정상 방송 탄압 잔 대가리 굴리는거 도찐개찐이넹!  대한민국 민주주의를 역행시키는 방송위원들과 위원장 규탄한다,1,1,1
이제 썩은 범죄혐의자 이재명과 역사상 가장 무능하고 군인들 사기 떨어뜨리고 국민을 우습게 보고 있는 정청래를 탄랙시키자!!!,1,1,1
민주당 = 아바이수령찢죄명당 = 공산당 ㅎㅎㅎㅎㅎㅎㅎ,1,1,1
잘하고 있다..더불만진당 속쎔이 뻔하다   몇개월간 직무정지 되기전에 사퇴하고  또 위원장임명하고또 탄액 나오면 또 사퇴하고 ㅎ ㅎ ㅎ,1,1,1
더불당 진짜 정치조폭이다. 이런 인간들이 국민을 대변한다고  Gsgg,1,1,1
더불어 터잔당 꼴보기 싫어,1,1,1
탄핵안 낸 넘들이 모든신상 탈탈 털어내니까 어쩌겟나.털어서 먼지안나는 넘 국개들중에 있을까?,1,1,1
이미  공산화는 2016년   딴핵때부터 시작됬고.,0,1,0
"런동관, 런종섭, 런홍일  민주주의를 역행시키는자들 뻔뻔하구나!",1,1,1
더불어터진 동네 이장질하는 잡범을 정부미공장에 장기근속시켜야 나라가 편안해 진다.,1,1,1
나라도 사람이 국개에게 탄핵이니 뭐니 하면 옷벗고 말겠다 국개에게 한소리 들어면 살아생전 재수가 없을끼고 자존심도 상하니!,1,1,1
"탄핵 사유도 없는데, 야당 무력 시위가 대단하군",0,1,1
교도소로 윤석열과 손잡고 가라,1,1,1
"런홍일, 런종섭 비겁한 놈들~ 대한민국 민주주의와 법치주의 파괴범 윤석열정권 부역자들은 끝까지 추적하여 반드시 죄값을 치루게 해야 합니다~",1,1,1
운영규정 미준수로 인해 삭제된 댓글입니다.,0,0,0
나쁜 것들ㆍmbc공영방송  민영화 ㆍ가속페달 ㆍ밟아놓고 ㆍ  빤스런함.ㆍ그러고 ㆍ또 ㆍ정권의개 ㆍ지편  ㆍ박아놓겠지.,1,1,1
이게 이 정부의 수준이다. 보이냐 이찍들아?,1,1,1
이정부인간들은 무조건 도망부터 치려고하네 책임따위필요없고,1,1,1
"이동관,김홍일 다음 부역자는 또 누구???스스로 죄인 증명이네 ㅋ",1,1,1
이동관 시즌3 개봉 커밍쑨~~~~,0,0,1
이동관이 같은 아주 저열하고 비열하고 능력없고 꼬봉인 할배요~~썩 꺼지소 마!!,1,1,1
이 참에 더 쎈분 기용 하세요. 아예 보수 위주로 방송편성 하실분으로~!!  좌발들 환장해 버리게~~!! ㅎㅎ,1,1,1
민주당  돌아버리겠네  ㅎㅎㅎ  민주당  아무리  머리  허도 보수  머리  따라가지  못해,1,1,1
보수란 것들이 그저 도망일색이니 국정에 신뢰가 가겠냐.,1,1,1
불법을 저질렀음을 자인하는 굥정권 하수인,1,1,1
좋아 민주당 바보 만들어라,0,1,1
탄핵병 걸린  저급한 정치인들  머리  돌겠지?,1,1,1
"위법 없다고 뻔뻔하게 나오더니, 탄핵한다니까 도망갔네. 이 정부는 어째 다 사고치고 다 도망가냐.",1,1,1
새로 임명할 방통 위원장 방통 위원 둘다 한꺼번에 탄핵 하세요,0,1,1
비겁하게 도망 가네 떳떳하지 못하니 도망가고 가리고 숨어버리는 이정권 진짜 수준 처참하다...,1,1,1
더둠어 탄액당은 탄액 노래 그만부르고 민생을 위해 일해라,1,1,1
참 비열하고 얍삽하게 국정을 운영하는구나.ㅋ,1,1,1
양아들....  그렇게 양아짓을 해서 니들이 정권을 계속 유지할것 같냐....,1,1,1
어휴 나라망신  석열아 똑바로 해라,1,1,1
나뿌넘입니다 진짜최악 무정부 정권입니다 하루빨리 탄핵시켜 대한민국 바로 싸워야합니다,1,1,1
홍일아! 그 동안 욕먹느라 힘들었지? 너 곧 석렬이하고 손잡고 교도소 갈꺼야. 기다려! 손 ! 손!,0,1,1
윤석열 최고 너무 잘하고잇다,0,0,0
"홍일이가 석열이 밑에서 수모를 겪는구나!!!  가오가 없구나!!!
  쪽팔린다!!!",1,1,1
누가 살검 출신 아니랄까봐 법을 조롱하며 빠져나가려고? 지은 죄가 있는데?,1,1,1
꼼수 쓰는데 도가 튼 2찍이 국찜당 닝겐들....법을 바꿔서 바로 사퇴 못하고 2~3개월 전까지는 미리 사퇴 못하는 법을 올려서 소급시켜버리길....,1,1,1
사퇴하고 다시 임명하면돼 탄액하면 다시 사퇴하고 다시 임명 그렇게 민주당 바보만들어야 정신차린다,1,1,1
국민 눈치도 안보고 막가는구나,1,1,1
안물러나면 안물러난다고 난리 물러나면 물러났다고 난리 좌좀 우덜편 아니면 무조건 난리,1,1,1
런종섭 런종관 런홍일 뭐하냐 너네,0,1,1
먹튀하는놈에게퇴임식은왜해주는거임?바보들임?,1,1,1
이 인간들은 온갖 방송장악 짓하려다 탄핵하려면 튀어버리네? 이동관도 그러고 이놈도 그러네...,1,1,1
법을 수호한다는 인간들이 그 법 테두리안에서 놀고있네,1,1,1
당당하면 있어야지 도망가버리네요,0,1,1
"한동훈, 표 더 얻었다고 있는 죄 없어지나..... 사퇴한다고  사법시스템 멈추면 잡범들도 따라해.....법 원칙엔 예외가 없다.",1,0,1
추악하다. 법꾸라지들이 이나라를 망치고 있네. 윤석열김건희 왕국을 찬양하기 위한 방송정책은 계속 가는가? 혹시 후임 방통위원장 후보는 이봉규? 김세의?,1,1,1
이동관 시즌2네 ㅋㅋㅋ 다음 놈 와도 뚜벅뚜벅뚜벅 탄핵 가즈아 ㅋㅋㅋ,1,1,1
ㅋㅋㅋㅋ 이 정권이 막장을 향해 간다는 클리셰 ㅋㅋㅋㅋ 곧 망하겠네,1,1,1
특검한다고세월다보내네개국개들아민생좀챙겨라 정은아국회의사당에한방좀때려라,1,1,1
국찜에서 자진사퇴할 정도면 얼마나 중범죄를 저지른거야 ㅋㅋㅋㅋ,1,1,1
역시네 그래야 윤모리지 정부답지 ㅉㅉ,0,1,1
이젠 방통위원장 누굴 꽂더라도 탄핵안 상정부터 해야 할듯,0,1,1
"은근슬쩍 앉아서 용산에 부역하다가 탄핵 직전까지 해먹다가 그만 두는자리구나,,,",1,1,1
명예도 있는 사람이 왜 후배 검사 꼭두각시 노릇을..,0,1,1
불법 인줄은 아나 보네이 동관이를 비롯한 김홍일이 너도 죄값 받을 날 몇일 안 남았다.,1,1,1
진짜 코디미가 따로 없다.,0,0,1
어떻게   이런식으로 정ㅊ를 히다니,0,1,0
봉투탄핵당 원하는데로 사퇴 해줬잖어. 뭐가 문제인거야? 약올라서 문제야?,1,1,1
역겹다 국민개무시하는 비열한 작태,1,1,1
이 정권은 절대 책임안진다,1,1,0
졸라 추접스럽다...ㅋㅋㅋ,1,1,1
개검출신들 자기 잘못은 아는 모양이네 비겁한넘,1,1,1
빤스런하나는 누구보다 빠른 민족.,0,1,1
ytn 불법 매각으로 일단 뒤진줄 알아라 건희랑 빵 동기되는거야,1,1,1
참 겁도 없는 정권이네,1,1,0
반드시 넌 천벌받을거다!!,1,1,1
탄핵당 오늘도 탄핵 성공.. 민주당 이름 바꿔라... 탄핵당으로...,1,1,1
세상 지금까지 이렇게 무능한 정부는 처음이다. 석열아 이게 의료개혁이냐?나도 너 탄핵에 클릭할지 모르겠다~,1,1,1
나라 운영을 진짜 젓가치하네 불공정과 몰상식의 극치네,1,1,1
어느정권이든  골수가  있기마련인데  진짜  완장 찼어,1,1,1
더불어범죄당의 법위에 군림하는자 모조리 처단하구 오로지 할줄 아는건 탄핵 특검 목 자르는것 이게 정치라구 더럽다 나도한다 썩어빠질것,1,1,1
나머지 한놈도 탄핵하거라,1,1,1
이제 청와대에서 바로 아무나 임명하겠지,0,1,0
휴전국가에서 스스로 무장해제 시킨 양산 개장수한테도 박아줘라,1,1,1
문가 같은 인간이 다시는 정치판에 발을 붙이지 않아야 나라와 민족이 산다,1,1,1
문재인 5년  도대체 이나라엔 무슨일이 있었던 건가요?  군인이 훈련을 안한다?  북한은 끊임없이 도발을 멈추지 않는데도..,0,1,1
야 포사격 훈련도 안했다고?,0,0,1
정권을 지키기 위해 남은건 전쟁뿐이냐?,0,1,1
굥재앙은 전쟁하고 싶은 듯. 전쟁나면 2찍한 개돼지들부터 다 죽으러 나가라,1,1,1
"동해에 발사된 미 확인 물체 (?) 할때부터 알아봤다 ㅋ  강제로 종전 당하고 싶었나보네, 하긴 뭐 그들의 이념이 윗쪽이랑 똑같응게,, 좋아라 하겠지",1,1,1
잘한다. 미친 개에게는 몽둥이가 약이라는 것을 보여줘야지.,1,1,1
양산에 은신중인 개장수가 이 소식에 격노합니다,0,1,1
죠씁니다~ 강한 모습 보여주자고요~ 이왕이면 선제타격으로 더 강한 모습 기대합니다.,0,0,1
이게 맞지 휴전국에서 GP 없애고 고속도로 깔아주고 무장해제 하는 문씨와 좌파 일당은 나가라 진짜 ㅋㅋ,1,1,1
친일 매국노들이 긴장을 조성하면 지지율이 올라가는 줄 아나베 .. 하긴 노인네들은 멸콩 외치겠네 !!,1,1,1
"전쟁을 유도하는 굥이,,,,,,,,국지전이라도 일어나면 그 핑계로 계엄령 선포할듯한 기세네,,,,,,",0,1,1
양산 문영감 위장 평화로  온 국민들  속이고   편안하슈    잊혀진 인간 되겠다고 공언 하더니 쉽지 않츄?!!,1,1,1
분단 국가에서 당연한 일,0,0,0
든신 2찍이들 귀 옆에다 대고 포사격을 해야 정신 차림... 애초부터 대화가 불가한 종족들임..,1,1,1
민주당이랑 좌파들 ㅂㄷㅂㄷ하겠네 아후 좌파들 진짜 꼴뵈기싫음,1,1,1
여기 댓글..........친일 매국 극우할배 좋아한다...............ㅋㅋㅋㅋㅋㅋㅋㅋㅋㅋㅋㅋㅋㅋㅋㅋㅋㅋㅋㅋㅋㅋㅋㅋㅋㅋㅋㅋㅋㅋㅋㅋㅋ,1,1,1
군훈련은 당과 상관없이 휴전국가인 이상 무조건 강하게 해야한다.,0,0,1
북한이 탄도미사일 발사하니 우린 겨우 자주포  발사합니까? 그러다 또 조롱당할까 우려됩니다. 북한 드론이나 못오게 막으세요.,1,0,1
휴전 이니 전쟁 시작 하면 가는 거임??? 2찍들아 니들이 전방 다 가서 막아 안그럼 내가 뒤에서 죽여 불랑께 ㅡㅡ,1,1,1
대통령 고향 김영삼(거제) 김대중(신안) 노무현 (김해) 이명박(일본) 박근혜(대구)  문재인(거제) 윤석열(서울),0,0,1
잘하는것은잘한다고해야함,0,0,0
포탄이 시청에 떨어졌나,0,0,0
훈련 강하게 하고 문제가 생기면 즉각 응징하라,0,0,1
"상식적으로 내가상대보다 힘이강하면나를괴롭히거나 도발하지못한다 국방력
이 우위에있으면 그것이바로 평화를가져
다주며 전쟁은 내가 힘이없으면일어난다",0,0,0
"훈련은 하고 대화도 하고, 단 정치적으로 이용하려고는 말길...",0,0,0
최소한 SLBM 을 날려야된다고 봅니다.,0,0,0
6년동안 포병사격안했다면 ... 제대로 나가겄나 제대로 쏘것나... 이제라도 제대로 쏘도록해서 다행이다...,0,0,1
그럼 전쟁하자는 겁니까? 리재명 왈,0,1,1
당ㅈ연 훈련을 해야지요ㅡㅡ,0,0,0
남조선 좌파들  보란듯이 훈련합시다  북조선 인민군 대장정은이 오줌 찌리게~~,1,1,1
저쪽에서는 미사일 큰거 날리던데 이걸로 씨알이나 먹힐까여?,1,1,0
김건희씨가 5년안에 통일한다는데.... 전쟁말고는 5년내 통일 될 방법이 없네... 하루속히 탄핵해야한다.,1,1,1
역시 역대 최고의 대통령 윤석열!! 잘한다!!!,0,0,1
나라 꼬라지 봐라~..전쟁하면 이길것 같지요? 우크라이나 보세요~ 국민이 얼마나 고생하고 있는지..전쟁은 결국 일반 국민이 희생합니다.,1,0,0
"전쟁 부채질하는꼬라지가 
친일매국노  윤완용 답구나!!!
반민족 행위 당장 그만두고
썩 꺼지거라마!!
평화가 경제이거늘!!
하는짓거리가 구상유치다!!!",1,1,1
제발 포한번 쏴주세요~~ 하고 고사를 지내네,1,1,0
잘했다 훈련도못하는군을만들려하는 세력들이누구였는지똑똑히생각해야한다 인민들굶어죽는판에도 미사일쏴대는곳이어딘가,0,1,1
