comment,SEJ_label,PEJ_label,MRJ_label
실리외교는 호구라서지. 국민에 돈 안되는 외교는 하지말고 실리 없이 돈퍼주는 외교는 하지 마라,1,1,1
이스라엘 유대ㅡ2천만명 이라면 회교는 20억명,0,0,1
좋은 행보였다고 생각합니다.,0,0,0
외교부의 적절한 대응 찬성입니다.,0,0,0
정말 잘햇어요. 이제 좀 더 애쓰면 중국이나 러시아눈길도 달라질거에요 .한국 화이팅.,0,0,0
한국의 외교원칙은 알다가도 모르겠네,0,0,0
글쎄 별로 잘한 짓 같지는 않다. 사정이야 있었겠지만.아랍과 손잡는 것 보다는 미국과 손잡는게 낫지. 원전 머니 때문인 모양인데 조삼모사라고 본다.,0,0,1
한국은 미국이나 일본만 따라서 잘 하면 중간은 간다 ㅋㅌ,0,0,1
한국이 미국 식민지 국가인건 전세계가 다 아는 사실이고.. 그래도 저렇게 표면적으로라도 찬성표 던진건 잘했다고본다,0,1,1
아돌프 당신이 그립습니다..,0,1,1
"일본도 찬성했는데, 이딴걸 기사라고 쓴거냐?",1,1,0
유엔표결로 석열이가 철들었다고 생각하면 안된다. 근본이 토착왜구다.,1,1,1
사드때 아무것도 안했으면서 뭔 소리. 그리고 미국 설득에 핵포기한 우크라... 니들이 지키고 있니?,1,1,1
미국은 자국에게 돈이 안되면 지원 안해준다 착각하지 마라 중국이나 미국이나 돈이 되니 한국 이용해먹으려는 것,1,1,1
그 말을 믿으라고?   트럼프  당선되면  중국보다 더 압박할건데.  각자도생 만이 답이다.,0,0,0
일단 우리나라를 침탈하려는 공산국가와 친하게 지내자는 한국내의 친중매국노 정치인부터 몰아내야 합니다.,1,1,1
찢제명 쎄쎄 쎄쎄  나라를 중국에 팔아먹은건가??,1,1,1
공산당하고는 애초에 병존할수 없다~ 자유민주주의 우방과의 동맹강화만이 우리가 살길이다~,1,0,1
말로는 만리장성도 쌓겠다지만 실제는 모른 척을 어디 한두번 했나.,0,0,0
중국 무역 의존도 사드보복이후 이제 20%도 안됨 중국에 비굴 해질 필요도 없고 이제는  중국눈치보지말고 강경하게 대응해도됨,0,0,1
순진한소리하고있다지들밖에모르는짓거릴기억못하는게냐,1,1,1
제발 미군 철수라는 헛소리는 하지 말자..,0,0,1
믿을 놈 1도 없다... 미국도 중국도 일본도 대만도 다 우릴 잡아먹으려고 한다....,1,1,1
자국의 이익이 최우선인 국제관계에서  저말은 미국에 더욱충성하라는 립서비스일뿐,0,0,1
ㅋㅋㅋㅋ 그 말을 믿으라고?? 개가 웃는다,1,1,1
왜 이제와서?뭔가 아쉬운게 있냐?,0,0,1
뭐???   트럼프 한테 물어봐,0,0,0
한국 기업들은 중국에 투자하면 안댄다 언제든지 중국과 무역 전쟁이 발생할수있다,0,0,1
분명한건 지금처럼 미국이 중국을 압박하지 않았으면 한국경제는 막강 경쟁자 중국에게 다 쳐발리고 있을거다. 반도체 전기차등,1,0,1
와 뭔가가 지금 물밑으로 치열하게 움직이고 있는듯....,0,0,0
웃기는 짓들그만하지. 트럼프는 주한미군 철수를 언급하는 마당에 미국이 뭔 도움을 주냐? 핵개발하여 배치해라,1,1,1
IMF때도 방관 사드보복때도 방관..이런 헛소리 믿는건 자칭보수노인들뿐..,1,1,1
선조들이 미국은 믿지말라 하신 이유가 뭐겠노,0,1,0
전쟁 터져도 사드때와 마찬가지 일 것 같다,0,0,0
한국 핵무기 개발 및 보유 용인하라.,0,0,1
한한령에 대응하여 짱-깨령으로 맞대응하라.늦었지만.외교는 균형이다,1,1,1
이 뉴스를 종북친중 반미 사회주의 더듬어당과 찢죄명이 싫어합니다.,1,1,1
이거지~ 윤통이 한미일 외교동맹 강화의 결과이다~,0,0,1
뭐 또 뽑아 먹을게 있는가? 이익이 없으면 절대로 우호적으로 움직이지 않는 미국 흥미가 없다.,1,1,1
한미동맹이 불합리한것도 잇지만 우리대한민국에게 엄청난 이익입니다 합동훈련하면서 배울점도 매우많고 정보전에서 미국을 따라올 나라는 없습니다.,0,0,0
균형 추가 없는 문제이다. 모든 것이 미국 이익 중심으로 설정한 문제이다. 사실 균형은 미국이 깨고 있는 것이다. 생각해 주고 있는 척,0,1,1
용산 사람들 좋으시겠네...어쩌다 나랏꼴이 이리 되었나요?,0,0,0
장난 까냐 파면이 아니고 구속을 해야지,0,1,1
최대가 아니라 최소 파면이 되어야지. 결국 최대로 하면 파면은 아니란 말이네.,0,1,0
아니 문제팔면 당연히 파면해야지 학원가서 강사하라고 근데 최대가 파면? 결론은 파면은 없다? 이거네 계속 문제팔아먹으라고 부채질하네,1,1,1
파면되면 학원 가면 되지. 수사도  즉시 착수,0,0,1
교사 출제 저작권도 보호해주세요. 학원서 돈 받고 팔아먹는데 왜 교사는 힘들게 출제해서 아무런 보호를 못 받나요.,0,0,1
파렴치한 범죄행위에는 무기징역이 답이다.,0,0,1
최대???  말같지 않은소리 하고 있네... 그냥 파면시켜야지.. 교원자격증또한 취소시키고,1,1,1
사교육 때려잡겠다든 윤석열 어디감? 그래서 사교육 없앰?,1,1,0
이런데도 사교육 카르텔이 없다고 주장한 자들이 있었지.,0,0,1
월급이나 좀 제대로 주고 대우해줘 그럼..ㅡㅡㅋ 민주주의에 무슨..,0,0,1
아주 인재들 떠나라고 고사를 지내라,1,1,1
교사 명예를 돈으로 바꾸진맙시다,0,0,0
최소 파면으로 가야지 . 죄다 견책 감봉 받고 문제팔아 돈벌고 ㅋㅋ 개꿀이네 한심한 철밥통들,1,1,1
헌법 소원감이다. 왜 문제를 팔면 안 되지??? 교사의 지위(?)를 이용한 것도 아닌데???  그럼 이젠 수능 출제자에게 수 억원의 수당을 줄 생각인가?,0,1,1
소극적으로 팔면 괜찮음,0,0,0
학원비 올라가는 소리네~,0,0,0
"최대가 파면? 어이없는것들이네
파면은 기본이고 징역살이 보내야 정신차리고 그런짓 안한다.",1,1,1
평양냉면 맛 진짜없다.,0,0,1
어쩌라는거지 북한은 우리나라 주적일뿐이다.,0,0,0
즈그들도 냉면 개맛없는걸 아는듯,1,1,1
뼉다귀 해장국은 없슴까?,0,0,0
우리나라보다 났네  그게 북한이징,0,1,1
하던지 말던지 저짓해서 퍽이나 돈 많이 벌겠다 그래도 우호관계 일때 먹을만 했지 그돈이면 김밥천국 가겠다,1,1,1
중국이어 북한 속식이 판을치는세상,1,0,0
이젠 하다하다 적국한테도 존대하냐?,1,1,1
앞에 평양 들어간 음식치고 맛있던적이..,0,0,1
心理支配하는  毒이 含有돼 있을 것이다. 더듬고 주믈럭 犯罪巢窟黨  192마리 國疥들도  北韓毒에  重毒되었을 것으로 보인다,1,1,1
우리와 같은 음식을 먹고 사는 가까우면서도 먼 북한. 맛이 어떤 차이가 있을지 궁금해.,0,0,1
이기자 진짜 조사한번해야하는것같은데~ ㅋㅋㅋㅋ진짜 의심되는데?,0,0,0
어느 누구가 로비 자금 엄첨 챙기겠네요,0,1,0
유사시 전쟁초기 이나라 상공에 떠 있는 적국의 인공위성 청소는 필수요소..  방어적 성격이 아닌 전략적 개념으로 봐야 하는게 정설.,0,0,0
저수지에 묻어둔 백장 대현동등 수조 이재명비자금만 찾아내도 수백발 산다..!,0,1,1
저런 장난감은 필요없다. 보복용 핵미사일 배치만이 한국의 살 길이다.,0,1,1
2찍들 가관이네 보수 정규재옹께서 만든 10가지 규칙 있으니 한번 읽어보기를 바랍니다,1,1,1
양산 문가는 중국이 울 국방문제에 어깃장 놓눈 일에는 꼭 거론되네 ㅋ  저런게 매국노가 아니면 머가 매국노인가??,1,1,1
SM-3 당연히 도입해야지 그거없이 이지스함이라 부르면 안되지,0,0,1
예전에 많이 쓰던말 * 자주국방* 엄청나게 비싼  미국 무기 구입하지 말고  자체적으로 개발하고 생산해서 자주국방하고  수츨도하고~~~~~~,0,0,1
미국이 우리를 지켜주는것과 우리가 미국을 지켜주느게 상호간에 앙립될 수없는 논리냐?,0,0,0
그래서? 비싸서 안하는게 낫다?,0,0,1
밀매들도 보통 반대하는 미사일 아님감.?,0,1,1
전국민 25만원 지원금으로100여기 구매하면 되겠네.,0,0,1
기자야 니 목숨 163억원이면 비싸지? 그렇다고 그냥 디져 줄래하면 그렇게 하겠니?,1,1,1
SM_3  꼭 필요한 무기입니다,0,0,0
기자가 좌파성이네~  죄인이가 만들어놓은 국방약화를 비판해야지~,1,1,1
국산 미사일 좋다고 난리치면서 꼭 이렇게 돈을 돈을써야 되는건지,0,0,0
"아니뭐 한번쏘는데 몇천원인가몇만원하는레이저나온마당어
짬처리아닌가",0,1,0
부칸괴뢰집단 개노릇한 김대중 노무현 문재인 이것들은 나라팔아먹은 이완용 급이다 죽어서도 지옥으로 가서 죄값받아라,1,1,1
"문재앙이 도입을 꺼려하고 지연시켰던..., 중국이 반대하는 SM-3를 당장 배치하라!",1,1,1
"자주국방에 웬 중국의 눈치를 봐야하느냐,  이스라엘에게 한수 배워라",0,0,1
궁금한게 이스라엘 아이언돔이면 북한 방사포 막을 수 잇나요? 아이언돔 요격 너무 잘하던데 도입하는게 좋지 않나요?,0,0,0
기왕 비싼 무기 사와야 한다면 기다렸다 트럼프가 방위비증액 요구할때 협상카드로 쓰는게 좋지 않을까,0,0,1
걱정할 사람들에게 생존보고는 좀 해라..  느닷없이 연락이 안되니 이런 헤프닝이 생기지..,0,0,1
나라들쑤셔놨으면 상황 공유라도해야지 뭐냐?,1,1,1
몇달전? 홀로 일본 여행가서 사라진 청년도 이렇게 좋은 소식 전해오면 좋겠구만.. 무사하기를,0,0,1
저러고 자기 뉴스나왔다고 유튜브 하기만 해봐라,1,1,1
실종됐다고 쌩 난리치고 발견되니 자세한 내용은 몰라두 되고 ㅋ,0,1,1
그냥 연락 두절인가보네 공권력 다 쓰고 ;; 국가배상 청구해야되는거 아닌거,0,0,0
불법이나 쪽팔리는 일로 잠적한거니 밝힐수 없다는 거지. 여자 내지는 마약.,1,1,1
공공의 자원을 썼으면 공개해야지. 전국민 걱정시켜놓고선 무책임하네,0,0,1
관종 관상이던데? 역시나..,1,1,1
"급할때는 여기저기 별별 요청다하고, 간절하게 이야기해놓고, 해결되고 나니까, 입 다물어주세요.",1,0,0
찾아달라고 그렇게 공개해놓고…어디서 뭐하며 있었는지는  비밀이라니…그녀와 있었나?ㅎ,0,1,1
조회수 늘리려고한거면 진짜 열받는다,0,1,1
공중파 뉴스를 도배했으면 당연히 알려줘야하는거 아니냐??,0,0,1
가족이 부끄러워 얼굴을 못듭니다,0,0,1
극혐 민폐 가족이네 ㅋㅋ 세금낭비 국력낭비,1,1,1
여차저차한 사유라도 말하는게 정상 아니냐… 느그아들 찾는데 들어간 공무원 인력들을 생각해서라도..,1,1,1
"ㅋㅋㅋ 도와달라고  온 국가기관에 연락하고 한인회에 연락해서 겨우 찾았더니
응 찾았으니 이제 니들은 알꺼 없어 신경꺼줘 시전 ㅋㅋㅋㅋㅋㅋ 

대단하네",1,1,1
실종이냐? 잠적이냐? 신체 이상이나 특별한 사항이 없다면 실종이 맞냐? 나이트클럽 놀러가서 술과 마약에 취했냐?,1,1,1
"그냥 연락없이 잘먹고 잘 놀고 돌아다녔는데, 실종했다고 난리쳐놨으니 사연이 없어서 공개 못하는거지.",0,0,1
한심한 인간이네. 가족들도 마찬가지고.,1,1,1
유투브홍보하려고한것같은 의심이드는건 나뿐인가...진짜싫다 싫어 관종들,1,1,1
어느 높은분 혹은 재력가의 자제길래 바로바로 움직이냐,0,1,1
"이딴게 뉴스냐? 지들 급할때는 찾아달라하고, 찾으니까 비공개? 니


미",1,1,1
이슈가 된 만큼 사유가 궁굼해요,0,0,0
팔자좋아 파리 여행 다니는  놈 걱정까지 우리가 해야되나?,0,1,1
혼자 살면 이게 문제중에 하나지. 걍 두는게 서로 속편함,0,0,1
어디서 딴짓하다가 가족들 연락도 씹고.. 참 여행 지편한대로 하네.. 다른 가족들 생각은 안했나...,1,1,1
숨쉰채 대마초 피다가 발견,0,0,1
공개 안할거면 제보를 왜 받아,0,0,0
여행 유투버인가. 조회수 늘리는 거라면 욕해도 된다. 국가기관을 이용하며 돈벌이를한다.아니면 어느 여성과 숨었던지?,0,1,1
유럽애들은 지들멋데로 살면서 인종차별 심하고 아시아인들 엄청무시하고 증말 유럽인들은 게으르고 더럽고 자기들만의 생각으로 산다,1,1,1
관종이야 뭐야 온 뉴스에 도배하고 민폐만 끼치고,1,1,1
일본에서 실종된 분도 가족들 애타게 찾던데. 소식 들려옴 좋겠네요.ㅜㅜ,0,0,0
더이상 기사올리지마라!!관심없고 떳떳하지못했으면 더욱..앞으로 또 이런일이 생겨도 찾아달라고하지마라!! 책임감 없고 ...더이상자꾸 기사올리지마라!!,1,1,1
전국민과 현지 교민들에게 큰 도움과 응원을 받았으면 대략적인 상황공유는 해줘야 하는거 아닌가....,0,0,1
혼자서 해외여행하면서 다른사람들 안가본데 가본다고난리피는 인간들은 죽어도 할말없음.,1,1,0
내 생각엔  휴대폰 지갑 포함 소지품 소매치기 당해서 여기저기 떠돌아 다닌거같음,0,0,0
방구석 백수 숨쉰채 발견이랑 무슨 차이임?,1,1,0
이 사건 가족분 태도가 국민을 장난감으로 알던데 가족 수준이 정말 ..,1,1,0
"무사히 발견되었다니 다행이네요혼자 여행을 갔는데 연락이 안되었다면 저라도 걱정을 했었을거에요
큰 일이 아니라서 마음이 놓이네요",0,0,0
전 국민들에게 민폐 제대로~~😮‍💨😮‍💨😮‍💨,1,1,0
뭔일이길래 ?  엄청알고싶다~,0,0,0
밝힐수 없는 사생활이면 불륜이나 못된짓이지... 법적으로는 용서 받을수 있으나 네티즌들 벌떼처럼 물어뜯고 또 시끄러울테니 차라리 모르는게 약이다,0,1,1
나 여행가면 기사 한 줄 부탁해요,0,0,0
뭐 이런것들이 다있노?,1,0,0
홍보냐 뜨고 싶었어..? 그럼 뭐라도 내용 정리가.. 매우 덜떨어진 산박못한 홍보 수단으로 머리쓴건 아니겠지 설마.. ㅉㅉㅉ,1,1,1
"제발 너튜브 수익도 좋다만 위험한곳, 불안한 실험은 그만둬라 잘못되면 나라욕할거니?",1,1,1
단순 2주간 데이터 끊긴거 아닌가?,0,0,1
상세내용을 왜 비공개함??? 으이그 딱 봐도 사이즈 나오죠,0,1,1
자작극 냄새가 무지 나네 ㅋㅋㅋ 유튜브 조회수 노린거같네,0,1,1
주목 받고 싶어 그런 것 같은데,0,0,1
가족의 대처가 이러면 굳이 관심가지고 챃아줄 이유가없슴.이용해먹고.버리는꼴...,0,1,1
찾아달라고 할땐 언제고 상세내용은 공개못한다 술먹고 길거리에서 잔건가,1,1,1
공개못할만한 뭔가의 사건이 있었나보네요~,0,0,1
가족들생각을해야죠? 가족들은 큰일난줄알고 얼마나 속을 끓였을까요  ~다행입니다 ᆢ가족여러분   !당사자는 반성하쇼!,0,0,1
"이 관종님아 담부터 해외 그만 나가라
 모하는 짓이고",1,1,1
노이즈 마케팅 노린 건가?ㅋ,0,0,1
다행이지만~~꺼림찍 하기만하다,0,0,0
어지간하다 고마해라 이게 뉴스거리냐,1,1,1
"연락 안될 때는 온나라 떠들석하게 찾아달라고 하더니, 찾고 나니까 비공개를 요청해? 인간들이 왜 그러냐? 그냥 찾았으니까 땡이냐?",1,1,1
20세기....떠볼려고 쏘한거네,1,1,1
이틀에 한번은 집에 연락하자,0,0,0
보름 동안 뭐한다고 연락 끈었을까? 아예 영영 끈어 버리든가,1,1,1
무사하다면 다행이지  왠 악플을,0,0,0
그동안 뭘한거야? 왜 가족들은 실종이유 공개를 거부하나?,0,0,0
나이 30이나 처먹고 뭐하냐?,1,1,1
대사관 인력동원등 국고를 소비했는데 왜 저간의 상황을 공개를 안하냐?,0,0,0
관종인가....왜연락을 안하냐?,1,1,1
핸드폰 분실했거나 개인사정상 잠수탔거나. 어쨌든 무사히 살아있어 다행입니다.,0,0,1
진짜 실종 시켜라..그래야 정신 차리지,1,1,1
100% 소매치기 당했다 에 한표,0,0,1
구치소에 잡혀잇던거 아닌가 싶네,0,1,1
납치?미아? 뭐라는건지..,0,0,0
요즘은 방구석 유튜버들도 노이즈마케팅 아님 살아남기 힘듦,0,0,1
이런 기사쓰려면..왜  이지경이 되었는지  그 속사정도 좀 취재해라..날로 먹어 기사를...,1,1,1
"아휴ㅠㅠ 정말 다행이네요~ 안그래도 어제 기사보고 걱정되던데, 무사히 연락돼서 다행입니다.",0,0,0
무사하면 된거지 상세내용까지 알릴의무가 있는건 아나라본다!!!!~~일본여행가서 영구실종된 20대 한국남자를 봤을때 안타깝더라!!!!!,0,1,1
대힌민국만큼  살기좋은 나라읍다  외국나가봄 안다,0,0,0
필리핀 ㄴ 진단서끊어..감옥넣을거임..추방시킬거다 내가 얼마나무서운일당하고..외국하질년에게.폭행..자국민보호않하는 이런나란.조만간 .떠날거다~~,1,1,1
벌금 물어라메스컴타고  유명인 되는법도 다양하네,0,0,1
전화 안받고 sns 좀 신경 안쓴다고 뉴스에 매일 보도된다 ㅎㅎ 여러명 따라햐겠네,0,0,1
불법체류하려다 들통났나???...... 창피한일이군,1,1,1
한남  문제라면 여자문제...,1,1,1
김모씨 파리서 숨 쉰채 발견,0,0,0
기자가 육하원칙도 모르네 와. 기자법은 없나?,1,0,1
도와준 사람들 한두 사람이 아닐텐데 그 분들께 평생 감사하며 살길.,0,0,1
유튭각 뽑으려고 쇼한거??,0,1,1
유럽을 여행하면 전화는 자주해야지!부모님 걱정하시게  본인 생갇만 하냐!,0,0,1
"실종이였던거임?아님 당사자가 연락을 안한거야?
자세히 내용을써놔야지",0,0,0
도움을 요청했으면 사유까지 밝혀라 알겠냐 확 마,1,1,1
설마 관종은 아니겠지요. 모든 실종자들 숨쉰채 발견됐으면,0,0,0
유투브 구독올리려 한건 아니겠지?  그럼 정말 죄받는다.,0,1,1
벌금때려라 이게기사거리라고 진짜필요한사람들은 나오지도못하는데 저녁뉴스까지나오고 사지멀쩡한 30대가 뮈가궁금하다고 뉴스까지나와,0,1,1
그럴줄 알고 미리 욕 많이 먹었데,0,0,1
Sns에 꾸준히 여행기를 썼다니.. 의심이 간다,0,0,1
뭐여 자작극이냐 잠적이냐 사유가없어,0,1,1
다행이다  걱정했잔어 세상이하다 무섭고 흉흉하다보니,0,0,1
부산역은 외국인 바글바글 .우범지역(슬럼가임.),1,1,1
죽었으면 세금 잘 썻다고 할건데 살아있으니 세금 토해내라는 대한민국 국민들의 의식수준,1,1,1
이런걸 두고 숨쉰채 발견됐다고 해야하나......,0,1,1
안전은 코리아  씨씨티비 좀만 더 달면 된다,0,0,0
운영규정 미준수로 인해 삭제된 댓글입니다.,0,0,0
개인사유로 공개 안하겠다는데 무슨 권리로 이유를 공개하라 마라냐 .. 그래도 찾아서 다행이다,0,0,1
대놓고 전라도 출신이어야 한다는 전라도 정권 실세들의 생각이 참... 암담하다.,1,1,1
우덜식 슨상 김대중! 옛날부터 인터넷이 있었다면 슨상은 국회의원조차도 힘들었을거다! 지금 대한민국에나쁜 모든것을 만든게 슨상이다!,1,1,1
세계유일 3대세습 독제자들이 핵을 만들도록 핵자금을 지원한 간첩들은 김대중 노무현 문재인 이재명이다.,1,1,1
북한의 하명으로 장관을 바꾸다니 2중대였나?,0,1,1
연좌제 극혐하던 진보가 내 고향운운.. 웃기고 자빠졌다. 이놈의 나라는 좌우 성관없이 지연학연. 이러니 일반 국민은 가만히 앉아서 가마떼기 됐다는,1,1,1
"부정, 부패, 비리로 만연된 이 나라..... 광주 5.18 때문이다.",1,1,1
북한 정권의 요구라고 장관을 경질하는 김대중 정권때부터 대한민국은 공산당의 하수인이 되었습니다. 역사가 심판을 해야 됩니다.,1,1,1
절라도  향우회들 지들끼리 해먹는건,1,1,1
"DJ는 국민""통합""은 안하고, 지역이기주에 빠진 시답잖은 인간이었네..",1,1,1
지역감정 배제하자면서 그놈들은 뒤에서 더 하고있네,1,1,1
흥순영장관처럼 소신있는 사람이 필요.,0,0,0
ㅎㅎ 묻지마 투표에 묻지마 발탁까지 있었구나,1,0,0
"즐라도정권 즐라도사람 우조건싫다, 돼주미포함 다싫다.",1,1,1
지겹다. 무능력 무책임 무도덕 호남,1,1,1
유엔사무총장은 국제감각이 더있는 한승주 전 주미대사가 했어야,0,0,1
좋은면만 알려진 사람도 그 이면을 알면 평가가 크게 바뀌는 경우 많음...,0,0,1
He’s just a heel.,0,0,0
아무도 관심 없는 기사를 계속 연재,0,0,1
지금 UN사무총장 누군지 아시는분? 별 알아주지도 않는 반기문 사무총장도 힘없는 행정 관료였을 뿐이다.,0,1,1
경상도 문딩이교차로 죠센일보,1,1,1
미국도 참 인물 없다.,0,1,0
미국도 사기꾼이 대통령 도전하는 모양이다. 미국이나 한국이나 민주주의 위기입니다.,1,1,1
"트럼프도.. 선동에 대가..........  근데, 그 선동효가의 극대화를 위해서는  거짓말이 필수...........  우리나라 누구랑 비슷....",0,1,1
미쳤네.... 그냥 우리나라엔 바이든이 재선하는게 나을듯,0,1,1
쟤는 그냥 분담금을 한국이 다 내길 바라는거임. 동맹국을 잡아부수고 오히려 적국이랑 친해질려고하는 또람푸 클라스,1,1,1
아무말 대잔치..  개콘이 아냐. 현실이야.ㅠ,1,0,0
이른바 돈에 미친 사깃꾼,1,1,1
이레서 그지들하고 같이하면 안된다 구질구질하게 뭔짓이냐 ㅋㅋ 기술을 어떻게 3분의 1만 딱 재서 알려주냐 ㅋㅋ 핵심빼고 알려주면 되겠다 ㅋㅋㅋ,1,1,1
이미 기술 빼갔겠지!!,0,1,1
인니 국기좀 빼고 잘 마무리 혀,0,1,1
이미 기술을 다 빼갔다는 증거.,0,0,0
이슬람 잡것들 믿어? ㅋ,1,1,1
10년 넘은 악연이다..,0,1,0
바보짓 다하고있어 가지고있는거 지키지도 못하고 인도네시아에 기술빼앗기고 김정은에게도 군사기술 빼앗기고 책임자 엄벌하라 윗선까지,1,1,1
왜 인니에 목메지? 자존심도 없냐? 윤석렬이 문제야.,1,1,1
우리기술 훔치다 걸린주제에 그냥계약 파기해라 이무능한 룬정권아,1,1,1
이미 기술 빼갔나 본데? 저번에 그 사건도 있었고. 그냥 실비만 받고 빼버려라.,0,1,1
그냥 깨끗하게 갈라서라,0,0,0
이미 기술 빼간거 아니니?,0,1,0
이미 훔처갔네 훔처갔어!,0,1,1
"이런거지깽깽이같은나라랑기술개발을해!...사우디도있고,폴란드도있고....돈많은애들많은데....거지깽깽스....",1,1,1
믿을만한 나라랑 계약을 해야지  첨부터  잘못된 만남,0,1,1
스파이 짓거리 했으니 계약 무효화 조치해라!,1,1,1
1/3 축소 프라모델 주면 되겠네,0,0,1
그냥좀 인니 빼라 3분의1 같은 소리하네 그냥 나가리 시켜라,1,1,1
약속을 깬 인도네시아 말을  꼭 따라가야하나  약속은 깨졌다   한국은 어쩔수 없이  다른 나라와  계약하지머,0,0,0
그냥 나가라  우리가 해도된다,0,1,1
이미 기술 다 뺐다는 소리로 들린다,0,0,0
분담금 대신 전투기 40대 구매해가라 그래라,0,1,1
인니가 이정도로 큰소리내는건 kf-21이 형편없다는 예기다 지금 이라도 카이는 kf-21 뒤집어 업고 외국 전투기 수입해라 남 보기 쪽팔리다 ㅋㅋ,1,1,1
누가 세계적 호구국가 아니랄까봐 대놓고 통수맞아도 찍소리하나 못하네ㅋㅋㅋ 기술은 기술대로 다 털리고 돈은 돈대로 못받고 입꾹닫ㅋㅋㅋ,1,1,1
그냥 처음 계약서대로해. 뭔 도둑놈하고 협상이여. 싹다 몰수하고 도둑놈들 징역보내고. 끝.,1,1,1
긍까 왜 후진국이랑 이런걸 해서 이 사단이냐?,1,1,1
인니 기술자들 무기 징역에 처해라....,0,1,1
국민 1인당 25만원 안 줘도 되니까 그 13조로 거지국가 인도네시아 내치고 kf21 단독개발해라. 13조면 개발하고도 돈 남는다.,1,1,1
이행위반을 이유로 몰수하고 파기해야지. 돈없다고 그러고 프랑스 전투기 구입햇다며,0,0,0
그동안 빼갈만큼 벌써 다 빼간거 아닌지. 저건 국가 상호간 예의가 아니죠,0,0,0
10년 넘게 간보는 놈들하곤 더이상 상종하지 말자,1,1,1
1/3만 받겠다는것은 이미 다 빼 돌렸다는 이야기지,0,1,1
인니에게 팔지마라야   기술탈취 한  저들은 상호신뢰를 잃음 앞으로 더욱 꼬일것  이참에 계약파기해야  차후 후회않을것,0,1,1
이걸 받진 않겠지? 공동 개발국 하기 싫다는거 같은데 조용히 인니 국기 내려 주는게 도리인거 같다,0,1,1
인도네시아 재수 없으니까 꺼지라 그래,1,1,1
"인도네시아 노옴들한테 완전히 당했구나,,분담금을 차일피일 미루더니,,, 머튀 디데이를 잡앗구나,,,",1,1,1
그냥 보내라.쓰래기 국가 인도네시아와는 어떠한 협력도 하지마라,1,1,1
"문재인이 중요 외교실적이라고 자아자찬 생색내더니, 전투기 공동개발하자고 해놓고 주요 기술만 빼가려는 인도네시아에 뒤통수 맞은거네.",1,1,1
무기개발이 무슨 구멍가게 대파 사는거냐? 그냥 장난치네 ㅎㅎ 계약서대로 안되면 그냥 해지지 . 위약금은 내야하고,0,1,1
