comment,SEJ_label,PEJ_label,MRJ_label
문재인과 이재명은.. 북한에 그렇게 퍼주더니...  왜 저 북한 미사일 발사에는  한마디 말도 못하냐....  같은 편이냐..?,1,1,1
"우리사회의 악은 국민을 배신하고, 뒤로는 가족범죄 수백억으로 사기치고, 학력위조. 명품을 받고 사기치는 자다",1,1,1
쟤들은 돈이 어디서 나오는거야? 비트코인 해킹한거야?ㅋㅋ,0,1,1
북한은 미사일발사 연습도 못하냐?,0,0,1
왜 우리 국방부는 다탄두 기만체를 꼭 실패라고 분석하는 거지?....분석 실패는 인정하기 싫다는 건가?...뭐 내륙에 실패해서 떨어져?...ㅋㅋㅋ,0,0,1
또 한미훈련은 생각 안하나?,0,0,1
러시아한테 돈좀 받았나?,0,1,1
"공격용 드론 24시간 띄워놓고,, 탄도탄 올라오는거 전부 격추해라..",1,1,1
* 조선은 미국과 한국이 모르는 신기술을 계속 창출해 내고 있다.,0,0,0
빈수레가 요란하다는걸 정은이도 알아버렸지 ~~~~~~~석려라 그만 허풍 떨어라 ~~,1,1,1
돼지가 사료 떨어질 때마다 미사일 쑈를 하는구나  곧 살처분 될 짐승인데...,1,1,1
쓰레기 남매 ~ 전세계 민폐 러시아 푸틴하고 동맹 ? 전세계 민폐 덩어리 ~,1,1,1
정은이 투정부리는데 석열이가 한번 만나줘라 자꾸 도발하지 않도록 우쭈쭈 해줘라,0,1,1
대북확성기  사용왜 안히는기삶은소대가리처럼개여정이눈치보는가 대북정책 만은 범죄당보다 낫다고생각햇는데 윤정부 너무실망이다,1,1,1
정은이가 발정이 낫나 왜 자꾸 쏘냐,1,1,1
러시아 믿고 더 힘을 내는거같은데 지금 러시아 전쟁 중이라 너네 못도와줘,0,0,0
쏘면 ...강력규탄 끝,0,1,0
우리나라도 미사일 쏘잖아..  북한 도발하는건가..?? 그냥 훈련 테스트하는거잖아요. 이런 공포 조성하는 기사는 그만합시다,0,0,0
훠훠훠 우리의 혈셰로 우리북한의 미샹의 발사쳬들을 만들어 줄 슈 있셔 너뮤 기뿝니돠 훠훠 쩝쩝~~,0,1,1
남북 관계 좋을려면 돈줘야되는데  돈주며ㆍ 그걸로 전쟁 무기 사는데 .미쳤나 돈주게 .돈주면  절대로 안됨 대북 송금자들 사형이 답이다 반역자들 이다,1,1,1
이해관계만 맞아떨어지면 미중일러와 북한이 손잡고 한국을 초토화시킬수도 있다고본다. 이스라엘과 손잡아야한다.,0,1,1
계속 업그레이드 하는거지 저게 다 테스트하는거 아니겠냐~~~  우린 뭐하고 있냐 ~~,0,0,1
일단. 남북관계 만큼은. 좋아야된다.,0,0,0
문재인과 민주당이 행복해할 소식이네~,0,0,1
북 도발할때마다. 종북 좌파 머리 한대씩 때리고 싶다.,1,1,1
돈달라고 때쓰는 북한...... 대북송금한걸로 화약 놀이나 하고 있으니.... 참... 근데 조국평화 인민당애들은 무엇을 생각할까?,1,1,1
미사일=어자원의 파괴=해양 생태계 파괴,0,0,0
"민주당 질떨어진 국회의원은 전방 지휘간을 모욕하고,정은이는 미사일 날리고,, 민주당 살판 난건가? 왜 말이 없지? 공산당은 인류의 적이다",1,1,1
말만하지말고  확성기 즉각틀어  왠  늑ㄱ대와소년처럼 찔끔찔끔,1,1,1
무능개검정권이 국민들 마음 편하게 하는게 뭐가 있지?,1,1,1
학군이건 육사건 사회분위기가 군에대한 여론도 좋지않고 갈수록 장교나 장군에 대한 예우가 형편없는데 누가 지원하겠냐.,0,0,1
"대우도 안해주고 죽으라고 일만시키는데 누가하겠냐정신이상자들은 걸러서 군대 보내지 말아라
안그래도 힘든데 그런애들 관리하느라
힘들어 죽겠다한다",1,1,1
애국페이만 강요하지말고 확실한 대우를 해줘야지ㅡㅡ,0,0,1
부동시인데 당구는 엄청 잘치는 분이 계시네 ㅋㅋㅋ,0,0,1
복무년한을 원래데로 24개월로 환원하고  초급장교의 거주환경을 개선하고 각종기업체에서  채용하는데 가점을부여하도록하라.,0,0,0
"군대도 안갔다온 국개의원들이군을 무시하고  장성들에게
온갖 모욕과 멸시하니 군의명예가
   땅바닥에 떨어졌는데  어느누가
장교지원을 하겠는가!!!",1,1,1
정치인 자식들이 알티로 먼저 좀 보내야 정책이 바뀌지,1,1,1
떡열이가 만든 월급 더 많이 받는 18개월짜리 헬조선 보이스카웃 다녀오면 되지 기간 길고 월급 낮은 저런데 왜 가나,1,1,0
해결방범은 너무 명료하다 처우 개선!!어차피 해야할 군복무를 더 많은 시간과 노력을 들여서 초급장교로 지원하는데 일반 군복무보다 안좋으면 누가 하겠나?,0,0,1
강유진 여자 중대장 같은 애 또 나올라. 여자는ROTC 금지해라.,1,1,1
부사관은 어느 정도일까요?,0,0,0
얼차려도 맘데로 못시키는데 미쳤다고 장교로가냐 그낭 회사다녀,0,1,1
"멸공, 멸주사파, 멸대깨....멸딸...홧팅!",1,1,1
병사만 처우 개선하고 간부들은 찬밥이니 그럴 수 밖에....그걸 아직도 모른다고요? 병사도 간부도 다 대한민국 국민인데.............,0,0,0
입벌구 사기꾼 부부 댓통 놈과 사진 찍으면 뿌듯해지나,1,1,1
선택적부동시로 병역면탈한 돼똥령이 병정놀이 하듯 군인들 사이에 있는 사진이 너무나도 기괴하다.,1,1,1
여성들은 학사 장교도 있고 삼사관학교 모두 입교하는데 유독 의무복부는 안 해. 아니 이스라엘 여성들은 무슨 출산도 안하고 강철체력을 가지고 태어났나?,0,1,1
"육사를 2,000명 증원을 하세요. 누구 말 한마디면 간단히 해결 되겠구만 뭘 그리 걱정하세요.",0,0,1
이야 사진찍은 애들 좋단다 ㅋㅋㅋ 니들 쟤가 격노하면 박정훈 대령 꼴 나는거야 여튼 군생활 무탈하게 잘 하시길,1,0,1
채상병 건을 보아도 군조직에 충성하고 싶겠나,0,1,1
쓸모없는 여자 장교 뽑지말고 상병에서 6개월 교육후 1년반 장교로 근무라는 단기장교 뽑자,1,1,1
나중에 남자병사 가혹행위해서 죽일듯,1,1,1
"세계에서 희안하게 진급상한이 신분제로 존재하는 나라 ㅋ
병이나 부사관에서 장교로 보내면 될것을",1,1,1
이러니 정부가  무능이라는거다,1,1,0
"월 200도 못받는데 일은 일대로 겁나 하고, 병장이 200 받고 군 복무도 짧게 하는데 누가 하겠냐?월 300씩은 줘야 하겠다..😠😠",1,1,1
누칼협누칼협 노래를 부르더니 이제 더 줄어들 일만 남았다,0,1,1
밥벌이 수단 이었는데?  지금은 기피대상이라는거지?,0,1,1
"문재인이 덕.  하사관도 요즘 조기전역자 줄섰고, 모집 안된댜.",0,1,1
"수구보수들이 문제, 말로만 애국애국 안보안보하지, 지네 자식들 보내라 해",1,1,1
웃음이 나와? 인식은 밑바닥인 마당에....눈치챙겨 윤씨!,1,1,1
정청래이런 종북좌파가  장군을불러다놓고  호나고모욕주니  무신정변이라도 일어나야  정신차리지,1,1,1
"제일 쓸데없는 RT! 사관학교도 아니고 소등병 주제에 학사장교, 군장학생보다 위라는 선민의식이 있음. 당장 없애야함",1,1,1
부동시병역면탈이국군통수권자이니ᆢ,0,1,0
장교  소위월급500만원씩  월급줘라,0,0,1
슬슬 젊은이 고갈이 느껴지십니까? 앞으로 더 줄어들 것,0,1,1
"학군(ROTC)및학사(OCS)장교복무기간5개월씩단축시키고
전국4년제대학 군사학과 육사처럼
확대개편하여 매년1000명씩임관시켜야 합니다!",0,0,1
개차반으로 대우하니깐 그렇지,1,1,1
"장교할 능력이면 군인 안 해도 좋은 직장 얻을만 하니   그렇지,,,,부사관,, 병들을 진급시켜 장교 보충해라,,,,,ㅎㅎㅎ",1,1,1
"부사관들 진급시켜서 장교 보충해라,,,,,부사관 보충은 병들 봉급 마이 준다고  꼬시고,,,,ㅎㅎㅎ   다 돈 문제다..",1,1,1
개머리는 여기도 파국을 만들었다. 여름에 땀 뻘뻘 흘리고 훈련한 이들이 왜 그냥 포기할까?,1,1,0
앞으로는 반에서 꼴지를 해도 장교 될듯 ㅋㅋㅋ,1,1,1
??????????????,0,0,0
윤석열과 저러고 찍고싶냐,1,1,1
군대도 안간 윤도리 사진을 저기에 왜?,1,1,0
"신규 지원자가 줄면 기존 인력을 최대한 잡아야지?그런 노력을 하고 있나?  폭망해야 정신 차리려나?
시간이 없다!",1,1,1
아직도 장교가는 사람들이 있었나...얼른 병으로 짧게 다녀와서 계획 하는 일 하시길...,0,1,1
장군은 커녕 영관급 장교가는 것도 그들만의 리그인데다가 단기로 전역해도 취업에 전혀 도움이 안되는 경력이니 누가 학군하려고 하겠나?,1,0,1
공무원도 안하는 판에 군간부 하겠나ᆢ,1,1,1
초급간부 연봉 대폭 상향하고 군간부 복무 가점 확대하라!,0,0,0
배운거 없는 주제에 징징대지 마라 니들한테는 과하니까,1,1,1
국힘. 장교 임금 안 올리고 뭐하냐.,0,1,1
적어도 장교나 하사관들한테 중견기업 연봉은 줘야지.,0,0,1
석렬이 업적 아니던가?  ㅋ,0,0,0
"군대도 안 다녀온것들이 정치하고 있으니
 뭘 알겠냐..",1,1,1
사병들 군기가 개판이라 장교생활 존나 힘듬.  옛날에는  제대하면 취직이라도 잘됬었지...,1,1,1
똥별들 하는 꼬라지 보고 가고싶겠나,1,1,1
드론 미사일 우주전쟁시대 우주군 양성해라,0,0,1
"나라를 지키는 사람들에 대한 인식, 처우가 개판인데 누가 지원할까..??...",0,0,1
"월급도 적고, 지원해주는건도 없고, 복무기간도 긴데 안가는건 자연스러운거 아닌가",0,0,1
"그동안 공짜인력 데려다 잘썼지, 고급장교들 왕처럼 관사병에 골프병에 과외병까지, 애국애국 안보안보하면서",1,1,1
병사들 돈만 이빠이 올리는 돌석이 때문에 장교 하고 싶겠냐 ? 군대도 안다녀온 돌석이 인디 ㅋ,1,1,1
장교달고 육사똥별들은 절대 겪지마라. 다 앞뒤다르다. 신일순. 신영승 등등,1,1,1
군복을 입은 군인을 보면 든든하고 자랑스러웠는데 국방장관도 청문회에 불려가 찍소리못하는 모습이 ?????????.?????????????????,0,0,1
쓸데 없는 여성지원 예산 싹 없애고 군인 처우 개선에  예산 때려부어라. 나라가 망해야 정신 차릴거냐?,1,1,1
ㅎㅎ 저기서도 여군이 또 몇 명일까. 그러면 진짜 가용한 전투전력은 몇 명이나 된다는 거야?? 딱 2천 정도 되나보다.,0,1,1
복무기간 길고 주로 전방으로 가고 전역 후 대기업 취직 혜택 없어졌어요,0,0,0
"갑자기 일요일에 나와서 일하라는 회사를 니네들은 다니겠냐?똑 같은거야 ~~
가겠냐? 월급이 높아 ?복지가 좋아? ㅋㅋ",1,1,1
대책없이 대선주자들이 하나같이 복무개월수를 줄이는데 앞장선 결과가 아니겠나요,0,0,1
국군장병   여러분이    대한민국    영웅이십니다.,0,0,0
아직도 2천이 넘는다는게 신기,0,0,0
공군은 나오면 취직이 잘 되니  역시,0,0,1
국방에 별 진심이 없고..미국만 바라보고 있으니...,0,1,0
썩렬이가 병사월급 갑자가 존나 올려서 이사단 났지ㅋ,1,1,1
군장교. 임관식에왠 가축이. 있냐.,1,1,1
"이런 당나라 군대에 초급 간부들은  이등병 따까리노릇 할건데 누가 가겠냐.
조만간에 대한민국 자업자득될거다.",1,1,1
거면 갈수록 덜 떨어진 장교들만 입대할것ㅋㅋㅋㅋ,1,1,1
전시도 아니고 평시에 군인이 죽어도 당연하다는 말을 하는 나라가 대한민국 현재 보수가 집권한 나라다.,0,1,1
국회에서 장군도 개 무시하는데 누가 군인되려고할까,1,1,1
청정래같은 놈들이 국회에있는한 대한민국 군인은 없어질것이다 인간쓰레기가 법사위원장이라니 대한민국이재 망해간다,1,1,1
대한민국 역적 핵대중 노무통 문재앙 그리고 찢재명 그뒤에 수두룩빽빽함 / 나라 발전에 피해 일으키면 사형 하자,1,1,1
벨도 없는 것들 저것도 대통이라고 마냥 좋단다.,1,1,1
대학정원 늘리면 된다.   의대정원 3천명 늘리듯  대학정원 100만명 늘려봐라....  누가 지원하나,0,0,1
사관들 사이에 있는 저개는 뭐냐?,0,1,1
육사와 일반출신이 같을수 없지 ..선발할때부터수준이 다른데 육사는 육사다 엘리트!,0,1,1
종북좌팔 민주없는 민주당아 탄핵 특검.노래만하지말고 북한 미사일.오물풍선에대해서 한마디만 해봐라 입을미싱으로 꼬맸냐?,1,1,1
러시아가 적극적으로 도움 주고 있어 앞으로 걱정 됩니다 러시아  무너지게 우리도 우크라이나에 무기 지원 합시다,0,0,1
MIRV 였으면 이미 난리났고 중국도 북한 가만 안둘껄. 구라야.,1,0,1
클났다  핵탄두  미사일에 실어서  수도권에 떨어지면  수백만 몰살하것다,1,1,1
애 쓴다  정은아~~  미사일 쏠 돈으로 인민들 밥한끼더 챙겨줘라 자스가~~,1,1,1
조약하나 체결터니 기고만장했군..!  조용한  참수작전이   답이다...,1,1,0
맨날 안보리 제재 래 저미사일이 뭉가넘 앞마당으로 어떻게 해서 날인갈수없나,1,1,1
구경만 하지말고. 전달만 하지말고 우리도 첨단화. 역량극대화해라. 핵무장 준비도 완벽하게 하고.,0,0,1
"국민들정신차리소
안보가우선이요",0,0,0
우리도 같은 수량이나 최소한절반이라도 비슷한 거리에 쏴라,0,0,0
"기자야 ,  도발이 무슨 뜻인지 알고 막 쓰느냐?  어디를 집적거려서 일이 터지게 하는데?    동해사에 미사일 발사라 해라",1,1,1
군인들 고생한다. 아까운 청춘들. 이 땅에 태어나서 불쌍하다,0,1,1
러시아를 적으로 규정한 윤통령의 외교성과.,0,0,1
임명장을 기계가 쓰면 아니 되나?  캐캐 묵은 사고방식은 그만 둡시다,1,0,1
기계로 죄다 대체되기보다는 사람이 할 수 있는 일은 좀 남겨졌으면 싶다. 필경사 직군도 마찬가지..,0,0,0
대통령 임명장이면 거의 5급 이상일텐데..공무원들 사기 진작 차원에서도 좋을거 같음,0,0,0
그래 댓글들이 뭘 알겠냐... 자기들이 고시 공부해서 붙거나 5급 승진을 해봐야 '왜 다들 임명장에 그렇게 목숨을 거는지' 알 수 있겠지...,0,0,1
글씨 ! 제대로 혼을 불어 넣는 예인은 자기 서명 낙관도 없는 밥벌이에 먹 묻히지 않는다.,0,0,0
시대가 변한게 언제적인데  쌍팔년식으로 가는지.ㆍ.차라리 대통령이   직접써서 준다면  기념이라도 되지.ㆍ.ㆍ미친,0,1,1
부친 돌아가시고 유품 정리 하면서 대통령 시계가 여러개 있어서 다 버렸다.쓸데 없는데 세금 쓰지마라.,1,0,0
ai시대에..아날로그감성 임명장이라. 특이하네,0,0,1
"개인이 필경사를 운영하면 바보같을수도있겠으나, 공무로는 매우 필요하다고 보이긴함.",0,0,1
없어져야할 직군!! 세금 낭비 입니다.,1,1,1
나라 곳간에 돈이 없는게 아니다. 허튼데 돈이 많이 쓰여서 막상 써야할데 쓸돈이 없을 뿐이다.,0,0,0
인사혁신처는 자기 지신을 혁신해야함,0,0,0
이번 정부는 그냥 복사 하면 되잖아. 도주대사 임명장도 복사해서 보낸 마당에. ㅋㅋㅋ,0,1,1
미안하지만. 저놈의. 필경사가. 되고싶지는. 않네.,1,0,0
글씨만 쓰는게 아님. 타이포그라피 전문가라고 생각해보자..,0,0,0
컴퓨터로 치면되지 ㅋㅋ이딴걸 세금주고 모집하다니,1,1,1
이딴거를 세금들여 뽑는다고?,1,1,1
나도 글씨 잘쓰는데 도전해볼걸 그랬나 근데 요건이 빡시네,0,0,0
참내 경기도는 학교에 시설관리직 배치할 돈도 없는데,0,0,0
로봇으로 대체해라. 굳이 상징성을 따진다면 대통령이 직접 쓰던가.,0,0,1
아직도 조선시대를 사는구만,1,1,0
컴퓨터로 뽑아 써라. 뭐 하려고 헛돈 쓰나,0,0,0
국가 행사 난 줄 알았네~   이런 기사는 또 처음보네!,0,0,1
한국에만 있는 독특한 직책. 아니 임명장을 손으로 써는 직책??  21세기에 무슨 말이냐고.어이없을 뿐,0,1,1
정말 공무원 생각수준 낮다. 웃기지도 않는다. ㅋㅋ,1,1,1
김건희 코바나컴퍼니에서 사람 뽑겠지…물론 돈 받고…매관매직 김건희 매직,0,1,1
좋은 글꼴 적용해서 컴퓨터로 출력하지.대체 어느 시대에 사는건가.,0,0,1
헛소리하고자빠졌네 인건비 줄여라 이런게 쓸때없는 예산낭비사례다,1,1,1
임명장은 주는사람 본인이 써야하는거 아닌가?,0,0,0
월급 얼마? 걍 기계에게 붓글씨를 알려주면 안돼?,0,0,1
권위의식이 강한 이면에는 종놈 의식도 강한 측면이 있다. 공무원들이 특히 그러하다.,1,1,1
요즘 학생들은 우리나라가 아직 휴전국가 라는 걸 모르는 사람이 많더라. 언제 전쟁 다시 시작할 지 모르는 불안한 휴전국임.,0,0,0
양산사는 책장수가 요즘 뭔일이 있나 잠잠한데 그쪽으로 미사일 한방만 갈겨주라 정은아!,1,1,1
북한이 미사일 쏘라고 좌파들은 서로 경쟁적으로 돈을 갇다바치고 한민족끼리 난리통이네,1,1,1
"똥별들에 맏겨두면 해결될것이다.
그들이 미상일에  똥을  넣어 날리면  북조선이 똥바다 되지않겠슴....",1,1,1
동해상으로 쏘지말고 여의도로 쏴라....,0,1,1
내가 대똥때 바친 돈으로 미사일도 쏘시고 오물풍선도 보내주시고.. 감사합니다. ㅡ 종북머저리 ㅡ,1,1,1
돈달라고 징징거리네 ㅉㅉ,1,1,1
양산문책방. 사장님.   미사일이. 아니라. 돌멩이입니다.,0,0,1
그래서? 대책있냐구?한두번도 아니잖아? 놀랍지도않아,1,1,0
또 대통령은 쉬는 날이라서 NSC 참석도 안하냐?,0,0,1
"왜 민주당 좌파 놈들은 북한의 저짓거리에 말 한마디 제대로 못 하냐고. 사람이 부끄러운 줄을 알아야지-!!! 공산당은 악이야, 악. 악마라고 전부-!!",1,1,1
문재인과 민주당이 좋아할 뉴스네~ 적화통일 되길 바라는 빨간 것들이니까.,1,1,1
문재인이었으면 북한 공산당한테 빌빌 기었음 ㅇㅇ,1,1,1
문재앙과 이죄명 나라 망친다,1,1,1
이제는 말이야. 아파트 고층에서 베란다로 쓰레기 상습 투기하는 짓처럼 보여. 격이 떨어지다 못해 그냥 짜증난다.,1,1,1
문재앙 1천조 국가부채의 결과,1,1,1
저것을 기회로 우리도 핵전력 강화하길.,0,0,1
김대중 문재인 이재명 같은 암적인 존재와 암호화폐가 김정은의 밥줄이다,1,1,1
"* ""종이로 만든 미사일이다."" 이런 거짓말을 믿는 바보들이 아직도 존재하는가...? ㅉㅉㅉ...",1,1,1
맨날 분석만 하면 단가?,0,0,0
저러고 싶을까 그래서 왜 저러는 거야? 그럴 바에야 북한 사람들의 걱정이야. 그래서 식량을 구하던가 자기만 살겠다고 막 저렇게 하는 거 맞는 거냐 아이고,0,1,0
정은아 너따위가 세상에 쓸모가 있다고 생각허냐?,1,1,1
돈이 어디서 나서 수억원씩하는 탄도미사일을 툭하면 발사하나 .,0,0,1
우리도 새총을 만듭시다,0,0,0
정은이가 힘받았다 계속쏠것같다 정은이가노리는것 우리는착실히보답한다 경상도 전라도 좌파우파 열심히싸워라 정은이는복도많다 적국이도와준다,1,1,1
https://www.youtube.com/watch?v=5mSWhCWrNrE,0,0,1
대한민국 패싱의 역사가 시작되려는듯...  트럼프 뜨니 미국에게 대화하게 트럼프 뽑으라는 응원의 미사일인듯.,0,1,1
"오늘부터 계속 북한 뉴스를 가져와서 탄핵 청원 뉴스를 덮어야한다!이제 곧 백만이 될텐데 백만이 되기전에 막아야 해! 
북한 미사일 뉴스로 도배를 하자!",0,1,1
결국 국짐에 민주당도 윤석열도 당한거야  나라는 개판되고 ㅋㅋㅋ,1,1,1
대북송금 관련자들..천벌을 받으리..,1,1,1
석열이는 묵묵부답   대선때 어퍼컷 하면서 그리 선제공격 씨부리드만,1,1,1
석열이는 주말에 쉰다..,0,0,0
미사일  날리고  주민들  배 더더 고파지고  김돼지는 살 더더 찌고...,1,1,0
관심없다. 쥴리 특검이나 밀어 부치자. 어차피 전쟁 안난다.,0,0,1
야당은 잠잖고  미샬 더 쏘라고  응원하고 있는데...  최대장  김건휘  특검만 물고늘어지잖아...,0,1,0
지난날은 다 잊고 맥주 한잔 돌릴께여,0,0,0
두창이가 얼마나 만만했으면,0,1,1
북한에서 무인기가 날아오든 오물풍선이 날아오든 아무 것도 안하는 대통령이 앉아 있으니 더 걱정이다.,1,0,1
북한에 돈 퍼다 준 놈들 쓰레기 치우게 하라,1,1,1
림종석이 저작권료 명목으로 북한에 주려다가 못주고 법원에 공탁되어 있는 29억 원으로 피해 보상해 줘라.,1,1,1
혹시 남에서 북으로 보낸 풍선으로 북쪽에 피해 입힌건 없는지 살펴볼 때다.,0,0,0
삐라 보낸 탈북자  단체에서 보상 받아야된다,0,0,1
북한에도 남한 탈남한사람들이  쓰레기을 날려보냄  뭐라 하지마라  남한에서 먼저 금지해라,1,1,1
돼지 이쯤 멱을 따자~~~,1,1,1
어리석고 북괴추종세력 문재인이 역적질 제대로 했지,1,1,1
공산주의좌파 집단 전라도 나라결국 팔아먹을것들ᆢ,1,1,1
범죄자.종북들 세상 북은 핵실험 미사일발사 그래도 평화가 왔다고 판문점 쇼나하고...,1,1,1
도대체 왜 이나라국민들은 문재인 이재명한테는 관대할까...,1,1,0
전과4범 전과자이자 형사재판 진행중인자가 더불어 범죄공산당 야당  두목이다.선량한 시민으로서 공포 스럽다.,1,1,1
북에관해서는 국힘 말이맞는듯,0,0,1
전쟁하면 도와준다고 일본 식민지배 하겠지! 역사는 반복하잖아 돌머리야? 장관이 돌이니 대통령은 우라늄이지!,1,1,1
국방장관이 전쟁하제 한민족끼리 일본 간첩 아냐!,1,1,1
맞음.  김대중 노무현 문재인이 퍼주며 평화타령으로 핵무기 완성에 일조한것들이지.,1,1,1
국방부가 나서서 빨리 핵무장 추진해라.,0,1,1
문재인의 간첩질ᆢ9.19.,0,1,1
간첩이 아니라면 역대급 호구 합의였는데.그나마도 우리만 지켰지.,1,1,1
인구도 두배가 넘고 국방비는 몇배 더씀서 갸들이 겁내야지 왜우리가 겁내야 하는거냐,0,1,1
붕짜자붕짝이 장관? ㅋㅋ부끄럽다,1,1,1
간첩한놈이 5000만국민의 생명가지고장난질한것 뭉가놈은 광화문네거리에서  자아비판하고  고사포로저리해야됨,1,1,1
북한동포가 좋아 식민지배한 일본이 좋아 ! 일본에나 가 장관 계속 장관해라!,1,1,1
안보는 양산 그 놈이 망쳐 놓고 지금 북한이 두려워 경호원 65명씩이나 델고 있는건가!!,1,1,1
역대 1위 무능력 겁쟁이 1위 양산 무너벙 기네스북 등재 시급,1,1,1
평화를 바라는자 전쟁을 준비하라!,0,0,0
이런게 장군이지.. 김병주 별떼라.,0,1,0
그럼 박근혜 이명박땐 뭐했냐? 핵개발하는데?,0,1,1
와 진짜 전라도는 노답인거 같다...  종북 좌파 공산세력은 나쁜건데 어떻게 이걸 받아들일 수가 있냐... 도대체 이해가 안되는 지역임,1,1,1
"나라가 시끄럽다. 지휘관 문책하고, 채상병 위로하고 국립묘지 안장하면 끝날 일이었다.가만히나 있으면 됄 일을, 왜 쓸데없이 나서서 나라를 시끄럽게 하나?",1,0,1
소대가리가 나라꼴을 이꼴로 만듬,1,1,1
사단장까지 징계하면 끝날일을 뭐한다고 이렇게 많은 사람을 힘들게 하냐..자꾸 감싸니까 의심하는거야  멍중이들아,1,1,1
이종섭 국방장관과 통화한 800 전화번호 쓰는 사람이 누구인지 그것이 탄핵의 트리거가 될것 같다.,0,0,1
"자식의 죽음을 정치질에 이용하는 민주당을 보면 치가 떨린다.이재명 하나 지키려고 검사탄핵에, 특검에, 
나라꼴이 민주당 때문에 엉망진창이다.",1,1,1
재밍이나 조사해서 처벌해라,0,1,1
자기 살려고  부하  징역 시키는  재명이는  어떻게 했으면 하냐?,1,1,1
그냥 세월호 2탄 같다. 고문 당해서 죽은 훈련병에 대해서는 아무 말도 없는 그쪽 사람들.. 중대장이 여자라서 그런가?,1,1,1
싸나이 해병대는 구명조끼 안입습니돠~!!  싸나이 해병대는 조건따위 따지지 않습니돠~!!! 안되면 되게하는게 해병대 입니돠~!!,0,0,1
분대장. 소대장 .중대장 .대대장 이 책임 지면 됨니다~~,0,0,1
부모 맘은 이해 하지만 군에서 인적 문제 생길때 마다 최고 책임자까지 문책 하면 누가 남아서 우리 군을 이끌까요. 문재인?,0,0,1
채상병 듣기만해도 지겹다  하룻밤에 9명 죽어나가는판에,1,1,1
저기요 페미중대장이 훈련병죽인거는 왜 중대장 구속으로 끝나나요? 사단장까지  모가지날아가야죠 조용하네?,1,1,1
군인의 명예를 걸고 몸통을 밝혀라,0,0,0
나라꼬라지가 잘돌아간다 언제까지 특검 타령이야 이죄명이 문죄인 특검해라,1,1,1
서해 공무원 피살사건 책임은 왜 묻지 않나. 소대가리를 구속하라!,1,1,1
세월호 시즌2네. 주제파악 못하고...,1,1,1
전라도에서 경북까지 탄원서 제출하러 가시고..고생 많으시네요.,0,0,1
현장  소대장  중대장 이런사람들이  좀 잘하지,0,0,0
