comment,SEJ_label,PEJ_label,MRJ_label
마지막 남은 70대 이상 여론만 붙잡으려는 균형감 없는 어리석은 행보,0,1,1
"지금 이시기에 어디를 가야되는지 생각좀 해바라,,,,저리도 생각이 없을까,,,,,,,총선때 탄핵의석수 막아줘서 고맙다고 인사하러 가는거냐?",1,1,1
효도하는 정부... 너무 유치하다. 당영한 일이고 초등학생등이 숙제로 하는 일을 정부가 한다고 난리. 쫌 진짜 일을 해라.,1,1,1
아...저사진보고 진심 속 겁나울렁거렸네 ㅜㅜㅜㅜㅜㅜㅜㅜㅜㅜㅜ,0,0,1
현직 대통령 첫 장모 깜빵 면회나 가라,1,1,1
ㅋㅋㅋ 애쓴다 진짜 ㅋㅋㅋㅋ 낼모레는 용산 공원 가서 사진 찍을거냐??ㅋㅋㅋ,1,0,1
가야죠 그분들아님 10프로도안나올텐데,0,0,1
쌍판 봐라... 윤재앙,1,1,1
괜찮다가도 이XX 낯짝만 보면 화가 치밀어 오르네....진짜 뉴스를 끊어야 하는건가.....ㅠㅠ,1,1,1
경노당에 돈 거만 퍼줘라 거기서 처먹는 것들만 팔짜 고치더라,1,1,1
댓글보러 왔는데 아니나 다를까 ㅋㅋ,0,0,0
나라가 어찌되든가 말든가 기념사진^^대~~~~~박큰일이다,0,1,1
"웃는 얼굴로 한국의료의 가슴에 칼을 꽂아, 태연히 죽이는 자.",0,1,1
70년전 우리는 북한보다못살았다 이만큼 누리고 먹고살수있는건 똑똑한 지도자와 기업가들 그리고 그시대를 살아온 우리 어르신들덕분이다,0,0,1
효도정부는 무슨 얼아죽을,1,1,1
노망난 리더가 치매 걸린 2찍 노인들 가스라이팅 하네...ㅋㅋㅋ,1,1,1
잘했다    노인들을   가볍게  보지  말라,0,0,0
어 ㅂ ㅓ이를 싫어 하는 조 ㅏ  파리 들........,1,1,0
윤석열 대통령을 증오하는 분들은 혹시 외국인들일까,1,1,1
친일파 장학생이 효도를 강조하는 이유는 입 다물고 살라는 건가?,1,1,1
널보면 애들배울까ㅣ겁난다 저런개가무슨?,1,1,1
니 애비 죽을때 김건희 안 갔지 무슨 어버이애기하냐,1,1,1
어짜피 지들 표는 거기서만 나온다는 거지.,0,1,1
얼굴이 불알 닮으셨어요,0,1,1
의료계에 짱돌 던져놓고 난리 났는데 이 와중에 문체부 공무원은 간단한 수술 받으려고 아산병원으로 청탁 및 전원함. 이게 대한민국 공무원의 민낯임,1,1,1
저 탈모쓰레기는 언제 잘리나요? 사의 밝힌지가 언제드라,1,1,1
"의사들은 복귀하고 싶어하는데 복귀 못하도록 막고 있으니 환자들만 죽어가는거지. 2,000명 증원 과학적 근거는 신내림 아닌가 싶다.",0,1,1
사표낸지 언제인데 아직도 총리인가....,1,0,1
니는 아파도 병원오지말고 고독사해라,1,1,1
"OECD식 진료 원하자고 하는거 아님? 초진까지 3개월, 수술까지 최소 6개월.... + 전세기 !!",0,0,1
본인 아플때 빼곤 병원 갈일없는 총리가 하루가 멀다하고 환자생각하는척  쇼질하고 다니네,1,1,1
지들이 싸지른 변 치울생각은 않고 그 냄새싫다고 간 사람들 돌아오라소리는.  한심하다,1,1,1
"메달 면제 폐기 하고 , 여성도 징집해라",0,1,1
말도많고 탈도많은 병역특례제도를  폐지해라  신성한 국방의무보다  우선시할 것은  없다,0,0,0
미필은 정치 못하도록 해야함. 여성이라도 부사관 또는 장교복무 필한자들만 정치하도록해야한다,1,1,1
당연히 폐지 해야한다...바보만 국가를지키냐?,0,1,1
저출산으로병역자원도모자른데 병역특혜제도는 없애야한다,0,0,0
병역특례는 조건없이 폐지해야한다고 생각함,0,0,0
추신수를 싫어하는 이유,0,0,0
노벨상 받아도 군대 가는데 금메달이 무슨 상관? 특례 없애라.,0,1,1
부가가치세부터 폐지해야지.,0,0,0
체육 특례는 어느정도 이해는 가지만 연예인들 특례는 없어져도 된다고 봄.. 대부분 30살까지 질질 끌다 어쩔 수 없이 가는 경우가 태반이라..,0,0,0
여자는 왜 군입대안하나요.애낳아서? 30세까지 안낳으면국방세라도 내자!!!,0,1,1
BTS가 군복무하는게 당연한거지!,0,0,1
"변질된지 오래다..그리고 예전에는 군인으로 모집할 사람이 넉넉할때고, 지금 시점에 특례가 필요한지 모르겠다. 폐지하자. 시대적 사명이 다한 제도이다.",0,0,1
이런건 하나 맘에드네~ 예전같았음 비행체가 넘어오던지 말던지 눈치보느라 고민만하고 있었을듯ᆢ공군경공격기급파?격추?멋지네!,0,0,1
열기구에 김정은 얼굴 인쇄해서 북칸으로 띄워보내자..절대 격추못할듯 ㅋㅋ,1,1,1
오인하더라도 출동해서 직접 확인 하는게 낫다.,0,0,0
세금없는 나라~ 양산에서 실현중인놈 있던데,0,1,0
이런 멍청이들 !!!시대가 어떤시대인데 ...,1,1,1
우리나라도 븍으로 삐라를 마구마구 뿌려라 김정은 척살하면 금과1톤 포상한다고 그리고 3대까지 집과 직장을 준다고 해라,1,1,1
풍선 날리는데 전문가들이 즐비한데 탈북자들 풍선맛 함 봐야 정신차리지,1,1,1
"비행체 확인안하고 격추하다니, 특검하자고 깡짜부려야지.",0,1,1
메뉴얼대로 대응한건 칭찬해,0,0,0
북에서 오는거면 풍선도 경계해야지 당연히 .. 거기에 탄저균 같은 생화학 세균이라도 있으면 큰일이다.,0,1,1
아직도 계란후라이에 고기반찬준다고 넘어오라고 광고하냐? ㅋㅋㅋㅋ처음들었을때 개웃겼는디ㅋㅋ,1,0,0
풍선인지 드론인지 믿을수가 없다,0,0,0
3월...ㅋㅋ 지금공개하는 목적이있구나.. ㅋㅋ 지지율 30%는 유지해야되니 지금 풀때 됏지,0,0,1
야구는 특히 특례 제외해야함 ㅇㅇ,0,0,0
이번 기회에 특례 없애고 인구 절벽을 앞둔 시점 여자들도 군대 가 즈 아~!! 🤔,0,1,1
"모든 국민이 병역의 의무를 수행해야 합니다. 지금이라도 예술, 체육 병역특례는 없애야 합니다.",0,0,0
클래식ㆍ어중간한 입상자들ㆍㆍ,0,0,1
군대를 안가는 애들은 국가가 신체검사로 인정한 공인 장애인이다 특례 빼고,1,1,1
병역 특례는 전부 폐지 하는것이 올바르다고봄.여러 가지 시비도 없어지고.법앞에 만인은 평등하지 않은가요?,0,0,0
OECD평가 A+인 한국의 의료를 OECD 평균에 맞추라고 하는 거꾸로 대통령 윤석열....,0,0,1
세계에서도 손꼽히는  한국의료계를 눈떠보니 의료 후진국으로 만들어놨네..,1,1,1
정확히 말하자! 의정 갈등이 아니라 의새들의 특권 의식과 밥그릇 챙기기 카르텔이 문제지. 전 세계에 한국 의새들처럼 집단 카르텔 만든 나라는 없다!!,1,1,1
한국은  부자..트럼프가  말함!  부자니까 영국처럼 공공의료로 가자.,0,0,1
한국의료 빵점이고 의사들도 양아치같이 되어 버림.,1,1,1
"한국은 의료진만 좋다. 노동강도, 보험 수가체계, 각종 소송 등은 세계 최악이다",0,1,1
"""韓의료, 세계서 손꼽히게 훌륭…의정 갈등 안타깝다""ㅡㅡ 손기술만 뛰어나면 머하냐. 환자도 가차없이 버리는 오욕덩어리들인걸!!!!!",1,1,1
시스템은 좋으니 사람만 바꾸고 늘리묜 될듯,0,0,1
대한민국 의료정책은 의사님들 허락없이 한발도 못나갑니다. 역대정권에서도 그랫고...써글넘의 의사넘들...,1,1,1
"의새 넘들이   ~~   자화자찬 하며 국민을 속이고 있죠   ~~   죽은자들은 말이 없지만 ,  설움받은 환자는 동의하지 못하지요",1,1,1
"물론 시스템은 좋지, 그러나 시스템보다 더 돈을 좋아하니개선 해야한다는 것이지.",0,0,0
부럽다 저사람들은 살려놔도 기분상해죄로 소송걸고 자빠지는 조선 개돼지 국평칠 가붕게들 볼일 없어서 ㅜㅜ,1,1,1
"그 우수한 한국의 의료시스템을 한번에 박살낸 정신병자 윤석열,박민수! 정신병원에 처넣고싶다!",1,1,1
기술이 아무리 좋으면 뭐하나 마음이 삐뚤어져 욕심만 가득한 괴물인 것을.,1,1,0
한국 의사 놈들 처럼 돈에 노예가 되지마라,1,1,1
한국은 굥사기꾼이 의료체계를 마비시키고 있다,1,1,1
무료로 진료보러 3개월 기다리시겠어요?몇천원 내고 당일 진료 보시겠어요?,0,0,0
폐기물 하나의 고집으로 대한민국 의료 시스템 자체가 붕괴되었지,1,1,1
물론 훌륭한 의사님들도 있겠지만 지금 파업하는것들은 그런훌륭한분들하곤 거리가 먼 인간들이지.....,1,1,1
이 기사를 윤데지세끼가 싫어합니다.,1,1,1
기술은 손꼽히게 훌륭한데 이번에 만전하에 드러남.. 인성은 세계에서 꼴지 수준인것을,1,1,1
영국은 의료가 무슨 복권이네 ㅋㅋㅋ 공짜 ?? 돈 있어도 당첨 안되면 못사니 공짜겠지,0,1,1
댓글 연령대 50-60대 합 71퍼센트 ㅋㅋㅋㅋ 의사 욕하는 사람들이 이분들이었구나,0,1,1
의사들은  아니고 시스템이. 좋은거죠. !,0,0,0
말은 바로해라. 의료대란이 아니라 의사폭동이다.,1,1,1
한국 의료 서비스가 세계 최고라는 것은 직접 외국에서 살아보면 알게 됨.  어떤 멍청이가 의료 개헉(개악)  주장했을까요?,0,1,1
최고로 우수한 인재들이 몸을 갈아 만들어놓았더니..,0,0,0
"한국의료는 쵝오야 의사들이 돈 많이 받는다고 이런식로하는건 아니지....필수의료,지방의료는 의료시스템을 변경해야해",0,0,0
2칙들한테는 필요 없는 k-의료! 아프면  사이비교로 간다 ㅋ 룬성녀리는 천공의 하수인,1,1,1
이번 사태를 보면서 민노총 보다 더하고 가장 패쇄적인 집단이 첫번째 국회고 그 다음이 의료계라는걸 깨달았다,1,1,1
너무훌륭해서 뺑뺑이 돌다 죽는가보다,0,0,0
의술만 좋으면 뭐하나 인성이 아닌데 아마 연봉도 제일 높을것임 그 좋은 의수로 치료좀히지,0,1,1
백정과 의사는 한끗차이다...목적이 돈 & 목적이 의술,0,1,1
세계일류면 뮈하냐 인간성이 의사쟁이 장사꾼수준인데.,1,1,1
그렇게 의사를 악마화하더니 ...조중동이 윤을 버리긴할려나보다.,1,1,1
황금알을 낳는 거위 배를 갈랐다,0,0,0
"국가의료시스템의 최대수혜자임에도... 고마움을 모르고   막가파인성을 드러내는
것이 더안타깝습니다...",0,1,1
야당에서 지지하는거 보니 이 정책도 양아치 정책인가 헷갈리네 ㅋ,1,1,1
뭣도 모르는 정부라서 그렇죠,1,1,1
개석렬이 하라는 법조 연금 개혁은 안하구 최고 선진 의료계는 쑥밭 만들구,1,1,1
2찍 꼴통들 의사들 의술은 좋은데 인성이 개라서싫데 ㅋㅋㅋㅋㅋ의술안좋고 인성이 좋은거보다 나은거아님?의사랑 살것도아니고 ㅋㅋㅋㅋㅋㅋ,1,1,1
저기 영연방 왕국 병원은 진짜 헬인거 모름?,1,0,1
기술은 좋은데 인성이 안된다는 거네요,0,0,1
영국식의료 호주이민간 친구가 이민을 후회한 유일한 순간이 아버지가 심장병으로 돌아가셨을때라고,0,0,0
륜삭얄이 세계 3류만들기 진행중,1,1,0
한국의사는 봉사정신없고 그저 돈밖에 모르는 돈벌레임외국의사들이 요즘처럼  존경스럽게 보일때가 없음,1,1,1
한국의 의료시스템은 세계적으로 휼륭하지만 의새들의 자질이 그에 못미친다는게 문제지....심지어 의사윤리도 없음.,0,1,1
윤석열이 의료체계와 의료질 그냥 말아먹네요 빨리 탄핵당하기를 기원합니다,1,1,1
의술은 모르겠고 인성은 개다,1,1,1
실력도 중요하지만 인성이 우선이되는 사회가 건전한 사회이고 선진국으로 인정받는거다,0,0,0
자화자찬 하고 자빠졌다,1,1,1
기술만있지 인간이 덜됨,1,1,1
정말  죽을 병  걸려봐야 의사가 하나님처럼 보이고 선진화된 의료 시스템 병원에 감사하지~~  능력있음 기부하고 싶다!!!!,0,0,1
외국에 사는 비의사 한인들 인터뷰 좀 해봐라. 이번 사태에 대해서 어떻게 생각하는지? 한국 의사들의 집단 파업에 대해서 어떻게 생각하는지 ㅋㅋㅋㅋ,0,0,0
잘하고 있는 집단을 왜 들쑤셔 놓는지 정말 안타깝습니다,0,0,1
그러네요 의정갈등을 조장하는 정부의 무능이 개탄스러울 뿐입니다.,1,0,1
원가도 안나오는 적자 진료에 그 적자메우려고 전공의 최저시급에 써.. 장례식장 검진센터로 적자메꾸는 기형적인 구조는  안고치고 인원만 늘리고 있으니...,0,0,1
역시... 해외 가재도 가재는 가재라 절대 의사 욕 안 하네 ㅋㅋㅋㅋ 혹시 한국 들어올 수도 있으니 말이지?ㅋㅋㅋㅋ,1,1,1
돈에 환장한 집단일 뿐이다.,1,1,1
뭐하나  제대로 하는게  없는  윤석열이가   도대체  왜  또 의료에  손을 대는지....얼렁뚱땅....진짜   대통령이  꼴도 보기 싫다.,1,1,1
그렇게 안훌륭해도 된다. 충분한 진료 받고싶다. 붕어빵 찍어내듯 환자 보지 말고... 요새 의새들을 환자가 돈으로 보이니?..,1,1,1
실력과 인성은 별개라는게 요번에 증명되었다.  醫師가 아니고醫事인걸  요번에 알았다.,0,1,0
정부가 외치는 의료개혁=세계적인 자랑거리 였던 K- 의료 말살과 붕괴,0,1,1
"한국의료, 내용은 민간인데 거기에 정부가 숟가락 얹고 사회주의식으로 운영한다. 모순이고 지속가능하지 않다.",0,0,1
외국나가서 병원한번가봐라 ㅋㅋㅋㅋㅋ,0,1,1
문제는 의사의 실력을 논하는게아니다. 정원 늘리지말라는게 초점이다.잘 알고  판단해야한다,0,0,1
지금 여기서 붕괴되고 있는 NHS 를 찬양할 때가 아닌 것 같은데,0,0,1
"어차피 한국사람들은 이미 누리고 있는 것에 대한 감사함은 없어요.
전문의 만나는게 이렇게 빠르고 편한 나라도 없는데",0,0,1
대학병원가면 의사.1분 면담도 어렵다..,0,0,0
단체에서 좌표찍고 댓글남기기 캠페인 펼치셨군....저 기자 누구니?,1,0,0
채은아 니가 몰 아노;; 에혀,0,1,1
왜 훌륭하긋냐.... 가격을 국가에서 통제하고... 그냥 엄청 싸게 의료를 책정해 놓으니깐 훌륭한거지 ㅋㅋㅋㅋ,0,0,1
인성은  세계최고로 더럽지,1,1,1
그걸 알면 개돼지가 아니게...,1,1,0
의사들이 만든 의료시스템이 아니라 수십년간 정부와 국민이 만든 시스템이다.   의사 다 면허증 반납하고 이 땅을 떠나라. 외국에서 들여오자,1,1,1
훌륭한 의료인이라면 나라의 최고 결정 꼭대기에서 흔들어대는 행동을 해서는 안된다. 좀더 겸손한 자세로 자신을 낮추면 존경받는다,0,0,1
윤석렬 각하 대단하십니다.한순간에 한국의료를 아작을내는 실력에 감탄할뿐입니다,0,1,1
헛소리하고 자빠졌네 독점적인 상황에서 기껏 얼마나 우수한데 야기해봐라  ᆢ,1,1,1
"대한민국 1류 의료를 3~4류인 정치권과 관료들이 ""의료개혁 "" 으로 거짓포장하여 ""의료난도질 "" 을 하고있다.",1,1,1
우수한 의료역량을 국민과 환자가 체감하고 혜택을 받을 수 있도록 의료개혁은 반드시 필요합니다!!!,0,0,0
"스스로 과욕 부리다가, 자폭하고 있는 꼴.",1,1,1
이럴 때 일수록 입 닥치고 있어 주세요,1,1,1
결국 밥그릇이죠 그렇게 훌륭하면 조금 덜해도 개혁하는데 낫죵,0,1,1
정치가 꼴등이라도 의료는 상위권이었는데 굳이 oecd 평균으로 끌어내려서 평균맞추려는 정책 ㅋㅋ,1,1,0
이 상황에 1도 필요없는 내용,0,0,0
"배 아파하지 말고, 하향 평준화 시킬 생각하지 말고… 몇천원 내고 수준급 의사들 진료 받는걸 감사해야돼…",0,0,1
윤석열이 기존의한국 의료는 죽였어. 이제 OECD 평균야. 국민이 원하는대로.,1,1,1
실력있으면 지들끼리만 해쳐먹어도 되나. 엄연히 응급의료 제대로 안돼 죽어가는 환자가 부지기수인데,1,1,1
전국민의료보험시스템이 훌륭한 것임.,0,0,0
"의새들!자기 밥그릇 줄어들까봐 온갖 궤변을 늘어놓는다.
개만도 못한거 아닌가?",1,1,1
이번에 돈벌레 의새들만 분리수거 면허박탈 추방하고 의사다운 의사로만 물갈이해서 세계최고 의료계로 도약하자~~^^,1,1,1
훌륭하지. 근데 그걸 독식하려니 문제지.,0,0,1
복지부가 다 망쳤네요 ~,0,1,0
ㅋㅋ 의료시스템 좋은데 남 잘되는꼴 못보는 놀부심보로 지네들 복을차는거지 의료시스템은 나빠지고 보험료는 오르고 ㅋㅋㅋㅋ,1,1,1
증원하는 필요성도 입증된거없는데 그저 앵무새처럼 늘리자고하네ㅋㅋㅋ,1,1,1
"의정 갈등 ?  뽕이다 "" 환자 인질극""이다",1,1,1
한국 의료가 세계 최고면 뭐하나? 의사들 인간성이 그런데~~,1,1,1
"안타까우면 뭘합니까?  지  뱃대지만 잇속을 챙기는 아주 나쁜놈들인데,    ~~~   😭",1,1,1
잘 돌아가고 있는 기계를 왜 고쳐요? 고장나지 않은 것을 고치자고 하는 놈은 사기꾼임.,1,1,1
의사 증원 정책이 옳고 그름을 떠나  환자를 버리고 자신의 주장을 관철 시키는 의사 집단이 동서고금에 어딨나?,0,0,1
의새들이 환자 버리는 인성은 세계 최고~!!,1,1,1
그런데 총선에 잘난척하려다 윤석열이 다망쳤지!!! 이젠 능력이 안되니 해결할 의지도 없지!!!  썩을것!!  병원가기 힘들다!!,1,1,1
배부른 조선 의새악마들,1,1,1
일본의료보고 힐러리가 일본의사들의 희생과 헌신에 놀랐다고 하던데. 그거 아냐? 일본의료 수가 우리나라 3배고 근무시간 절반이다,0,0,1
시스템이 훌륭한 거지 의새가 훌륭 한건 아님..,0,1,1
의사수를 늘리고 의료수가는 낮춰야 한다,0,0,0
우리도 영국처럼 외국의사 모셔 옵시다.,0,0,0
웃기지마라 이기적인집단 한때 존경했던 자들이 괴물로 보인다.,1,1,1
"한국보다 못한 의료 후진국 의사들 인터뷰나 따고, 참 급했다.",1,1,1
세계최고 대한민국의료를 개혁하겠다는 후진국형 정치인들,1,1,1
우수해도 인성이 걸러먹었으면 돈의 노예가 되는거지 환자 치료?  난 모르겠고 무조건 권력과 돈이지,1,1,1
의사들 더 뽑아서 세계시장에 진출해야 한다!K팝처럼!!,0,0,1
의사놈들이 정신이 나가서 정신이 없읍니다.의사의 본분을 저버리고 국민의 아품을 후벼파고 있답니다.어찌 이런 말도안되는 행동들을 하는지 너무 어이가없네요.,1,1,1
치과는 의사가 아닌디..,0,0,1
"국민들이 적극 지지하고 합리적인 국가 정책을 의사 집단이 조직적으로 반항하고 무산시키려고 하는 것은 잘못됐다. 집단이기주의의 산물이자, 과욕이다.",0,1,1
최저 가격에 최고의 의료를 누리는건 의료진의 희생이 있었기 때문인데 그마저도 깨부수려고하고 악마화하면 누가 희생하려고 할까요,0,0,1
한국의료가 잘된것은 의료보험제도때문이지 의사들때문은 아닌듯~~~,0,0,1
우리나라만큼 의료 접근성 좋은 나라는 없다,0,0,1
의사들 공무원화.. 확 와닿네?,0,0,0
가장 중요한 응급실과 필수과가  무너졌는데 시스템이 좋긴 뭐가 좋아.,0,0,1
정치적으로 의료를 써먹는 놈들이 문제,1,1,1
"한국의료가 우수하기 때문에 의대 증원을 추가로 해서도 안되고, 지방 의료가 더 발전해서도 안된다는 논지가 아닌 이상은 아무 의미 없는 기사이다.",0,0,1
의료체계는  최고의사 수준은 최저,0,0,1
영국 의료가 좋으면 그렇게 하든가? 그동안 얼마나 좋았던 의료시스템인지 알게될거다..,0,0,1
전세계에서 우리나라 만큼 의사한테 월급 많이 주는 나라는 우리나라뿐 그러니 잘돼고 있지 돈 더 받을려고 증원 반대하고 있다 알도 이야기해라,0,0,1
무상의료이기 때문에 의사 얼굴한번 보려면 예약하고 몇달 기다림을 감수해야 하는건 빼놓으셨네,0,0,1
잘못 봤겠지?  한국 의사들?  환자를 버리고 도망가는 의사들도 많아?  제대로 보라~~,1,1,1
의사 많아지면 국민이 불편한게 있나요?,0,0,0
한국에서 정부랑 싸우지 말고 의사들 다 외국으로 튀라는거 맞지? 나가는데 붙잡지나 마라,1,1,1
우수한 의사가 많아지면 좋은 일 아닌가.,0,0,1
해외의사들도 훌륭하다고 판단하는 한국 의료를 개판 oecd 평균 의료로 만들려는 정부는 정신 좀 차려라!!,1,1,1
영국을 포함한 유럽은 진료볼려면 수개월걸림...,0,0,0
한쪽은 아에 듣을 생각이 없는디...,0,1,1
그렇지 bts가 군대 간 순간 병역특례 주장할 수 있는 기준이 성층권 뚫고 날아가버림,0,1,1
BTS에게는 공정성 갖다대면서 왜 윤석열정부에는 윤석열을 비롯해 군대 안갔다 온 놈들이 많을까!!!,1,1,1
이따구니 비리가 생기고 특권층이 생기는거다 나하나쯤이란 생각 기준과 원칙이 흔들림 끝이다 전쟁나도 면제겠네 ㅉㅉㅉ,1,1,1
이분은 군대 갔다왔나요,0,0,0
솔직히 연예인 가던말던 관심없음 애초에 사는세계가 다른데 뭔상관,0,0,0
@유승준 유승준!!!...보고있나?,0,0,0
병력특례 다없애자...너무많다...복무기간도 짧은데,0,0,1
여자도 군대 보내야.. 옛날처럼 애낳고 키우는 여성도 급감하는데.,0,1,1
금메달 특례 당장 없애라,0,1,1
남녀평등. 특례폐지. 여성도 똑같이 군복무.군복무 완료자는  군가산점 혜택.,0,0,0
여성도 군소집하고 자녀출산 여성에게  군복문 혜택주고  특레자체을 없애야 된다 군인 줄어들고 있다.,0,1,1
뭐 축구도 그딴 상황된 마당에 이참에 다 없애라,1,0,1
이기식이 니가 두번가라~,1,1,0
아니근데 꼴랑 1년6개월도못버티냐 월급도 인제 100만원이상주고 먹여주고 재워주면 걍쳐가라,1,1,1
병역특례 없애는것이 맞다고 본다...진짜 BTS도 군대 갔는데...,0,0,1
병역특례는없애는게지금시대에는맞다,0,0,0
여성징병제  하면..형평성등  모든문제가 해결될것....최전방경계근무에  투입시켜라,0,1,0
연금으로 만족해야지 이제는 인구도 줄어가는판에 언제까지 엘리트 체육인들만 특혜 줄 순 없음,0,0,1
모병제 하면 절대 안됩니다. 모병제를 하는 대부분의 나라는 군인들의 질과 양이 저하되어 국방력에 크게 어려움이 되고 있습니다.,0,0,1
"전형적인 니들끼리 싸우냐네, 그냥 하면 되는데 일부러 bts언급해서 서로 싸우게 만드네 ㅋㅋㅋㅋㅋ 
이런 패턴 지겹다",1,1,0
다음정권은 이재명이밀어주고 여자군대보내자,0,1,1
체육특혜자 없애야한다 대한민국 남자라면 모두 군입대 시켜라 뚱뚱해도 말랐어도 키가커도 작아도 모두 입대시켜라,1,1,1
이제는 폐기해야지요! BTS도 갔는데~,0,0,1
제발 예체능 병특 없애라. 도대체 병멱면제를 포상으로 하는 게 전쟁중인 나라에서 말이 되나?,1,1,1
특히 프로야구 선수들 병역특혜 없애라 아시안게임 동네 야구에서 겨우 금메달 따고 병역면제는 누가봐도 특혜이고 비리다,1,1,1
미혼에 미출산 여성들 심지어 전세계 마른비만 1위 미취업 1위 대한민국 여성들 군대가서  돈도벌고 몸도 건강해져서 오는 방법도 있다고 생각합니다,0,1,1
당연한거 아닌가... 복무 기간도 예전 방위 수준으로 짧아졌는데...,0,0,0
"이기석병무청장님말씀에찬성합니다대한민국국민이라면모두가공평해야됨니다
개인위주이득은아니라고봅니다",0,0,0
여성징병제 당장 실시 하라...우선 자원입대라도 가능 하게 하라...ㅡ,0,1,0
"여성들도의무적으로군대가야됨니다여성사회가너무문란해졌다
애도안나을라고하고
결혼을해도이혼확률이70프로라니
정신상태가엉망입니다",1,1,1
와 근데 이와중에 사진 너무 멋있는데,0,0,0
듣기조은 기사네요^^  공정의 상징인 병역이 무너지지않길 바래봅니다,0,0,0
당연한 얘기를 깜짝 발언이란 표현을 쓰네.국민의 의무라고 법에 명시해놓고 편법으로 특혜를 주는게 누구를 위한 법이고 발상인지 묻고싶다.,0,0,0
방탄보다 유명해지면 면제해라,0,1,0
국방의 의무에 모든 국민이 참여해야지요. 신체적 결함이 없는 이상.,0,0,1
스티브유 자네가 그몸으로 특임단 같은 이런 멋진군복을 입고 복무 했더라면.. 지금 당신은 적어도 JYP급 이 상 되어있을 것이오,0,0,0
찬성.세상이 변했는데  특례없는건당연.특히 지난번 프로야구.축구등 당연히 군대갑시다,0,0,1
요즘은 여자도 드론 조정같은 부대를 만들어서 병역복무 가능함,0,0,0
국방의 의무 앞에 그 어떤것도 예외가 있어선 안된다!!! 가뜩이나 저출산에 인구도 병력도 모자라는데...,0,0,0
여자들취사병  입대해라,1,1,1
"체육인들 지들개인에게 좋은거지왜 병역을 면제해주지?
전쟁나면 체육인들 보호해줘야하냐?",0,1,1
우리나라는 아직 휴전중이지 전쟁이 끝난게아닌데 특례로 왜 군면제를 해야되는지 이러다 쟁나면 우짜지,0,1,1
"여자도 병역 의무 하자
남녀 평등 아닌가",0,1,1
맞는말 금메달 보다 bts의 국위선양이 훨씬 커다,0,0,1
