comment,SEJ_label,PEJ_label,MRJ_label
일부러 정은이 노렸구나,0,1,1
"하루라도 빨리 핵을 개발해야 우리나라 살길이다다른 방법이 없다 나중에 비참해지지 말고 핵탄두 개발
해서 보험 들어야 한다",0,1,1
가지가지하는구나  핵돼지 찢 죄앙이는 박멸 소각처리가 답이다,1,1,1
김정은대가리에 떨어지길 간절히.기도합니다.,1,1,1
죄인 죄명은 땅을 치고 슬퍼할 소식이군,0,0,1
"주석궁으로 낙하했으면, 전세계가 축하했을텐데..",0,1,1
정은이 정수리에 정확히 떨어져야하는데 ㅣ.,1,1,1
소대가리는 돼지가 무서워서 미사일이라고 못하고 미상의발사체라했지,1,1,1
기술로 보아하니 양산에 떨어질 가능성도 있네~,0,0,1
북괴군아.... 아직 멀었다.... 조금 더 연습해서 주석궁 정확하게 타격해라.....,1,1,1
자폭이냐? 불장난 하다 집 태우는 애들도 아니고 돼지는 구제가 안된다.,1,1,1
똥돼지 머리에 떨어져야 하는디...,1,1,1
주석궁에 떨어져서 통돼지 바베큐가 되기를....,1,1,1
자동 반품 탄도 미사일 ㅋ 양산 평산마을 소음 유발자에게도 배송되길 ㅋ,0,1,1
오빌로 양산 돼지 축사에 떨어지면 딱인데 정은아 담에는 잘 해 보아라,1,1,1
금수산 궁전에 떨어져라. 끝장내자 ㅋㅋㅋㅋ,1,1,1
미사일이 더불어 당사에 떨어져도 좌익들은 아무쏘리 안할듯~~,1,1,1
불장난 자주하다 뜨거운 맛을 봐야 정신차리지!,0,1,1
오폭해서  개정은 머리통에 떨어저라,1,1,1
이게 그 말로만 듣던 자폭인가,0,1,0
북 탄도 미사일 발사할때 부메랑이 되어 북돼지 머리위에 바로 내리 꽂아주면 얼마나 좋을까,1,1,1
주석궁에 떨어지면 세계적 이슈가 될건데..북한이 핵을쏴도 북한에 떨어지거나 중국에 떨어질 것임.,0,0,0
남한 국개의사당에 떨어지지 ㅋ,1,1,1
김정은 집무실로 향하길,0,1,0
이왕이면 평양궁 그것도 개정은이 집무실 부근이었으면 좋았을 것을....마이 아쉽다!!,1,1,1
핵쐈는데 자기 정수리로 떨어지면 꿀잼^^,0,1,1
정은이  개그쇼냐 ㅋㅋㅋㅋ,0,1,1
정은이 집으로 미사일 떨어졌길...,0,1,1
주석궁 정밀타격을 기원합니다,0,1,1
김정은 주석궁 아님 양산 돼멜다  안방으로 떨여져야 했다....아쉽구나  ㅎㅎ,1,1,1
평양 정밀타격한거냐 ㅋㅋ 모지리들이네 ㅋ,1,1,1
"남한도 핵무장가쟈... 경제도 나라 전쟁나면 아무 소용 없다.. 핵미사일 1천기 이상, 핵원잠 8대 이상",0,1,1
자살골이네~ 자책골이라는 표현이 낫겠다~,1,1,1
계속 쏘다가 자폭할끼다.,1,1,1
중국이나 러시아에 떨어졌으면 참 재미있었을텐데ㅎㅎ,1,1,1
악인은 제 발에 걸려 넘어져라,1,1,0
"멸공, 멸공,멸공   좌파들을 때려 잡기 위해선  멸공 과 빨강이 프레임이 최고다",1,1,1
양상 문산군은 이 기사와 중공 로켓 발사 실패 소식에 북쪽을 향해 두 번 절하고 “샤뢈이 우션입뉘돠!“라고 부르짖으며 오열합니다.,0,1,1
주사파 여적  문재인 간첩의 양산 아방궁에 미사일 한발  날려라. 국민들의  소원이다.,1,1,1
정은이 궁에 떨어지지 안했나?   그랬으면  조켔타 ~^^    ㅋㅋㅋ,0,1,1
평양 인근이었다면 또 군 관계자 몇 사람은 처형을 당하겠군. .,0,1,1
남한 국회개사당에 떨어지지,1,1,0
러시아에 다 갖다바치고 불량품만 남았나보네? ㅋㅋ,1,1,1
"추락할 시점에 맞추어 신의 지팡이 하나 떨궈주면, 쥐도 새도 모르게 없애 버릴 수 있었는데...",0,1,0
돼지가 푸틴한테 당했네,1,1,1
평양 도야지 대가리에 떨어졌다..ㅎ,1,1,1
ㅋ ㅋ ㅋ 🐖 머리위에 떨어지면 좋어련만...이기쁜 소식을 더불어 기쁘하지 않고 마음이 찢 어지게 아쁨을 느낀다면 문제 지...,0,1,1
이 소식에 더불어 안타까워 하고 있으면 문제인....,0,0,1
"꿈에, 적군이 줄지어 나타나더니... 우리 아군이 통쾌하게 물리쳤다~!!! 대한민국 넘 볼 생각, 추호도하지 마!! 이것들아!!!!!",1,1,1
김일성주의자 더러운 평화주의자 심장 폭파하라,1,1,1
러시아한테뒷통수당한거아냐?ㅋ,1,1,1
내일은 평양에서 좋은 소식이 있기를,0,0,0
우리도 쏴~ 대응 안하고 가만있으면 만만하게 보는게 현실 입니다.,0,1,0
내일 김정은 사망소식 나는거아냐?,0,1,1
쟤내는 민간인이 저런거 맞으면 위대하신 수령님이 내려주신 고귀한 불꽃이라고 하려나??,0,1,1
쌤통이다 북한돼지 좀 처리 했으면 좋겠다,1,1,1
내가 바라던 일이 진짜로 발생했네. 진정 바라면 이루어지는구나. 찢범이 갑자기 비명횡사하길 진정 바란다.,0,1,1
지나가는 개도 신경 안쓴다는...북조선 탄도미사일. 잘~~봤슴돠!!ㅎㅎㅎㅎㅎㅎㅎ~☆☆,0,1,1
정은이 머리 위로 떨어졌음 좋것네.,1,1,1
미사일을 해킹해서 북돼지 있는곳으로 안내하면 좋을텐데~ ㅎ,1,1,1
구글 실시간 위성 보면 폭파구름 안보이나,0,0,0
종북좌파가 좋아하는 기사는 성공했다는 기사가 나오는것 그이외 실패나 최고존엄을 폄훼하는 기사는 싫어함,1,1,1
미국의 사이버 교란작전 또 성공,0,0,0
북한놈들 핵미슬 잘못 쐈다간 북한이 셀프멸망 할 수도 있다는 뜻이네. 좋아. 아주 좋아.,1,1,1
다음번엔 미사일 파편이 김정은 도야지 새끼 앞마당에 떨어지기를.....,1,1,1
쓰든지 말드지 이젠 관심 없다~~,1,0,0
제네들 그냥 쏘는건지 아니면 좌표 찍고 쏘는거임.,0,1,0
평양을 노린 쿠데타 시도인가,0,0,0
김정은  머리통에  떨어져라,1,1,1
북한 오물풍선이나 보내지나 말아라. 그냥 우린 북한에 삐라에 무조건 시한폭탄을 선물할 테니까 기다려라.,1,1,1
"아쓰바~ 러시아아들이 갈켜준대로 했는데 젓됐어, 이게 메이야 동무!!!",1,1,1
그걸로 누굴 그렇게 죽일려고?,0,1,1
그래 오발해서 너희 머리에 떨어지는건 별 상관없는데 양산이나 계산동은 안된다 거긴 일반시민들도 많이거주한다 조심해라..,1,1,1
정은이한테 떨어져야되는디,1,1,1
여분 있으면 여의도에도 한발 줘라.,0,1,0
미싸일..?  이런 글귀나 말투는 전형적인 북한 ...!  조선일보는 북한의 대남  방송의 한축 ...?  조선일보야 정신 차려라..,1,1,1
평양과  용산 멀지 않은데 무당 자식 쫄았겠다,1,1,1
찍소리도 못 하는 보수 대통령 탄도 미사일을 담금주로 아시는듯. 몇년산이냐??,1,1,1
북한의 미사일 기술 발전이 어마어마 하구만~ 미국도 쫄고 있을듯~ 남한은 아는게 없으니 무서운거도 모를거고 ㅎㅎ,0,1,1
"2찍영감드라... 핵탄두를 만들려면 핵실험, 핵처리 등등을 해야하는데,, 니네집 지하에서 하면 어떨까??",0,1,1
남걱정말고 용산개머리통에 떨어지는지 살펴봐라,1,1,1
석열아  북한이 탄도 날리고 있는데 집에서 술이넘어가냐?,1,1,1
한국도 석유왕 윤석열 때문에 전쟁나면 65세이상 쉰내나는 할배할매들을 총알받이로 앞세워서 전투에 승리하자 ㅋㅋㅋㅋ 😆,1,1,1
2찍 바글바글한 영남에 좀 날려주지.. 대한민국 평균연령 확 낮추고 세금 절약될텐데...,1,1,1
용산에도 맨날 폭탄주 터뜨리는데,0,1,0
전쟁하고 싶어 안달난 갱상도랑 용산에 한방씩 넣어드려라~ 노인네들 도망치나 호미들고 싸우나 구경하고 싶네 ㅋㅋㅋㅋㅋㅋㅋㅋㅋㅋㅋㅋ,1,1,1
민주당만 조용하지 또 ㅋㅋ,0,1,1
더듬어 공산당 저거 만드는데 돈지원 백퍼 해줬을듯,1,1,1
민주당에서 또 도와주겠네,0,0,0
그랴 자꾸 헛돈만 갖다 버려라,0,1,0
정은아 그렇게호아데다가는 느그덜국민들 전부죽이게 생겼다 ㆍ적당히해라,1,1,1
대중이 노무현이  제앙이 돈준거로 대두안는 미사일 엄청쏘네 개딸 대깨들  헛소리나 찍찍하고,1,1,1
부칸아 한발은 푸틴.한발은 문재명 한테 보내봐라.정확할거다,1,1,1
스플돈도많네.죄앙이가.얼마나주어을까.좌파들북으로제발가라.,1,1,1
미사일이 북한 개정은이 사는 김일성 궁전에 떨어져 폭발했음 조컸당게여. ㅎㅎㅎ 😆,1,1,1
베이징에 떨어뜨려야지. 돈 나올데는  중국밖에 없잖아,1,1,1
"쏘면 맞기만 하면서 ""강력히 규탄한다"" 이 게 끝",0,1,1
폭죽도. 못만드는 나라가 무슨 탄도미사일을 만들겠니.공갈 협박용이고 북한은 석기시대 국가임.,1,1,1
그러다 돼지머리 아작나긋다,1,1,0
고마해라 공부좀더하고  해라,1,0,1
평화롭게 살고싶어요...,0,0,0
비정상이든 정상이든...저렇게 그냥 둬야되나?? 뭔가 당하고만 있는듯 한 느낌...,0,1,1
용산에 수십발 정일타격 부탁함! ㅋ,0,1,0
저게 더 무섭다 ㅋㅋㅋㅋ 어디 떨어질지를 모름,0,1,0
아 평양 김정은 집에 다 떨어졌어야,1,1,0
대선 공약사항 아니였나??,0,0,1
"20,30 남성 지지율 떨어지는 소리가 여기까지 들린다",1,1,1
30대 남성임. 내 인생에 두번다신 국힘 찍을일 없다.,0,0,1
건희가 숨은 보스라 내비두나,0,1,1
솔직히 대선때 윤석열 찍은 건 여가부 폐지한다고 해서 인데. 이런식으로 뒤통수 치네,0,1,0
목적 달성했다 이거지. 공약이고 나발이고 이제 나몰라라 가는거지 뭐. 애초에 기대도 안했음.,1,1,1
지키지도 못할 공약은 왜 건거냐? 거짓말쟁이 기만자,1,1,1
3년차에 당분간은 뭔 당분간 ㅋ,0,0,0
윤석렬은 벌구냐..벌리면 구라네...니가 니입으로 없앤다며...,1,1,1
공약이란게 있으나 마나~~~;;;,0,0,1
"나라 살림 못 살릴꺼면, 공약 이라도 지킵시다.",0,0,1
2찍들 하는게 그렇치 ㅋㅋㅋ,1,1,1
말만 하지 말고 실천을 해라,0,0,0
ㅋ 일베와 꼴페미의 콜라보 정권 소리 나오겠네,1,1,1
그렇게 이야기했건만 안믿더니 뒤통수 맞네.....국짐을 믿지마라..개네는 보수가 아니라 그냥 친일파집단이야....,1,1,1
2찍 일베남들 부들부들 거리는 소리가 여기까지 들린다 ㅋㅋㅋ ~~ 오늘 2찍 일베들이 임영웅도 드릉드릉 했다고 까고 있던데 ㅋㅋㅋㅋ,1,1,1
솔직히 여가부 폐지가 현 대통령을 만들었는데 왜 안 없애나?,0,1,1
2030남자들은 시위라도 하지 ㅋㅋㅋ 암것도 안함 ㅋㅋㅋ,1,1,1
여성부는 물 먹는 하마 이지,1,1,1
없애지 않을 거면 남성가족부도 만들자 ㅎㅎ,0,1,0
여가부 폐지가 정답이다,1,1,1
ㅋㅋㅋㅋㅋㅋㅋㅋㅋㅋ 이야~ 뱉은말 주워담는게 희박하네 ㅋㅋㅋ,0,0,1
여성가족부가  왜  필요 한가요?   그냥  폼으로  부처 만든거  아닌가요?  여성부 있는 나라는  우리가  유일 한데 . .,1,1,1
"무능하면 양심이라도 좀 있어라.입만 열었다 하면 거짓말, 자신이 한 말에  논란이 생기면 모두 ""날리면"" 되는 것이고.",1,1,1
저출생부도 만드는데.. 여가부는 왜 안없애냐?,1,1,1
없애고 저출산부가 흡수통합하는 방식으로 하세요. 여가부 필요없습니다. 모든 초점은 신생아에게 가야 합니다. 그 인력을 저출산부로 옮기먼 됩니다,0,1,1
이준석 하태경 기억하겠다,0,0,0
제발 페미여성가족부좀 없애버려라..진짜로..극혐이다.,1,1,1
"윤가놈은 숨 쉬는 거 빼고 제대로 하는게 도대체 뭐냐? 아, 술쳐먹는건 잘했지 ㅋㅋㅋ",1,1,1
여성이라도 여가부는 혐오할거같은데 정작 여성을 위한 정책은 제대로된걸 하지도않고 무슨 성기모양 연상하니 어쩌니 트집만 잡아서 예산쓰고,1,1,1
그럴줄 알았다 처음부터 할생각도 없었는데 표 받으려고 속인거지 그냥 망해라,1,1,1
윤고집통  공약 제대로지키는게 하나도 없네  냐려와라,1,1,1
최소한  이름 이라도  바꾸면서  하는  시늉이라도   했어야지  참나....,0,1,1
지지율 더 떡락하면 그 때 뭐 좀 한 것처럼 없애볼라고??? 너무 약은 짓 아니냐,0,1,1
ㅋㅋㅋ여가부 폐지하면 우리나라에 엄청 큰 혼란옴 차라리 국방부 폐지해,0,1,1
전세계 보는 눈이 있는데 당연히 못없애지ㅋㅋ,0,0,1
애  안 나서  나라가 망하게 생겻는데 ㅡㅡ 하늘에서  똥  떨어지는 소리하고 잇네 여성가족부 2도 신설하러 ㅡㅡㅡ,1,1,1
ㅈ팔육은 다 똑같음 나거한,1,1,0
대통령되면 폐지힌디-며? 역시 입벌구네ㅋㅋㅋ 쥴리가 반대하냐?,1,1,1
윤재앙이 ship se ki ya,1,1,1
당.분.간..? ㅋㅋㅋㅋㅋㅋㅋㅋㅋㅋㅋㅋㅋㅋ 이찍들아 니들이 찍은 정부다 악으로 깡으로 버텨라,1,1,1
취임하면 당장 없앨것처럼 하더니.....2년 넘도록 뭐 하고 있는건지...,1,0,0
이 부서가 예산이 뭐고 무슨 역할에 얼마썼는지 당장 수사하라,0,0,1
"헐,,,여성가족부 폐지공약때문에 찍었는데 ㅜ",0,0,0
표 빨리고 먹튀당했네ㅋㅋㅋㅋㅋ,1,1,1
윤석열씨 뭐하는거야? 여가부는 필요가없어,1,1,1
"어짜피, 야당에서 안된다고 할 터이니, 미리부터 머리 숙이는 것이 좋지요.",0,0,1
횡설수설 우왕좌왕 천방지축 윤두창 탄핵이 답이다.,1,1,1
멍청한 윤석렬정권.대선 1호 공약도 못 지키고 3년차에도 저렇게 우왕좌왕 하고 있네,1,1,1
ㅋㅋㅋㅋㅋㅋㅋㅋㅋㅋㅋㅋㅋㅋㅋㅋ  사기꾼 정부,1,1,1
윤석열 : 여가부폐지하겠습니다.,0,0,0
문 윤 진짜 베스트를 꼽을수없을정도로 나락을 보내버리네 나라를,0,1,1
민주당이 국회 다먹어서 정부조직법이 통과가 안됨. 없애고 싶어도 방법이 없다,0,0,1
여가부 없애려는 정부나 없애라고 뭐라하는 사람이나 수준이 낮아서 보고 있기 힘들다.,1,1,1
더듬당과 개딸들이 반대해서 어쩔수가 없네요 여성부페지 때문에 뽑은 사람들도 많은데,1,1,1
만진당에서 지들 본토에 미사일 떨어졌으니 특검 하자고 하겠네 ㅋㅋㅋㅋㅋ,1,1,1
각도조절 실패했누 빽샷으로 정은이 대가리에 직격했어야했는데,1,1,1
자살미사일인가? ㅋㅋㅋㅋ,0,1,1
굶주리는 주민들 쌀 사먹일 돈으로 미사일 만들어서 허공에 날리네 한심한 놈들...,1,1,1
제발 개정은 주석궁에 떨어졌어야 했는데. 아직도 그런 소식이 없어 아쉽네,1,1,0
몇발은 주석궁이나 북한돼지 집무실에 떨어졌어야하는디...양산개장수 맘이 찢어지겄네....미사일이 실패해서,1,1,1
ㅋㅋㅋㅋ 미사일부대 전원 총살이네,1,1,1
평양도심에 떨어졌어야하는댕 아쉽네요ㅠㅠ,0,0,1
저게 핵이었으면 도끼로 제발등 찍은꼴 ㅋㅋ,1,1,1
저걸 제지하는게 진짜 민생이다,0,0,1
주석궁 한가운데에 꼴아박았어야 했는데 아깝네,1,1,1
어디 당대표님 이게 김정은이 하는 노력인가요? 자국민 죽일려는 미사일 쏘는게? 해명좀요,1,1,1
정은이 아방궁에 떨어졌을라나,0,1,1
1발이 평양 이면 한발은 양산으로 와야지.,0,1,0
평양 인근에 떨어진건 레전드네ㅋㅋㅋㅋㅋㅋㅋㅋㅋㅋㅋㅋㅋㅋㅋㅋ,0,0,1
우리나라 정보력도 대단하다.  미사일이 추락해서 폭발하는 것을 실시간으로 관찰하고 있었네...,0,0,0
ㅈㄴ 웃기넼ㅋㅋㅋㅋㅋㅋㅋㅋㅋㅋㅋㅋㅋㅋㅋㅋㅋㅋㅋㅋㅋㅋㅋㅋㅋ,0,1,0
"말할 수 없는 비밀,,,,, 미군 미사일에 의해서 요격되었음,,,,,ㅎㅎㅎ",0,0,1
이젠 자폭하기에 이르렀군,1,1,1
아깝다 ...  보낼수 있었는데,0,0,0
평양 한복판에 떨어져도 유동인구가 적어서 아무도 안 다칠 거 같음 ㅋㅋ,0,1,1
팀킬이냐 무슨ㅋㅋㅋㅋㅋㅋㅋㅋㅋㅋㅋㅋㅋㅋㅋㅋㅋㅋㅋㅋㅋㅋㅋㅋㅋㅋㅋㅋㅋㅋㅋㅋㅋㅋㅋㅋㅋ,0,1,0
"[속보!!] 문모씨,이모씨는 지금 대성통곡 중!!",0,0,0
북진하려면 벌써 하고도 남았다..먼저 그럴 일 없으니까니...무기개발 말고 경제나 신경쓰라.,0,1,1
다음에는 용산돼지 대가리에다가 한방 날려다오!!!,1,1,1
무능한것들만 모아두고 세금낭비만 하는것들이 니넨 뭐아무것도 하지마라,1,1,1
"ㅋㅋㅋ 정부조직 간소화한다며~~전 정권 그렇게 까더니 여기가 더 많네
왜 이리저리 챙겨줄 사람이 많나보지?!",1,1,1
무능한 인간!지 맘대로 구만...나라경영을 구멍가게로 만드는 인간!,1,1,1
"아무것도 하지마라!   무능ㆍ무대책ㆍ무책임!
       유투브 말 듣고 하는 거니???",1,1,1
얼빵한 인간들 10명 있으면 뭐하나 똑바른 인간 하나면 충분한데 대통령이 얼빵하니 밑에 있는 장관들도 얼빵하내,1,1,1
뭘 새로 옥상외으로  만드냐? 있는 부처에서 해도 된다.,0,0,1
하라는건 안하고ㅋㅋㅋㅋㅋ월요일부터 개그하네ㅋ,1,0,1
국민혈세 조둑놈들 소굴 또만드네ㅋㅋㅋ,1,1,1
윤석열은 문제인이 심어놓은 첩자이다,1,1,1
집값때문에 결혼도 미루고 출산은 생각도 못하는 젊은 2030세대들에게 진정 필요한것은 부동산 50% 세일이 필요한데  혹시  아직 모르시나요~~~!!!,0,0,1
그냥 감투 자리만 계속 만드네  회의만 하고 효과도 없는 세금만 들이 붓겠지 아 삥땅도 해 먹겠구나,1,1,1
여가부 폐지 안한다매 ㅋㅋㅋ 갈라치기 계속 할건가보네 니들이 원하는 저출생 원인이 가까이 있는데도 표팔이 하는게 목적이니,1,1,1
지금도 많은데 더낳으면 먹고살거도없어,0,1,0
그러지말고 대통령급으로 하여 따로 신설하면 안될까? 추천하고 싶다.,0,0,0
결혼을 해야 아이도 낳지...결혼도 하기 힘든나라에서 무슨.. 1차적인 문제부터 해결하시고 2차문제를 바라봅시다~,0,0,1
작은정부는 물건너갔고....나가기전 맘에 드는놈  자리 하나씩 주네...뚜ㅡ라이 !!,0,1,1
"문재인때 이미 출범했어야 했다. 너무 늦었지만 지금이라도 무엇이든 하세요,",0,0,0
윤깡통 탄핵에 매우 공감하시는분 따봉눌러보세요,1,1,1
이게 될거라 본인들도 믿지 않고 국민들도 믿지 않음,0,0,0
2~30년 키워논 쌩떼같은 자식들을 길을 걷다가? 군복무하다가 사망케하는 정권이잖아?  수백명을 일시에 죽게만들어놓고 ?,1,1,1
2년넘게 놀다가 이제와서 헛소리하네 문제는 윤석열이다. 한심하다,1,1,1
나도  보수지만  포기다  에라이   내놓는정  책마다  참  누구머리서  나왔는지80년대   머리로    어찌   따라오리요,1,1,0
그냥 해 처먹을 자리 하나 더 만든거 같은 기분인데,1,1,1
니들 대가리에서 나올 해답이 아닌걸로 알고 있다,1,1,1
쥴리부터 애 셋 낳고 키워보라 해라,0,1,1
"하는일 : 저출산 홍보포스터 만들기, 여론조사 (근본적인 해결은 없음ㅉ)",1,0,1
1년만 지나면 이런 기구 있는지도 모른다 저출산 문제는 전담기관 문제가 아니다 수구 놈들 아무런 의미 없는 이름 바꾸고 기구 설립하는 거 너무 좋아한다,1,1,1
기성세대가 다이아몬드 곡괭이라 쌓아 올린 부동산을 젊은층이 나무 곡괭이로 부숴야 하는데 되것냐 ㅋ,1,1,1
부동산을 이리 만들어 놓고 출산?? ㅋㅋㅋㅋㅋㅋㅋㅋ 너희는 안 웃기냐??,1,1,1
저출산 비용으로 900조원 탕진했는데...차라리 그 역비용으로 사용해도 이미 돈은 남아돌아,0,1,1
이미 쓴 저출산 예산 300조 내놔라. 도둑놈들아,1,1,1
제발 아무것도 하지 않길... 어쩌다가 이렇게 된 것인지. 이미 벌려 놓은 일이나 수습 잘하길 간절히 바랍니다.,1,0,0
아니 탄핵이라고 짐 싸요,0,1,1
대체 여가부는 왜 안없애는 건지 모르겠다.,0,1,0
도대체 지금도 일 않으면서 무슨 위원회를 그리도 많이 신설하나요.그런 위원회 신설보다는 실질적인 소상공인.자영업자의 빚 탕감이 더 현실적이지 않나요.,0,0,1
대통령부터 애가 없는데... 대책은 무슨~~!!,0,1,1
그리고 서울대법대 or 검사출신 or 지인 꽂아놓겠지,0,1,1
출산율 높이는 건 복지정책 뿐이다 그 재원은 결국 세금인데 말로만 떠드니,0,0,0
세금 아깝다.. 있는 부처들이나 견고하게 재정 관리해ㅡ니 돈이냐? 너부터 애 낳아라 !!!!,1,1,1
"서민, 중산층에 돈 안풀리고 물가못잡으면 출산율 절대 안늘어난다.",0,0,1
개딸만 아니면 출산율은 올라가요?? 차라리 남자들보고 한국여자말고 일본여자랑 결혼하라고 하세요 출산율 급등할듯,1,1,1
세금 들어가는 위원회만 계속 만들고  출산에는 도움안되고 큰일이다 ㆍ 공무원들이 대한민국 망치고있다,1,1,1
"""저출생"" 이딴 페미가 만든 단어를 공식적으로 쓰는한 저출산 해결 절대 안된다",1,1,1
예산 빨아가는 도둑 등장이요~~ㅋㅋㅋㅋㅋㅋㅋㅋ,1,1,1
고만 좀 세금써라. 욕나오게 하네. 이민이 답이다,1,1,1
문재인은 진짜 뭐한거지? 개혁하나 없었고.,0,1,1
저출생 <= 이라는 페미기싸움용어를 쓰는시점에서 저출산 해결할 의지가없음,1,1,1
인구전략기획부 제대로 역할 하면 여성부 정말  아웃 되겠네,1,1,1
"지속적으로 자리만 만들면 뭐하나 또 다른 장,차관 자리 새로 만들면 능력도 자격도 안되는 내사람 않혀놓고 국민 혈세만 낭비할게 뻔한테",1,1,1
이 모지리 정권 도대체 언제 끝날까,1,1,1
부동산부터 잡고나서 저출산을논해야지. 1경원 퍼부어봐라. 부동산가격 안잡히면 출산율 반등은 없다 ㅋㅋㅋㅋ 두창아 알겠냐 ㅋㅋㅋ,1,1,1
집값을 잡아야 애를 낳는데 집값을 부양하면서 무슨 애를 낳으라고 하냐ㅋㅋ,0,1,1
급전땡겨 여행다니고 부실사업한다고 나라곶간 다 털어먹고 부처신설해서 자리돌려먹기까지 하려나봐?,1,1,1
출산율 반등할 때까지 4급 이상 공무원은 양심이 있으면 식대 청구하지 마라. 세금 아깝다.,1,1,1
"건전재정으로 세금은 안 걷히고...무슨 정책을 하려나..
어떤 시에서 하던 출산 장려 댄스같은거나 추려나?ㅋㅋㅋㅋㅋ",0,1,1
이미 급행열차 탔다~~^^  시골은 20년뒤에는 유령도시일거다,0,0,1
기대도안한다 쇼만할거면서 ㅋ,1,1,0
뭐라도 하는 시늉은 보기 좋은데 문제는 아무 성과 없이 새어나가는 세금,0,0,0
저출산이다. 그리고 착각하지 마. 니네가 하라면 네 하고 하는 젊은 남자들이 이젠 아냐. 뭔가를 시킬 생각이면 아예 처음부터 사업 접어,1,1,1
신설할꺼면 기존것 하나 없애고 하든지.  윤석렬 저건  없애라는건 하나도 못없애고 없던 일만들고 없던것 신설하고.  재정은 역대급으로 빵꾸내고.,1,1,1
지금와서? 지금은 늦은거 아닌가 싶은데..,0,0,0
"케겔운동 하세요~! 허이짜, 허이짜. ㅋㅋㅋ 110억짜리 국기게양대도 만들고. 어이? ㅋ",0,1,1
지금부터는 무엇을 하겠다는것 자체가 힘들지 빨리 내려오는게 좋다고 본다,0,0,1
장관이나 실무자에게도 직접 전화하셔서 강력한 리더쉽을 보여주시는 대통령님이 계신데 뭐하러 부총리급 추가하는지 의문이네.....,0,0,0
집값도 올려야 하고 출산율도 올려야 하고.. 되것냐?!!,0,1,1
공약대로 여가부 없애라...,1,1,0
ㅋㅋㅋ 뭔가 차려놓으면 다 된다는 마인드인가?????,0,1,0
ㅋㅋㅋ 뭐 자꾸 자리만 만들고 돈이나 해 쳐먹을 궁리나 하지,1,1,1
건강보험부터 바꾸세요.임산부는 건보.개인실비가 전혀되지않음.,0,0,0
인스타 금지 시키면 됨,0,0,0
거니부부 부터 출산을 ~~~~~~~~~~~~~~~누가 문제 있냐 ???,0,0,0
저출산 대책 마련 한답시고 이런 부서 만들어서 세금 낭비하고  뒤로는 임산부들 겁먹게  무통분만 유료화 시키는게  뭐하는건가요?,0,1,1
지금처럼 서울경인지역에 모든 산업 집중시키면 백약이 무효하다. 기득권들과 목숨걸고 싸울준비 해야 한국이 존립할수있다.,0,0,1
그래 봤자 예산 빼돌리기 밖에 더하겠나  이 나라는 미래가 없다,1,1,1
그동안에는 기구와 대책이 없어서 안된줄아나보네..근데 이태원 참사가 났는데 저 인간이 아직도 장관이라는게..나라가 어찌돌아가는지 안봐도 비디오다.,1,1,1
저런 구데기 인간들 자꾸 자리만들어 세금낭비할돈으로 애낳는 부부 양육비나 더 보태줘봐라..,1,1,1
해외 저출산 극복사례 확인한답시고 해외연수 겁나게 다니겠구나. 돌아가며 해외여행 다닐 명분 생겨서 아주 두근두근하겠어,1,0,0
나경원이 했었던 저출산고령화 위원회가 부총리급 아니었나. 이걸로 대체하는건가? 그런데 저거 약자가 인기부인건가?,0,0,0
부처 조직이  부족해 저 출산인가?   담당  고위직은  워킹맘으로  해야  현실적인  대책이  나온다 .정치인  교수는  제외~~,0,0,1
출산명령 하면되겠네 ㅋㅋ명령좋아하더구만,0,1,1
성남시에서 쓸데없이 저출산콘텐츠공모전 한다더라. 이런것들부터 좀 쳐잡아라,1,1,0
뭐? 초등생 야자시키고 최저임금 폐기?,1,1,0
